,author,author_flair_text,created_utc,retrieved_on,domain,full_link,id,is_reddit_media_domain,permalink,is_video,locked,num_comments,subreddit,subreddit_id,score,selftext,subreddit_subscribers,title,total_awards_received,updated_utc,removed_by,poll_data,post
193,moritak69,,2021-04-24 09:47:34,2021-04-24 09:47:45,self.wgtow,https://www.reddit.com/r/wgtow/comments/mxgrer/women_who_think_they_can_mold_their_son/,mxgrer,False,/r/wgtow/comments/mxgrer/women_who_think_they_can_mold_their_son/,False,False,43,wgtow,t5_31ux8,1,"I think it's gonna get deleted but I'm posting it here bc there are no other radfem subs (if you know any please share down below)

So I mentionned separatism amongst handmaiden (even though I knew I wan't going to convert them) and one handmaiden said ""Even if I wasn't romantically involved with men, I have a son. I'd rather spend my time raising my son to respect women than spend the rest of my life bitching with miserable banshees"".

The same boymom said she think she can ""mold"" her son. The word is actually quite telling. It made me think of the story of Pygmalion

 *Pygmalion, disgusted by the loose and shameful lives of the women of his era, decides to live alone and unmarried. With wondrous art, he creates a beautiful statue more perfect than any living woman.*  
 *The more he looks upon her, the more deeply he falls in love with her, until he wishes that she were more than a statue.*    


The statue that he molded as his perfect women (in traits and in personality) then becomes real.  
I think that women who are disapointed by the state of men and want to raise their sons into their idea of a man who respects women and as some sort of ideal romantic partner aren't as different as Marquis de Sade rewriting Pygmalion but with his daughter.  
Not that these women are as degenrate as Sade, or more recently, incels who want to groom their daughters into becoming sex slaves. But the instrumantalization of children and the incesty element is there. I definitely think adults project their fantasies onto children. (Which is why I am a firm believer it's okay to disapoint your parents lol.)  
Terri Strange has an excellent video abt mothers of sons where she says mothers have a romantic attachement to their sons, and she cited the exemple of Amy Schumen who was shocked she got along with her mother in law bc she always felt like she was treated as a sexual competition by the mothers of her former boyfriends.  
I understand that patriarchy creates this structure where women feel their role in a man's life (mother, wife or girlfriend) is their entire identity. Which explains why they feel any criticism twrds men is a personal attack.",6933,"Women who think they can ""mold"" their son",0,,,,0
194,ASCIITable,,2021-04-24 04:57:50,2021-04-24 04:58:01,self.wgtow,https://www.reddit.com/r/wgtow/comments/mxd06w/hi/,mxd06w,False,/r/wgtow/comments/mxd06w/hi/,False,False,1,wgtow,t5_31ux8,1,"I like you guys 'cause instead of doing the cringe 'tHiS gRoUp BaD' in the *other* version of you guys y'all are just talmbout agency and just happen to be women

the *other* subreddit could learn

&amp;#x200B;

also nice member count",6934,hi,0,,,,0
195,ASCIITable,,2021-04-24 04:48:55,2021-04-24 04:49:05,self.wgtow,https://www.reddit.com/r/wgtow/comments/mxcvy6/hi/,mxcvy6,False,/r/wgtow/comments/mxcvy6/hi/,False,False,0,wgtow,t5_31ux8,1,"you guys dont look as toxic as the dating strategy one or the men one

whats up",6934,hi,0,,,,0
199,zetateta,,2021-04-22 23:03:05,2021-04-22 23:03:17,self.wgtow,https://www.reddit.com/r/wgtow/comments/mwhb1x/career_ar_late_age/,mwhb1x,False,/r/wgtow/comments/mwhb1x/career_ar_late_age/,False,False,40,wgtow,t5_31ux8,1,"Hi! I am 25 and I feel bad that I don't have a good job career etc. After gratuating from school I switched my studies for a couple of times. I have worked as a shop asistent, game-presenter, waitress etc. Now I study again  and I have finished half of it but I am going to take academic year (this time I want to continue so I will work and save some money untill that). I know it is my fault only that I didn't make right decisions from the very beginning. I just wonder how to not fail in the future and did you also struggle with it? Have you also switched a lot till you succeed?",6926,Career ar late age,0,,,,0
200,Keith_Ackerman12,,2021-04-22 13:39:10,2021-04-22 13:39:20,self.wgtow,https://www.reddit.com/r/wgtow/comments/mw4yas/how_do_you_cope_with_the_idea_of_being_alone/,mw4yas,False,/r/wgtow/comments/mw4yas/how_do_you_cope_with_the_idea_of_being_alone/,False,False,46,wgtow,t5_31ux8,1,"I’m 18F ever since I was  11 I decided I didn’t want to marry seeing how the community I belonged to treated women and a lot of these married women seemed depressed including my own mother who I really love and cherish even though we had our own heated debates because my mother leans more towards the traditional and conservative side. But now I am having conflicting views a part of me wants to have children and a husband another part of me wants to be single forever and enjoy life, but there’s also this fear of dying alone how do you guys cope with it.",6925,How do you cope with the idea of being alone forever?,0,,,,0
205,ThrwAwayMarshmallow,,2021-04-21 17:41:04,2021-04-21 17:41:15,self.wgtow,https://www.reddit.com/r/wgtow/comments/mvl0vv/need_to_get_this_off_my_chest/,mvl0vv,False,/r/wgtow/comments/mvl0vv/need_to_get_this_off_my_chest/,False,False,15,wgtow,t5_31ux8,1,"I dated a lot in my teens, 20s, and early 30s.  And I'm going to be specific in which men I talk about.  But for the majority of people I've dated, the only thing they're good for (at best) is being a sperm donor.

I don't know if I'll be wgtow forever.  My dad and a few of my male friends are great.  But when I have tried to date, the people who I've dated dropped the ball in the biggest ways.  In that, they couldn't even do simple things like pick a restaurant, show up on time, or be there for me if I got sick.  At the very least, I've made it a rule that I will not under any circumstances date anyone from the state I live in.

I'm thinking of moving to a state that's drier, sunnier, and doesn't have the constant drizzle I deal with here.  If I'm going to be alone for the rest of my life, I might as well spend that time in sunny weather and a cactus farm.  I feel way less alone by myself in the desert than I do where I am.",6918,Need to get this off my chest,0,,,,0
207,Shadowgirl7,,2021-04-21 09:28:31,2021-04-21 09:28:42,self.wgtow,https://www.reddit.com/r/wgtow/comments/mvby56/what_made_you_be_wgtow_and_what_is_your_life_plan/,mvby56,False,/r/wgtow/comments/mvby56/what_made_you_be_wgtow_and_what_is_your_life_plan/,False,False,77,wgtow,t5_31ux8,1,"Basically a two part question.

The mainstream life plan for women is get a husband, get a house together, have kids, either after college or in some cases, it's not even advised for women to go to college. In the US I think most people, even women who want to be homemakers, go to college. In my country and other countries I don't think it's that common. I am the first of my family to ever go to college and my family never stimulated me to do so, they thought it was a waste of time and I am sure they'd be happier if I had had kids instead in my 20s. 

I am curious to know what is the life plan of women who decided to go their way and what made you decide that.

For me, I was bullied as a kid by guys due to my looks which caused me depression later in life (still struggling though now it's controlled and no longer suicidal), have an extremely annoying and bad father figure (not abusive, but basically a man child) and had a lot of bad previous experiences with guys. I wasn't sexually assaulted but I just have a low tolerance for dishonesty and I think to be in a relationship you have to accept certain things that I don't want to accept. I am not actively looking for a relationship anymore, if one appears we'll see, but I highly doubt. I'd rather be alone than to settle for crap/abbuse. I was never in a relationship (only two long distance ones, which I'd rather not have been), I lost my virginity in a short fling and since then didn't have any sexual partner, because well, I didn't meet anyone who I am attracted to and who is attracted to me enough for that. I do go to a lot of events and meet a lot of people (not now due to pandemic), I have no trouble meeting guys, so it's not like I am not putting myself out there like they say, but I just never met anyone interesting. 

My life goal is to be able to own a house alone. Ideally it would be a house with garden to have pets, not sure if that will be possible due to housing prices. I am anti-work and anti-corporate so I'd like to make enough so that then later in life I can not work or only work part time to have time to travel or study some social science or even do a PhD in something useful for society.",6913,What made you be WGTOW and what is your life plan?,0,,,,0
208,throwaway_38585,,2021-04-21 05:58:48,2021-04-21 05:58:59,self.wgtow,https://www.reddit.com/r/wgtow/comments/mv9egj/moving_on_from_past_resentments/,mv9egj,False,/r/wgtow/comments/mv9egj/moving_on_from_past_resentments/,False,False,8,wgtow,t5_31ux8,1,"Resentment towards men in my past has been a major struggle for me, as well as resentment towards myself for how I handled the situation at the time. There's one instance I have a hard time moving on from and any insight is appreciated.

A few years ago I had a close male friend who ended up becoming a roommate. We were super close and hung out daily, traveled together etc. I'm sure he had a crush on me and I maybe would have been interested except he was pornsick as hell and left his pornhub history on his computer literally every single day (yuck, I know). I've changed so much since then and would never hang out with a pornsick male now but this is just some background for you.

One day when I was changing I caught him taking a picture of me with his phone. I had nothing on but a thong. I turn around and see him with his phone *blatantly* lifted up and pointed right at me, and he immediately and nervously pulls it away when he knows I've seen him. I froze with fear and said nothing which I *majorly* regret. But keep in mind we lived under the same roof, I did not want to lose my place to live. 

I acted bitchy to him after that and eventually moved out without confronting him about what's going on. I've actually ran into him at a few events since then and since it was not an appropriate time to bring up the situation I was cordial but I still wish I had gone off on him.  

I just needed to let that out, I absolutely hate this guy and almost want to confront him about it even years later despite knowing he will deny it and it will probably not blow over well.",6912,Moving on from past resentment(s)?,0,,,,0
213,Environmental_Bread7,WGTOW mod ✨,2021-04-19 14:20:15,2021-04-19 14:20:26,self.wgtow,https://www.reddit.com/r/wgtow/comments/mu1mmu/monday_suggestions_day/,mu1mmu,False,/r/wgtow/comments/mu1mmu/monday_suggestions_day/,False,False,4,wgtow,t5_31ux8,1,"Welcome to Suggestion Monday! Mondays are for suggesting new ideas to help our sub grow and thrive!

Please post your suggestions below.",6909,Monday: Suggestions day!,0,,,,0
215,throwaway_38585,,2021-04-19 03:26:37,2021-04-19 03:26:47,self.wgtow,https://www.reddit.com/r/wgtow/comments/mts3p0/ovarit_invite_code/,mts3p0,False,/r/wgtow/comments/mts3p0/ovarit_invite_code/,False,False,6,wgtow,t5_31ux8,1,"If anyone has an ovarit invite code they would be so kind as to bless me with, I would very much appreciate it. I have been lurking their site for months yet unable to contribute due to not having an invite code. Feel free to check out my post history to confirm I'm not a man or a troll.",6907,Ovarit invite code?,0,,,,0
218,kiramekki,,2021-04-18 21:05:17,2021-04-18 21:05:27,self.wgtow,https://www.reddit.com/r/wgtow/comments/mtlhe4/would_appreciate_any_advice_for_my_moms_situation/,mtlhe4,False,/r/wgtow/comments/mtlhe4/would_appreciate_any_advice_for_my_moms_situation/,False,False,3,wgtow,t5_31ux8,1,"Hi all,

I hope it’s alright I post here. I am concerned about my mom and I feel I can’t give her enough of the advice she needs as I am 25 and haven’t lived through her experiences as she has. I’m looking for outside ideas and advice. Long story short, she has had a really challenging life. She raised my brother and I alone. She’s had 3 husbands die, 2 in front of her, and she immigrated to the US from Mexico about 20 years ago with me. She doesn’t have a steady career, but does enjoy, and is quite good at being a hairstylist. She’s moved her entire life several times for different people and her overall sentiment is: I’m just tired. She’s been with her new fiancé about 3 years, 2 at a distance and 1 living together. I have lived with them for some months now and can say they have a really hard time communicating well. TLDR; she’s not happy but is at the same time “comfortable” for the first time in a long time- no money troubles, not having to work in a toxic work environment (her previous salon), and living in the nicest home she’s lived in yet. She feels stuck, like she can’t be herself around him, like he’s too controlling, and at the expense of a comfortable lifestyle. She’s really strong but she’s just so tired. I can’t tell her, you got this! Just leave him. Go back to work for low pay and deal with rude people,go back to a Shitty apartment....I am trying to encourage her that should she choose to leave it can be better than before. I’m wondering if anyone knows of WGTOW groups for women over 50 looking for roommates? She’s be living in San Antonio, Texas. She’s currently in the middle of nowhere, because her fiancé lives in the middle of nowhere. Ofc couples conseling and such is being discussed but I know there has to be a good option. The lack of being close to her network in San Antonio also doesn’t help the situation. I am leaving in a couple months to go work in Asia, so that’s also going to make it extremely hard for her. She’s my best friend and once I’m making more money I absolutely intend to help her should she choose to leave. I can help her apply to nicer high end salons where the environment is much nicer to be in. I really want to help her, If she went to church or a hobby group she could meet women her age or a roommate. If anyone has any ideas I would appreciate a comment so so much! I just know there’s resources I don’t know exist or groups. 

TYIA",6900,Would appreciate any advice for my mom’s situation!,0,,,,0
219,throwaway_38585,,2021-04-18 18:23:43,2021-04-18 18:23:56,self.wgtow,https://www.reddit.com/r/wgtow/comments/mtibve/great_men_in_history_cheating_on_their_wives/,mtibve,False,/r/wgtow/comments/mtibve/great_men_in_history_cheating_on_their_wives/,False,False,19,wgtow,t5_31ux8,2,"I just need to vent about this because it really pisses me off. There are a lot of men who are highly respected throughout history, many of which I admired and then I later found out they were adulterers (and/or were openly very sexist). JFK, Carl Jung, Alan Watts, and MLK all cheated on their wives (many times in fact). Aristotle, Kant and Plato were openly sexist and said women are inferior. Yet these are men society loves and worships. There are more examples obviously but this is enough to make my point.

Typically the justification is that they are only human, it doesn't discredit the great things they did etc and I get that. Everybody has flaws. That's not why it's annoying. It's annoying because the pattern here isn't that they made mistakes, it's that they are *shitty to women*. And society just writes it off. Would we write it off as quickly if the pattern had been child abuse or theft? Would we write it off as quickly if one of them had abandoned their pet and left it at the side of the road?

I also see that one can be immoral in behavior yet brilliant in mind. But I just needed to vent about this because it really irritates me. It seems like any men in history whose work I enjoy or are seemingly admirable turn out to have been shitty to women in some way.",6899,"""Great"" men in history cheating on their wives",0,,,,0
222,goldthefo,,2021-04-16 22:15:47,2021-04-16 22:16:09,self.wgtow,https://www.reddit.com/r/wgtow/comments/msdvum/is_vindicta_or_glowup_based_pages_just_cope_and/,msdvum,False,/r/wgtow/comments/msdvum/is_vindicta_or_glowup_based_pages_just_cope_and/,False,False,15,wgtow,t5_31ux8,1,"Hey everyone,

I've had issues all my life with wanting validation from men especially when it comes to them praising me. I've never felt beautiful because of them. It got to the point where I starved myself to be underweight just to be seen by them. Now I'm back at a heavier weight and unhealthier. 

Present day I am constantly struggling not to care what men think of me. And not care if they treat me less than human because I'm not the pretty one in the friend group. 

But when I see vindicta pages or beauty pages it makes me yearn to be more and more beautiful. They say on those pages it's used to get ahead in life and take advantage of men. But isn't it still all based off of what men want in their narrow views of beauty?",6878,Is Vindicta or glowup based pages just cope and for the use of male validation?,0,,,,0
227,moritak69,,2021-05-16 21:21:59,2021-05-16 21:22:10,self.wgtow,https://www.reddit.com/r/wgtow/comments/ndyb8d/is_bell_hooks_a_radical_feminist/,ndyb8d,False,/r/wgtow/comments/ndyb8d/is_bell_hooks_a_radical_feminist/,False,False,9,wgtow,t5_31ux8,1,"I read her essay on Lemonade and From Margin to center. She leans more twds liberal feminism.  
 I was surprised she considers herself radical.",7206,is Bell Hooks a radical feminist?,0,,,,1
228,Itchy_Arachnid8131,,2021-05-16 13:30:58,2021-05-16 13:31:09,self.wgtow,https://www.reddit.com/r/wgtow/comments/ndoe2y/what_do_you_enjoy_best_about_going_your_own_way/,ndoe2y,False,/r/wgtow/comments/ndoe2y/what_do_you_enjoy_best_about_going_your_own_way/,False,False,43,wgtow,t5_31ux8,1,"For myself I can say I feel a lot more secure and confident within myself. I'm a lesbians may find a partner in time, but I spent years following heteronormative ideals and thinking I needed to date men because it's what I 'should do'. I ended up in many abusive and bad relationships and regret it instead of following my own heart. I also don't feel the need to impress men anymore and don't care whether they find me attractive or not. What has everyone else found brings you joy and happiness in going your own way?",7203,What do you enjoy best about going your own way?,0,,,,1
232,Shadowgirl7,,2021-05-15 01:14:31,2021-05-15 01:14:43,self.wgtow,https://www.reddit.com/r/wgtow/comments/ncnp7q/how_the_fuck_did_i_become_a_wgtow/,ncnp7q,False,/r/wgtow/comments/ncnp7q/how_the_fuck_did_i_become_a_wgtow/,False,False,39,wgtow,t5_31ux8,1,"Like seriously...

I come from a western country but still a bit conservative and I grew in a rural area so traditions are very much engrained. My grandmother was a homemaker (she did work but then retired early), I was raised being told the importance of being a homemaker, cleaning the house, cooking. My mom still tries to put me down saying I am not good at those things (except for cooking I am frankly better than she is at everything, and even cooking if I stop being lazy I can do much better than she does, but ok). I am the first one from my extended family to ever go to college, honestly the only educated people I met in my life were my teachers at school.

I was bullyed throughtout my childhood due to my looks mostly by guys. I spent my teen years with so much body issues, depression and anxiety. I craved so much male attention yet I thought I was so ugly no man would ever look at me. When I finally started exploring the dating world (only when I was 23-24) I had such a low self esteem. I remember being so worried about getting to know the guy, what he wants sexually, because I wanted to be a cool girl that would treat him so well, not like those bitchy women. I felt unworthy when an handsome guy liked me and felt I needed to try to do the right stuff and try extra hard to please him.

Now I sometimes read some reddits posts from the subreddits I used to go and...something changed. When a guy says I want X, Y, Z I no longer feel inferior for not having all what he asks. I just think he is full of shit and are happy I don't have to put up with that crap lol.

I still have some troubles saying no and feel guilty when I turn down a guy. I can't help but have those annoying thoughts in the back of my head saying I am not that good so I shouldn't be as picky otherwise I'll end up alone and some day I'll regret it... Problem is, this fear is no longer enough to make me want to give my freedom to tolerate bullshit.

Sometimes my body issues come back, but then I am like... ""who cares?"". I just been finding some very cute plus sized models on instagram. Today I found one who filmed a tiktok video with a guy asking her to rate herself in a scale of 1 to 10 and she was like, with no doubt ""I am a 10"" and the guy kept trying to put her down questioning her ""are you sure? to be a 10 you need to be flawless"" and she was like ""yap I am a 10"" with so much confidence. According to her, it pissed a lot of dudes on tiktok. But I just loved it! and also her body shape is similar to mine and when I was younger I would never image I'd see someone with a body similar to mine being a model...

I used to feel inferior due to my lack of sexual and relationship experience, now, since my last failed crush, not even that bothers me that much anymore. I feel like if I meet someone and that's an issue for that person, than that person should go see a shrink and get the fuck out of my life, because I don't have a problem with it so neither should he LOL I am a bit worried if this is repressed emotions or something and will blow out later. Not sure. But I just don't feel a lot of drive to pursue those things as much as before.

I am sure I am still damaged and have a lot of emotional traumas, but I think I was able to grow some self esteem thanks to communities like this one and others that I found along the way. Definetely without the Internet and the digital age I wouldn't have evolved because I wouldn't know there's other people like me out there and that I am valid.",7198,How the fuck did I become a wgtow?,0,,,,1
236,gruuvi,,2021-05-14 18:08:05,2021-05-14 18:08:16,self.wgtow,https://www.reddit.com/r/wgtow/comments/ncezx5/i_think_im_becoming_eccentric_and_i_like_it/,ncezx5,False,/r/wgtow/comments/ncezx5/i_think_im_becoming_eccentric_and_i_like_it/,False,False,8,wgtow,t5_31ux8,1,"I was thinking about this yesterday as I was washing my clothes in my bathtub. This is a habit I've embraced since the pandemic started. I didn't want to go to the laundromat and now I find washing my own clothes MUCH simpler! I also started trimming my own hair... and now I can't imagine spending $100 for something that takes me 5 minutes top. Add to that I'm childfree and single and happy about it and so I thought ""Is this what being eccentric means? Cuz uh.. it's pretty cool!"" My life is becoming simpler and more peaceful and I used to feel like finding a relationship was what I needed to be truly happy. And yet right now I am feeling more content than I ever have! If this is what eccentric looks like, sign me up! I'm embracing the ""weird"" and yet it feels so right.",7196,"I think I'm becoming ""eccentric"" and I like it!",0,,,,1
241,moritak69,,2021-05-13 11:08:44,2021-05-13 11:08:54,self.wgtow,https://www.reddit.com/r/wgtow/comments/nbe3jz/arguments_commonly_used_to_ridicule_wgtow_and/,nbe3jz,False,/r/wgtow/comments/nbe3jz/arguments_commonly_used_to_ridicule_wgtow_and/,False,False,8,wgtow,t5_31ux8,1,"I find it interesting that as soon as a woman says she doesn't want to bother with men, people just assume she ""becomes"" a lesbian. I hear people say that a lot. They just can't conceive of not having a sexual or romantic relationship. As if single and celibate people didn't exist (??) regardless of their orientation. Our culture is always so centered on romance. Even words like ""intimacy"" get attached to sex. You can be intimate with someone (friendships) wo having sex. Just like you can have sex with someone wo being intimate. Hopefully normalizing romantic frienships will change that. I think marriages btw best friends are a good idea.  
Not to mention they say that *damaged* women become lesbians. In a way of conveying the message that heterosexuality is the norm and that lesbians are deviants, who become that way due to trauma. It's a way of pathologizing lesbianism. The same argument is used for asexuality, that they become that way because they had sexual trauma and need help.",7176,Arguments commonly used to ridicule wgtow and separatists,0,,,,1
