,author,author_flair_text,created_utc,retrieved_on,domain,full_link,id,is_reddit_media_domain,permalink,is_video,locked,num_comments,subreddit,subreddit_id,score,selftext,subreddit_subscribers,title,total_awards_received,updated_utc,removed_by,poll_data,post
138,moritak69,,2021-04-07 14:04:48,2021-04-07 14:04:59,self.wgtow,https://www.reddit.com/r/wgtow/comments/mm2tm0/do_yall_think_women_who_love_and_worship_men_are/,mm2tm0,False,/r/wgtow/comments/mm2tm0/do_yall_think_women_who_love_and_worship_men_are/,False,False,41,wgtow,t5_31ux8,1,The title.,6799,Do yall think women who love and worship men are the obstacle for liberation,0,,,,0
140,LadyoftheLizards,,2021-04-07 09:22:24,2021-04-07 09:22:34,self.wgtow,https://www.reddit.com/r/wgtow/comments/mly8on/how_to_reject/,mly8on,False,/r/wgtow/comments/mly8on/how_to_reject/,False,False,9,wgtow,t5_31ux8,1,"We first met when we were being shipped off to the military. When I was discharged he called me a few months later and said he was discharged for some sort of testosterone issue. I haven't really talked to him because I was busy trying to get a job, apartment, and registering for online classes. Now recently he's had called me again and texted me that he still wants to date me. He seems nice. But I don't like the risk that comes in relationships. I don't know how to tell him this.",6799,How to reject?,0,,,,0
144,Environmental_Bread7,WGTOW mod ✨,2021-04-05 14:20:19,2021-04-05 14:21:09,self.wgtow,https://www.reddit.com/r/wgtow/comments/mklsm1/monday_suggestions_day/,mklsm1,False,/r/wgtow/comments/mklsm1/monday_suggestions_day/,False,False,0,wgtow,t5_31ux8,1,"Welcome to Suggestion Monday! Mondays are for suggesting new ideas to help our sub grow and thrive!

Please post your suggestions below.",6788,Monday: Suggestions day!,0,,,,0
146,Schelanegra,wgtow golden girl,2021-04-04 18:45:13,2021-04-04 19:33:27,self.wgtow,https://www.reddit.com/r/wgtow/comments/mk25un/what_are_your_practical_life_rules_for_women/,mk25un,False,/r/wgtow/comments/mk25un/what_are_your_practical_life_rules_for_women/,False,False,24,wgtow,t5_31ux8,2,"The women on the subreddit presumably don’t date men but we are women with sisters, friends, mothers and even daughters who do. What are some life rules you’ve learnt that you want other women to know that will make their lives easier? This could also about how to live a good life and your answers don’t have to be about relationships.",6783,What are your practical life rules for women?,0,,,,0
147,basketcase789,,2021-04-04 17:21:00,2021-04-04 17:49:16,self.wgtow,https://www.reddit.com/r/wgtow/comments/mk0jcc/what_are_those_of_us_who_dont_prioritize/,mk0jcc,False,/r/wgtow/comments/mk0jcc/what_are_those_of_us_who_dont_prioritize/,False,False,29,wgtow,t5_31ux8,1,"It feels a lot like women have two options in a capitalist society: either become a mother and/or excel in your career. Neither of these options are appealing to me because I don't enjoy ""earning a living"" when I literally need a job just to survive. And becoming a mother doesn't appeal to me for obvious reasons. What sort of things are left for me to spend my life doing? I'm not sure if there is any advice, but I wanted to vent a little. I know hobbies can be important, but I feel like I can't really pursue hobbies because my life revolves around making enough income that I'm not homeless/starving, and my hobbies always inevitably fall to the wayside.",6783,What are those of us who don't prioritize family/kids OR a career supposed to do?,0,,,,0
149,Sweetlikecream,,2021-04-04 10:59:22,2021-04-04 10:59:32,self.wgtow,https://www.reddit.com/r/wgtow/comments/mju45x/how_to_deal_with_a_mother_that_is_obsessed_with/,mju45x,False,/r/wgtow/comments/mju45x/how_to_deal_with_a_mother_that_is_obsessed_with/,False,False,18,wgtow,t5_31ux8,1,"I'm an almost 23 year old women and my Mother always brings up relationships, love, marriage etc.

I have only been identifying as a wgtow for about less than a month now, but hear me, this us the happiest and care-free I've felt in ages! I love not thinking about relationships or romantic desires, and it is like a weight has been lifted from my shoulders. When I thought about relationships and dating I was always stressed out because the outcomes were never what I wanted. Now? I'm so happy that I don't have to think about this anymore.

Anyway, I digress. My mother is obsessed with me finding love and relationships, and having children. I definitely don't want my own kids I know that for sure. I might adopt in my mid 30s though. She's always bringing up me finding a husband, children etc. And it drives me mad! It's partly why I want to move out, so I don't have to hear her yapping about it all the time. Funny thing is, she's single and I don't think she even wants to marry or find a relationship. Yet she places all that burden on me? SMH.

Does anyone else deal with this? How do you function having a Mother that thinks a husband ""is a gift""",6782,How to deal with a Mother that is obsessed with me finding a relationship?,0,,,,0
152,mathquestions88,,2021-04-03 21:50:05,2021-04-03 21:52:38,self.wgtow,https://www.reddit.com/r/wgtow/comments/mji4j5/any_spiritually_sensitive_orwitcheswiccans_and/,mji4j5,False,/r/wgtow/comments/mji4j5/any_spiritually_sensitive_orwitcheswiccans_and/,False,False,17,wgtow,t5_31ux8,1,"If you have an innate gift of being spiritually sensitive, know things ahead of time, or  can see beyond this world .... can you also feel what kind of spiritual energy is around most men? Because in my experience they have very dark energies attached to them. Every single time I tried dating I was taken aback by the  spiritual feedback that would attack me later that  night just by dating these dudes.Coercive, destructive, demonic spiritual forces that would visit and try to intimidate me and my family or be sexually inappropriate, climbing in top of me,succubus/incubus  activity ect.

 A lot of them have parasitic entities feeding and driving them to do weird oppressive things to others, specially to women. i have had poltergeist type of activity in my room manifest after pissing off or letting down certain men who were into the MAGICK arts. 

When I'm not dating, nothing happens out of the ordinary but begin once again I talk to them.I have seen objects being levitated in mid air and thrown around the room violently, occult symbols cut and drawn into my legs as I asleep, powerful paranormal phenomena just come out of nowhere just because I said something he didn't like, and after some further investigation of the man in question I have found several of his social media to be a member of several magick practicing circles...which angers me because THESE DUDES ARE USING VOLATILE UNKNOWN POWER MAGICK GUIDES... NOW EASILY ACCESSIBLE IN THE INTERNET, TO MANIPULATE, BEND WOMEN TO THEIR WILL (SPECIALLY FOR SEX AND POWER TRIPS) and if it doesn't work I guess he could mess with her head either way as ""retribution""

yet a lot of them are not actual male witches but still have powerful angry demonic energies manipulating them, anyone else seen this?",6778,Any spiritually sensitive or/witches/wiccans and psychic women here always feels this dark and oppressive energy around a lot of men?,0,,,,0
153,Mella_20,,2021-04-03 13:33:56,2021-04-03 13:34:06,self.wgtow,https://www.reddit.com/r/wgtow/comments/mj8lii/im_put_off_by_the_forever_aspect_of_romance/,mj8lii,False,/r/wgtow/comments/mj8lii/im_put_off_by_the_forever_aspect_of_romance/,False,False,24,wgtow,t5_31ux8,1,"It's kinda hard to put in words what I'm thinking but I'll try my best.

I feel like when most people get in a relationship, get married and have kids, they forget their mortality. One of the reasons I want to go my own way from men and romance in general is because nothing lasts forever. I'm more comfortable accepting the people around me as temporary, because I'm also temporary. 

I often think about the idea of romance as a social construct and wonder if it was a big mistake. It just doesn't seem to work out for most people. Its a kind of ""love"" that causes so much pain in people's lives. We give so much power to another person to stomp on our hearts. And if it ends, either by death or break up, you're left with questions of ""what was it all for?"", that you don't have in other losses (I can't speak for everyone), because you invested so much time and energy in this ""forever"" relationship.

 I'm comfortable with my relationship with my family and friends as well as idea of getting a pet in the future. I acknowledge that people come and go. But when you get in a relationship, especially when you grew up with romantic movies where the cameras cut after they get married, you assume your relationship will be ""forever"". So you make a lot of forever decisions like having kids with that person, as well as investing a lot of time and energy with the assumption that nature will treat you kindly.

I just can't live this way. No matter how attractive the idea of romance is. I feel like the price is too high, as well as the risk. I feel like with friends, since you're not putting all your eggs in one basket, so to speak. It would be nice to have someone to be affectionate with and whatever, but it really puts me off how there are so many variables. I just don't think romantic relationships are a good investment.

But this is coming from a non-religious person. Depending on what meaning you make of life, your perspective will be different.",6759,"I'm put off by the ""forever"" aspect of romance",0,,,,0
155,Ok-Platform-892,,2021-04-02 22:41:49,2021-04-02 22:42:41,self.wgtow,https://www.reddit.com/r/wgtow/comments/mivkm5/good_start_to_a_great_series/,mivkm5,False,/r/wgtow/comments/mivkm5/good_start_to_a_great_series/,False,False,0,wgtow,t5_31ux8,1,"https://youtu.be/me60gWzbMXw

This is a great start to amazing series to help debunk myths of ""safety"" equipment so we women can the truly dangerous equipment to protect ourselves. Check out her Facebook too",6757,Good start to a great series,0,,,,0
157,urination_sensation,,2021-04-02 09:53:29,2021-04-02 09:53:39,self.wgtow,https://www.reddit.com/r/wgtow/comments/mih3de/giving_up_on_the_woman_i_considered_close_to_me/,mih3de,False,/r/wgtow/comments/mih3de/giving_up_on_the_woman_i_considered_close_to_me/,False,False,7,wgtow,t5_31ux8,1,"god, this is difficult for me to type. i’m consumed by just sadness and so much of anger and negative feelings. 

we have a long standing history of violence in my familial line. i don’t know what went wrong, and you can probably figure what the common denominator is across all the perpetrators of such violence is. from emotional to physical to sexual, i’ve faced my fair share and i struggle with a lot of mental problems as a result of all of that.

regardless, the only person who i felt would understand and care after the fact was my mother, but no. she still makes excuses for the abusers and says that ‘they feel misunderstood/powerless and just need someone to protect their future’ or ‘they did it because they were frustrated’. i gave up on my father a long time ago. i absolutely hate him. he’s spineless and would rather jump the gun to defend the horrible scum. but to just lose a caring mother and be all alone feels like hell.

do you ladies have similar experiences? i’m torn. on one hand, i don’t want to give up on her at all, but on the other, i feel it would be in my best interest to withdraw myself from her life, and vice versa.",6754,giving up on the woman i considered close to me,0,,,,0
161,level_up_always,,2021-03-31 22:12:55,2021-03-31 22:13:06,self.wgtow,https://www.reddit.com/r/wgtow/comments/mhh3h8/making_wgtowwomyns_lands_dreams_come_true_in_a/,mhh3h8,False,/r/wgtow/comments/mhh3h8/making_wgtowwomyns_lands_dreams_come_true_in_a/,False,False,20,wgtow,t5_31ux8,1,"So because of my financial situation I'm back living with family. An rv is going in on the property so that I can have my own space while I get my shit together. The silver lining of this is that I can start working on my dream of making things more of a compound here eventually. Bc of the zoning laws here you can have a house/rv etc per x amount of acres making it possible to have 5 including the main house given the size of the land. My sis may get a double wide if she moves back so she can save money too. That leaves two other potential units in the future. It will take years I'm sure but it would be awesome to either add more double wides, or tiny houses and then rent them to women in similar situations. 

I like this idea better than the commune type womyn's lands because I don't really want to do that whole situation to the extreme that they do although I do want to be self sufficient as much as possible and then I can be in direct control of vetting and such. Wanted to share this for other people who may have this type of opportunity or are thinking about it in the future. Just have to make sure you check the zoning laws in your given area and then learn a little about what it would take to add more houses the main issue is septic and such probably going to add another septic system although there are also greener more self contained ways to do things as well.

Anyone doing this already or have plans to in the future?",6747,Making wgtow/womyn's lands dreams come true in a pragmatic way and encouraging others to do the same,0,,,,0
164,Sweetlikecream,,2021-03-30 17:45:44,2021-03-30 17:45:55,self.wgtow,https://www.reddit.com/r/wgtow/comments/mgln8d/why_isnt_this_sub_much_bigger_than_it_is/,mgln8d,False,/r/wgtow/comments/mgln8d/why_isnt_this_sub_much_bigger_than_it_is/,False,False,92,wgtow,t5_31ux8,1,"Women have more reasons to be single as statistically men benefit from marriage and relationships, compared to women. So why aren't there more of us?",6745,Why isn't this sub much bigger than it is?,0,,,,0
165,Sweetlikecream,,2021-03-30 17:06:03,2021-03-30 17:06:14,self.wgtow,https://www.reddit.com/r/wgtow/comments/mgkrnd/why_is_this_sub_much_smaller_than_mgtow/,mgkrnd,False,/r/wgtow/comments/mgkrnd/why_is_this_sub_much_smaller_than_mgtow/,False,False,1,wgtow,t5_31ux8,1,"Women have more reasons to be single as statistically men benefit from marriage and relationships, compared to women. So why aren't there more of us?",6745,Why is this sub much smaller than MGTOW?,0,,,,0
166,Maiden_of_Sorrow,,2021-03-30 16:47:44,2021-03-30 16:47:54,self.wgtow,https://www.reddit.com/r/wgtow/comments/mgkcq0/encouraging_movies_for_women_going_their_own_way/,mgkcq0,False,/r/wgtow/comments/mgkcq0/encouraging_movies_for_women_going_their_own_way/,False,False,17,wgtow,t5_31ux8,1,"Are there movies that give you strength to go your own way?
 
One amazing movie that gives me strength is The Heiress (1949). Please watch it when you get the chance. Hope it helps you as well.",6745,Encouraging movies for women going their own way?,0,,,,0
175,Shadowgirl7,,2021-04-27 23:16:48,2021-04-27 23:16:58,self.wgtow,https://www.reddit.com/r/wgtow/comments/n01cp5/did_anyone_watch_the_movie_promising_young_woman/,n01cp5,False,/r/wgtow/comments/n01cp5/did_anyone_watch_the_movie_promising_young_woman/,False,False,26,wgtow,t5_31ux8,1,"... It was such a disgusting movie. The end brought some relief but I am still angry because I know in real life it most likely wouldn't end like that. 

It got some Oscar Nominations and I am glad I watched it.",6999,Did anyone watch the movie Promising Young Woman? [Potential Spoiler],0,,,,0
178,Environmental_Bread7,WGTOW mod ✨,2021-04-26 14:20:21,2021-04-26 14:20:32,self.wgtow,https://www.reddit.com/r/wgtow/comments/myyr6o/monday_suggestions_day/,myyr6o,False,/r/wgtow/comments/myyr6o/monday_suggestions_day/,False,False,0,wgtow,t5_31ux8,1,"Welcome to Suggestion Monday! Mondays are for suggesting new ideas to help our sub grow and thrive!

Please post your suggestions below.",6993,Monday: Suggestions day!,0,,,,0
182,Shadowgirl7,,2021-04-25 20:38:51,2021-04-25 20:39:02,self.wgtow,https://www.reddit.com/r/wgtow/comments/myh241/are_you_involved_in_some_sort_of_political/,myh241,False,/r/wgtow/comments/myh241/are_you_involved_in_some_sort_of_political/,False,False,19,wgtow,t5_31ux8,1,"Just wondering.

I never joined a political party in my country because I have a very hard time being accepted into ""clubs"" and having the club mentality of having to say yes to everything. Also with work and other stuff I sometimes lose touch with my political side.

I am left leaning and there's two major left wing political parties, Communist Party and then a derivative of the Communist Party that worries more about issues like gender issues, drugs, milennial social issues, let's say. Then there's the equivalent of the Green Party and two minor left wing parties that I know of (well there's more but they usually don't have representation in the parliment). And of course the Socialist Party but since it's part of the mainstream parties that alternate between each other in occupying power, it's a bit tainted with corruption scandals and nepotism.  

I also went to a meeting with group that worries about european issues but I was a bit disappointed because they just discussed more local small issues and I felt like I didn't fit in because most of them were from rich families. 

For me the most important issues are labour rights and income inequality, fighting poverty, quality of education, justice and health. Obviously women issues are important to me, but I often align with the Communist Party on this and refuse to indulge in some media fed gender fights because there's more important things in the big picture. Politically speaking there's very little that can be done in terms of gender rights (we already have legal abortion, free access to contraception programs), maybe increase penalties for rape crimes and sexual harassment crimes and give more legal protection to people who commit some sort of crime as a form of self defense. Obviously increase funding of associations that fight for gender equality and train police forces to know how to react to gender related crimes. 

I just feel like sometimes women worry so much about relationship and all the drama associated with it when we could be worrying about the bigger picture. I am guilty of that too, sometimes forgeting about the bigger issues because of my petty personal dramas.",6983,Are you involved in some sort of political organization? What are your political tendencies?,0,,,,0
183,hawaiiansweetrolls,,2021-04-25 18:45:53,2021-04-25 18:46:04,self.wgtow,https://www.reddit.com/r/wgtow/comments/myensb/men_pretend_to_care_about_you_when_really_theyre/,myensb,False,/r/wgtow/comments/myensb/men_pretend_to_care_about_you_when_really_theyre/,False,False,12,wgtow,t5_31ux8,1,"We also aren’t allowed to call this out. That’s why the me too movement blew up the way it has. Women decided to stop pretending that men aren’t operating as predators by default, and started calling it out. Men hate the fact that more women are waking up and they are being exposed for who they really are. For so long women were pretending that men are something different than what they really are, all because men would act as though their feelings would be hurt by being called out. Their feelings aren’t hurt, they just don’t want to be exposed. 
You can tell them a long story about something horrific that happened to a woman at the hands of a man, and all a man will have to say is that not all men do that. They don’t care what women are going through, they are just mad we’re making it harder for them to gain women’s trust quickly.


They will ask you questions about your life in an attempt to “get to know you”. What they’re actually trying to figure out is what your emotional weaknesses and triggers are, so they can use that to get you to sleep with them. I can’t even tell you how many times I’ve been listening to men who claim to be romantically interested in me speak to me and the whole time I’m just thinking - *this dude is full of shit, he wants to have sex with me and that’s it. This guy is not interested in me at all.* Every question is framed to eventually lead to sex, which is what he really wants to talk about. When you choose to reveal next to no personal information to them until they share more about themselves with you, they get frustrated. The bolder ones will just ask you for sex right away. At least they’re honest and don’t feel the need to play bs games. 

These are feelings I’ve had ever since I first started dating as teen. I knew that boys did not really like me, they just wanted me to let them grope me or something. They knew if they gave me the Princess treatment for long enough the way their dad taught them, it would probably happen. 

I don’t think men like women as human beings, personally. I think men like the way women make them feel physically, and they get a sexual thrill out of the chase. That’s why so many of them will say they can’t be friends with women. They do not see women as someone worthy of communicating with casually, unless there is a reward(sex) at the end of it. Women are for sex and child rearing and that is it. Eventually if you don’t annoy them with your existence for long enough and be passive enough, they will propose to you. The ultimate reward is supposed to be that you get to have their child and be proud that you have a child with this guy. Whole time it’s just a way to get permanent endured servitude out of you. Men don’t even like kids, which is why women end up taking care of the majority of childcare duties. Men can’t stand being around their own kids and pretend to be too busy. 

It’s just weird. 

I think all women know deep down that men don’t really like them, but they cave to society’s expectations because men bully them into believing they are nothing without them. It doesn’t matter how great a woman’s accomplishments are. Men say the only thing that really matters is whether she was worthy enough for a proposal. If that hasn’t happened yet, the woman is still a loser. 
Men have women on a merry go round of neuroticism. Meanwhile they are focusing on hoarding wealth and valuable resources, and dishing small amounts of it out to the women who obey their commands and jump when they say how high. 

I also think men know they’re not good people and that they’re unpleasant to be around, but can’t help it. They know they are biologically flawed and thats why they hoard resources. Women need to some incentive to be around them or else they wouldn’t bother. They get angry at any sign of a woman getting access to a new escape route, and work hard to cut that escape route off.",6980,"Men pretend to care about you when really they’re just trying to find a way to get you to sleep with them. We are supposed to pretend we don’t notice this and play along, we’re supposed to pretend we can’t tell it’s not genuine.",0,,,,0
184,moritak69,,2021-04-25 17:03:24,2021-04-25 17:03:34,self.wgtow,https://www.reddit.com/r/wgtow/comments/myci29/is_making_sourdough_starter_worth_it/,myci29,False,/r/wgtow/comments/myci29/is_making_sourdough_starter_worth_it/,False,False,4,wgtow,t5_31ux8,1,I want to learn how to do pastries and I was wondering if sourdough made the difference.,6975,is making sourdough starter worth it?,0,,,,0
188,ztsmart,,2021-04-25 06:04:53,2021-04-25 06:05:04,self.wgtow,https://www.reddit.com/r/wgtow/comments/my26fa/im_happy_this_sub_exists/,my26fa,False,/r/wgtow/comments/my26fa/im_happy_this_sub_exists/,False,False,1,wgtow,t5_31ux8,1,"I didn't know this existed until I saw a link on /r/MGTOW so I checked it out.  There are a lot of positive posts about the benefits of going one's own way and surprisingly no men-bashing like the amount of women-bashing on /r/MGTOW, and some quality shitposts of course.

I wish the relationship between mgtow and wgtow were more like the relationship between /r/TrollYChromosome and /r/TrollXChromosomes because I think there is a lot in common.  Anyways, it takes courage to deviate from the prescribed social norms and go one's own way and a lot of work to build a satisfying life independently.  I wish you guys the best on your own respective paths.

-A man",6957,I'm happy this sub exists,0,,,,0
191,waterylilies,,2021-04-24 16:45:00,2021-04-24 16:45:11,self.wgtow,https://www.reddit.com/r/wgtow/comments/mxnpo2/the_part_where_she_talks_about_having_that_choice/,mxnpo2,False,/r/wgtow/comments/mxnpo2/the_part_where_she_talks_about_having_that_choice/,False,False,3,wgtow,t5_31ux8,1,[https://www.youtube.com/watch?v=5Y3DqRjqGoU](https://www.youtube.com/watch?v=5Y3DqRjqGoU),6934,The part where she talks about having that choice.,0,,,,0
