,author,author_flair_text,created_utc,retrieved_on,domain,full_link,id,is_reddit_media_domain,permalink,is_video,locked,num_comments,subreddit,subreddit_id,score,selftext,subreddit_subscribers,title,total_awards_received,updated_utc,removed_by,poll_data,post
302,asianinindia,,2021-05-01 14:01:16,2021-05-01 14:01:26,self.wgtow,https://www.reddit.com/r/wgtow/comments/n2ix06/looking_for_women_rappers/,n2ix06,False,/r/wgtow/comments/n2ix06/looking_for_women_rappers/,False,False,27,wgtow,t5_31ux8,1,"I enjoy hip hop and rap when working out but it seems that there are nothing but male rap artists in the top charts and even if there are women their music is no different from the men's music in that it objectified women and oftentimes the artist herself. 

Are there any good hip hop or rap artists (women) that actually sing without talking about sex or body parts or abusive language toward women?",7039,Looking for women rappers.,0,,,,1
305,doodoowa,,2021-05-01 05:20:36,2021-05-01 05:20:47,self.wgtow,https://www.reddit.com/r/wgtow/comments/n2bwln/how_do_i_stop_being_so_obsessed_with_men/,n2bwln,False,/r/wgtow/comments/n2bwln/how_do_i_stop_being_so_obsessed_with_men/,False,False,56,wgtow,t5_31ux8,1,I want to be ok with being alone but I don’t know how.,7037,How do I stop being so obsessed with men?,0,,,,1
306,warinmymind94,,2021-05-01 04:39:44,2021-05-01 04:39:55,self.wgtow,https://www.reddit.com/r/wgtow/comments/n2bbh6/im_looking_at_my_friends_wedding_pics_and_her/,n2bbh6,False,/r/wgtow/comments/n2bbh6/im_looking_at_my_friends_wedding_pics_and_her/,False,False,13,wgtow,t5_31ux8,1,"My former best friend got married. I distanced myself because she essentially couldn't stand me being single and would try setting me up against my will with dudes that had situation-ships already going on with other women. She was dating this guy who always made her cry and belittled her... and she ended up recently marrying him. 

Anyways, I was checking out their wedding photos they posted! My friend looked so beautiful and elegant!

And then I looked aside her at her husband. They had a traditional religious wedding and part of the ceremony involves sitting before the minister and then all the people are watching them. She was sitting up, at attention, and looked focused on the Minister. Her hands were folded nicely. Her husband was extremely slouching to the point where his hurt jacket didn't even look like it was on all the way and his eyes were off to outer space dating off... and his one hand was grabbing near his crotch! I was horrified and feel secondhand embarrassed for the bride. The groom looks like one of the slobby class clowns from high school goofing off and not paying attention during class, like the kid that always gets sent to the principles office...

They looked like night and day. In the rest of the photos he was making faces and didn't take it seriously at all while she was trying to be mature and professional. 

I dont believe in marriage and haven't been dating, and when I am out in public I ignore men that start hitting on me. Seeing her husband slouch and zone out and be in his crotch in front of a minister and whole church of people made me feel literally so sick. He was the one that proposed to her. Why is he already acting so miserable and like he doesn't want to be at his own wedding? He asked her. And then to pose like that? 

My friend is like a many others who dream of their wedding and white dress their whole life. He knew that and he doesn't care to even pretend to pay attention at his own wedding. Im glad she is a former friend because I couldn't handle hearing any more of her stories about how awful he was during their time dating. 

The wedding she had though made me loose even more hope for myself. It feels so abysmal. To be honest I distanced myself hard when she got engaged because I just didn't have the heart to be there and pretend to act happy for her when I can see the truth. I do hope he gets better for her but I doubt that will happen. 

Her husband is an extreme example but still most guys never seem to excited for their weddings, they act sort of like its a chore and boring. No thanks!",7038,I'm looking at my friends wedding pics and her husband is slouching and grabbing near his crotch in the photos. I am so turned off by men and marriage!,0,,,,1
309,Shadowgirl7,,2021-04-30 11:06:04,2021-04-30 11:06:15,self.wgtow,https://www.reddit.com/r/wgtow/comments/n1rik4/which_type_of_feminism_do_you_identify_with/,n1rik4,False,/r/wgtow/comments/n1rik4/which_type_of_feminism_do_you_identify_with/,False,False,46,wgtow,t5_31ux8,1,"After I saw today's post on radfems sub I decided to go read about some types of feminism and found these two interesting reads:

https://www.sociologygroup.com/different-types-of-feminism/

https://www.uah.edu/woolf/feminism_kinds.htm?fbclid=IwAR3gOfH4EjrqRTEelska076sKZeZSyayh0PgGoPHCYR7yqieRUm3QXnk_og

So far I had only heard of radical feminism vs libfems and wasn't quite sure what they meant. After reading those articles I think I have a better idea, though still a bit confused. 

Ultimately it all comes down to this quote:
""I myself have never been able to find out precisely what feminism is: I only know that people call me a feminist whenever I express sentiments that differentiate me from a doormat, or a prostitute.""  

But just curious to know the types with which you identify the most.",7037,Which type of feminism do you identify with?,0,,,,1
310,electricpapaya593,,2021-04-30 06:22:18,2021-04-30 06:22:29,self.wgtow,https://www.reddit.com/r/wgtow/comments/n1nvs7/where_are_all_the_radfem_subreddits/,n1nvs7,False,/r/wgtow/comments/n1nvs7/where_are_all_the_radfem_subreddits/,False,False,97,wgtow,t5_31ux8,1,"Hey I am new and looking for a place... I just KNOW there used to be a radfem subreddit here. I used to post here ages ago. I feel like all the other womens social media sites are completely dead. Unlike the subs I used to frequent here back in the day. I am definitely into wgtow, but can anyone help me out?",7034,Where are all the radfem subreddits?,0,,,,1
313,ViolaineCocteau,,2021-04-29 05:08:52,2021-04-29 05:09:03,self.wgtow,https://www.reddit.com/r/wgtow/comments/n0xcdv/james_brian_chadwell/,n0xcdv,False,/r/wgtow/comments/n0xcdv/james_brian_chadwell/,False,False,0,wgtow,t5_31ux8,1,"Has anyone heard about him yet? A 9 year old girl was found in his basement (sexually assaulted and beaten) Some have now raised the suspicion that he could be a suspect in the Delphi murders. I was reading up on him and he seems like the typical violent incel that wants to blame women for all of his problems. He's just so well adjusted and wholesome, because all such people do what he did, right? /s

Here's an interesting article I found about him if anyone is interested. [https://heavy.com/news/james-brian-chadwell/](https://heavy.com/news/james-brian-chadwell/) 

I just thought it was interesting how he tried to portray himself as some misunderstood ""good guy"" just trying to find a decent woman to love him because he's so decent and awesome himself, you know. I honestly wouldn't be surprised if he was the murderer in the Delphi cases.",7021,James Brian Chadwell,0,,,,1
337,lucyintherain,,2021-05-28 08:22:47,2021-05-28 08:22:58,self.wgtow,https://www.reddit.com/r/wgtow/comments/nmt2y2/are_there_online_support_groups_for_women/,nmt2y2,False,/r/wgtow/comments/nmt2y2/are_there_online_support_groups_for_women/,False,False,12,wgtow,t5_31ux8,1,"So i am still quite young (21) but i want to move to another country and find a job and a house there, and i don't want to be dependent on a man in any way. Now of course a lot of people do this but i was wondering if there is a secret club of women who help eachother out with tips and support and maybe even meet up once in a while :-)",7287,Are there online support groups for women (re)starting a life without a man?,0,,,,1
338,sweetlevels,,2021-05-27 23:25:35,2021-05-27 23:25:46,self.wgtow,https://www.reddit.com/r/wgtow/comments/nmkh8m/has_anyone_seen_revenge_a_movie/,nmkh8m,False,/r/wgtow/comments/nmkh8m/has_anyone_seen_revenge_a_movie/,False,False,5,wgtow,t5_31ux8,1,I'm in the middle of watching it. It's about this women killing her rapist and his helpers. Would anyone want to see it?,7285,Has anyone seen Revenge (a movie),0,,,,1
339,level_up_always,deprogramming  🧠,2021-05-27 22:50:23,2021-05-27 22:50:34,self.wgtow,https://www.reddit.com/r/wgtow/comments/nmjt4q/men_are_taught_to_become_somebody_women_are/,nmjt4q,False,/r/wgtow/comments/nmjt4q/men_are_taught_to_become_somebody_women_are/,False,False,17,wgtow,t5_31ux8,1,"That's it, that's the quote. Heard on the radio today if anyone knows the source feel free to share googling didn't come up with anything.",7285,"""Men are taught to become somebody, women are taught to find somebody.""",0,,,,1
340,REDDITISMISOGYNISTIC,free spinster,2021-05-27 20:06:47,2021-05-27 20:06:59,self.wgtow,https://www.reddit.com/r/wgtow/comments/nmgap8/why_do_women_change_their_names_after_marriage/,nmgap8,False,/r/wgtow/comments/nmgap8/why_do_women_change_their_names_after_marriage/,False,False,25,wgtow,t5_31ux8,1,"Why isn't this practice banished yet? What are we waiting for? 

Why is the child always named after the father's family name?

On a similar note, can someone lead me to a list of matriarchal surnames? I wanna change my surname because eff patriarchy. I don't see why I should be retaining my father's name when I'm a radical feminist.",7287,Why do women change their names after marriage and incorporate the husband's family name?,0,,,,1
342,babalonsCup,,2021-05-27 14:06:11,2021-05-27 14:06:22,self.wgtow,https://www.reddit.com/r/wgtow/comments/nm88as/reddit_filtered_this_post_as_spama_list_of/,nm88as,False,/r/wgtow/comments/nm88as/reddit_filtered_this_post_as_spama_list_of/,False,False,8,wgtow,t5_31ux8,1," 

i recently saw \*promosing young woman \* and its not exactly what you’re asking for, but its definitely a film i’d recommend for wgtow ☺️ for something light hearted, i really love *julie &amp; julia* (includes heteo couple, but the story is about food)

**13ReplyGive AwardShareReportSave**📷level 1[**CatSweets**](https://www.reddit.com/user/CatSweets/)·[3m](https://www.reddit.com/r/wgtow/comments/lfsyno/anyone_interested_in_making_a_list_of_various_tv/gmnxetu/?utm_source=reddit&amp;utm_medium=web2x&amp;context=3)

Thelma &amp; Louise! A classic.

**9ReplyGive AwardShareReportSave**level 2Comment deleted by user·[3m](https://www.reddit.com/r/wgtow/comments/lfsyno/anyone_interested_in_making_a_list_of_various_tv/gmnxowq/?utm_source=reddit&amp;utm_medium=web2x&amp;context=3)📷level 1[**orange22orange**](https://www.reddit.com/user/orange22orange/)·[3m](https://www.reddit.com/r/wgtow/comments/lfsyno/anyone_interested_in_making_a_list_of_various_tv/gmoobbv/?utm_source=reddit&amp;utm_medium=web2x&amp;context=3)

Spirited away is a classic

**9ReplyGive AwardShareReportSave**📷level 1[**raisinhippo**](https://www.reddit.com/user/raisinhippo/)·[3m](https://www.reddit.com/r/wgtow/comments/lfsyno/anyone_interested_in_making_a_list_of_various_tv/gmns718/?utm_source=reddit&amp;utm_medium=web2x&amp;context=3)·*edited 3m*

I think this is a great idea and I would love a list, but I am struggling to think of any movies to add!

What a sad reflection on the world.

Edit: The movie Wild *almost* but not quite counts, since she does have flashbacks to leaving her husband.

**9ReplyGive AwardShareReportSave**📷level 1[**ThatIntention1**](https://www.reddit.com/user/ThatIntention1/)·[3m](https://www.reddit.com/r/wgtow/comments/lfsyno/anyone_interested_in_making_a_list_of_various_tv/gmnvy8b/?utm_source=reddit&amp;utm_medium=web2x&amp;context=3)·*edited 3m*

My first thought is Brave (2012 Pixar movie)

Girl, Interrupted is also a good one

**7ReplyGive AwardShareReportSave**📷level 2[**raisinhippo**](https://www.reddit.com/user/raisinhippo/)·[3m](https://www.reddit.com/r/wgtow/comments/lfsyno/anyone_interested_in_making_a_list_of_various_tv/gmoeqzf/?utm_source=reddit&amp;utm_medium=web2x&amp;context=3)

Moana too

**3ReplyGive AwardShareReportSave**level 1**\[deleted\]**·[3m](https://www.reddit.com/r/wgtow/comments/lfsyno/anyone_interested_in_making_a_list_of_various_tv/gn0bvs6/?utm_source=reddit&amp;utm_medium=web2x&amp;context=3)

Honestly it’s going to sound dumb but I LOVED Frozen!

It was one of the few Disney movies I’ve actually connected with because it’s not about romance primarily

Even as a little girl I only liked the music and songs in Disney cartoons but not the romance/prince/princess stuff

I think Frozen is empowering because it’s about family, friendship, sacrifice, sisterhood idk I really liked it and I had no kids to watch it for heheh

**5ReplyShareReportSave**📷level 1[**IamAwitch000**](https://www.reddit.com/user/IamAwitch000/)·[3m](https://www.reddit.com/r/wgtow/comments/lfsyno/anyone_interested_in_making_a_list_of_various_tv/gmowsku/?utm_source=reddit&amp;utm_medium=web2x&amp;context=3)

You are next (Erin is the best horror movie protagonist i have ever seen)

**4ReplyGive AwardShareReportSave**📷level 1[**babalonsCup**](https://www.reddit.com/user/babalonsCup/)·[3m](https://www.reddit.com/r/wgtow/comments/lfsyno/anyone_interested_in_making_a_list_of_various_tv/gn927s9/?utm_source=reddit&amp;utm_medium=web2x&amp;context=3)

Miss Fischer's Murder Mysteries!

Set in 1920's flapper Australia, feminist and very WGHOW. There is a love interest and dalliances, but she is wealthy and won't marry, owns a gun and has a butch doctor friend.

**3ReplyShareSaveEdit**📷level 1[**monivoz**](https://www.reddit.com/user/monivoz/)·[3m](https://www.reddit.com/r/wgtow/comments/lfsyno/anyone_interested_in_making_a_list_of_various_tv/gn1gpjo/?utm_source=reddit&amp;utm_medium=web2x&amp;context=3)

Tone deaf (horror comedy) and Birds of Prey come to mind as the most recent. I also posted about Agora (2009) on another thread.

**2ReplyGive AwardShareReportSave**📷level 1[**Beautiful\_Exam1071**](https://www.reddit.com/user/Beautiful_Exam1071/)·[3m](https://www.reddit.com/r/wgtow/comments/lfsyno/anyone_interested_in_making_a_list_of_various_tv/gmoi95i/?utm_source=reddit&amp;utm_medium=web2x&amp;context=3)

Frozen! People were actually mad because Elsa kissed Anna on the cheek in the end, and it was a sister story and not a romantic one.

**1ReplyGive AwardShareReportSave**📷level 1[**Hmtnsw**](https://www.reddit.com/user/Hmtnsw/)·[3m](https://www.reddit.com/r/wgtow/comments/lfsyno/anyone_interested_in_making_a_list_of_various_tv/gmq8c1j/?utm_source=reddit&amp;utm_medium=web2x&amp;context=3)happy catlady

I've asked this sub TWICE about books suggestions. Nothing.

Now there is this.

Thank you.

**1ReplyGive AwardShareReportSave**📷level 1[**LadyGrimes**](https://www.reddit.com/user/LadyGrimes/)·[3m](https://www.reddit.com/r/wgtow/comments/lfsyno/anyone_interested_in_making_a_list_of_various_tv/gmrgo9h/?utm_source=reddit&amp;utm_medium=web2x&amp;context=3)happy birdlady

I saw a movie on prime called ""Mermaid Down"" which I liked a lot.

**1ReplyGive AwardShareReportSave**📷level 1[**Outrageous-Knowledge**](https://www.reddit.com/user/Outrageous-Knowledge/)·[3m](https://www.reddit.com/r/wgtow/comments/lfsyno/anyone_interested_in_making_a_list_of_various_tv/gmvhx3r/?utm_source=reddit&amp;utm_medium=web2x&amp;context=3)

For books I just read The Priory of the Orange Tree. It’s fantasy F/F

**1ReplyGive AwardShareReportSave**📷level 1[**papanezismysaviour**](https://www.reddit.com/user/papanezismysaviour/)·[3m](https://www.reddit.com/r/wgtow/comments/lfsyno/anyone_interested_in_making_a_list_of_various_tv/gnmctzq/?utm_source=reddit&amp;utm_medium=web2x&amp;context=3)

The Fabulous Stains!

**1ReplyGive AwardShareReportSave**",7284,Reddit filtered this post as spam...a list of books/movies/and TV shows that adhere to the theme of this sub: Let's revive?,0,,,,1
344,moritak69,,2021-05-27 07:54:00,2021-05-27 07:54:11,self.wgtow,https://www.reddit.com/r/wgtow/comments/nm2dw7/censorship_of_womenidentified_women/,nm2dw7,False,/r/wgtow/comments/nm2dw7/censorship_of_womenidentified_women/,False,False,3,wgtow,t5_31ux8,1,"Idk if anyone has noticed but they deleted black obsidian's channel on youtube. She was one of the few radfems I used to listen to carefully.  
It seems like they're targetting vocal women who are sharing truths on every platform.",7280,censorship of women-identified women,0,,,,1
345,sugarelf222,,2021-05-27 03:13:29,2021-05-27 03:13:40,self.wgtow,https://www.reddit.com/r/wgtow/comments/nlybhy/people_dont_want_women_to_enjoy/,nlybhy,False,/r/wgtow/comments/nlybhy/people_dont_want_women_to_enjoy/,False,False,43,wgtow,t5_31ux8,1,"Have you noticed this in your life? 

People especially men and misogynistic women just don’t want to see other women enjoying or flourishing or being happy. 

They WANT you to suffer, toil and be depressed. 

That’s when they are happy and satisfied. 

The worst part is most of the people who don’t want to see you enjoying are the close ones and males in your life eg father, even partner. 

They can help you or make your life better or easier but they choose not to. 

That’s how they have a “hold” on you or so you don’t grow a “big head.”",7280,People 👏🏻 don’t 👏🏻want 👏🏻women 👏🏻 to 👏🏻enjoy 👏🏻,0,,,,1
346,FaithfullyCorrupt,,2021-05-26 13:56:53,2021-05-26 13:57:04,self.wgtow,https://www.reddit.com/r/wgtow/comments/nlhnmj/book_suggestions/,nlhnmj,False,/r/wgtow/comments/nlhnmj/book_suggestions/,False,False,8,wgtow,t5_31ux8,1,Anyone have a list of light/chicklit/beach-reads that feature female main characters &amp; no Mr. Right as end game?,7280,Book suggestions?,0,,,,1
347,FaithfullyCorrupt,,2021-05-26 01:09:34,2021-05-26 01:09:45,self.wgtow,https://www.reddit.com/r/wgtow/comments/nl4ti8/real_question/,nl4ti8,False,/r/wgtow/comments/nl4ti8/real_question/,False,False,8,wgtow,t5_31ux8,1,"Might seem trollish, but it's not.

Is this another women's sub created by men?",7272,Real question,0,,,,1
351,saralafontaine,,2021-05-24 14:52:51,2021-05-24 14:53:02,self.wgtow,https://www.reddit.com/r/wgtow/comments/njzrwg/what_is_a_relationship_anyway/,njzrwg,False,/r/wgtow/comments/njzrwg/what_is_a_relationship_anyway/,False,False,51,wgtow,t5_31ux8,1,"I have this theory that a relationship is basically just based off what marriage is supposed to be, which is an antiquated version of sex slavery, ie the man is in control of all finances and the woman is legally obligated to sleep with him (at least in the USA til 1994 when marital rape was outlawed). 

For most of my life I have idealized having a relationship. Guys would be down to have casual sex, or be my friend, but “getting” them into a “relationship” was really difficult. Almost like a feat. You had to get to know him, go on several dates where you played a part, smiling, feminine, and then he deemed you worthy of being his girlfriend. I know this isn’t 100% of cases but it seems to be the mainstream. 

In the few cases I did have a boyfriend, we were obviously alone a lot and he wanted to do sexual things. All the time. And I was his girlfriend, and that’s what the girl offends did unless they were waiting until marriage - and *then* they did the sexual things. 

Sure, there is love and cuddles too. Texting, hand-holding, events, spending time with friends. But what is this structure? Why can’t we have all these things without so much regular sex? 

Men whine about wanting love and connection. Empathy. A partner. But they also want a sex moppet. And I can tell you, during all of my relationships it was mostly him who wanted all the physical intimacy, and I just went along with it because I was supposed to trust him. Because he was my boyfriend, and that’s just *what you do* in a “relationship”. 

What do you ladies think?",7255,What *is* a “relationship” anyway?,0,,,,1
352,Environmental_Bread7,WGTOW mod ✨,2021-05-24 14:20:16,2021-05-24 14:20:30,self.wgtow,https://www.reddit.com/r/wgtow/comments/njz2fs/monday_suggestions_day/,njz2fs,False,/r/wgtow/comments/njz2fs/monday_suggestions_day/,False,False,1,wgtow,t5_31ux8,1,"Welcome to Suggestion Monday! Mondays are for suggesting new ideas to help our sub grow and thrive!

Please post your suggestions below.",7254,Monday: Suggestions day!,0,,,,1
353,Shadowgirl7,,2021-05-24 09:18:28,2021-05-24 09:18:39,self.wgtow,https://www.reddit.com/r/wgtow/comments/njtq1e/whats_your_long_term_life_plan/,njtq1e,False,/r/wgtow/comments/njtq1e/whats_your_long_term_life_plan/,False,False,24,wgtow,t5_31ux8,1,"What is your long term goal? Do you plan to stay where you are now, move to a different city/country?

What about your living arrangements? Do you plan to buy property, do you already own property?

Career wise are you satisfied with your job do you have any plans to change?",7255,What's your long term life plan?,0,,,,1
355,Flat-Apple57,Slowly Becoming WGTOW :cake: ,2021-05-23 20:08:18,2021-05-23 20:08:29,self.wgtow,https://www.reddit.com/r/wgtow/comments/njfyu7/does_anyone_else_feel_like_you_can_finally_be/,njfyu7,False,/r/wgtow/comments/njfyu7/does_anyone_else_feel_like_you_can_finally_be/,False,False,13,wgtow,t5_31ux8,1,"I realized my whole life... every time I stay engaged with some men, they view me through sexist lens as a negative rather than a positive:

  
\-- **Random &amp; silly: oh she's batshit crazy and not emotionally stable** (like okay? my emotions have nothing to do with you provoking me. I'm just being myself. I'm not emotional like most women. I only get emotional about my own life, not men.)  
\-- **Productive and hard-working,** therefore not wanting to be bothered when doing something important (rude, erratic \[for telling them to leave you alone for a bit\] and mean

\-- **Insecure because I don't brag about things and put others down** (How is that a GOOD trait??? I do brag, but then you shoot me down, so I just say nothing. The hell you expect?) 

\-- **Slutty with no boundaries because I'm bubbly, nice, and sweet** (No. I'm extroverted and not sweet. I just don't say mean stuff, but I'm actually quite selfish and don't do anything for men. And sex? Only 1 guy. I'm 25.)

These are all traits and qualities people love about me. But the wrong men seem to get selfish and try to tie me down while also denying me the right to be myself. They love what I have to offer, but make it miserable to be with them, and act like I""m not good enough. Then I leave and they realize how much joy I brought to their life. I went back once, and it ended up being hell. Every single shit-personality guy, every single time. And then when they actually affect me, I get mad and stand up, and they leave saying I abused them. Why would I sign up for that? I want men with good personalities, like me. 

I just realized until I can get these shit-men to truly leave me alone and understand I have nothing to do with them. Is the time I can focus on myself and then find a guy who values me for me without being clouded by other crappy men's judgement.",7250,Does anyone else feel like you can finally BE YOURSELF after GYOW?,0,,,,1
357,LadyoftheLizards,,2021-05-22 12:37:54,2021-05-22 12:38:04,self.wgtow,https://www.reddit.com/r/wgtow/comments/nihqbu/air_drying_saves_quarters/,nihqbu,False,/r/wgtow/comments/nihqbu/air_drying_saves_quarters/,False,False,32,wgtow,t5_31ux8,1,"I live in an apartment with no laundry unit so I have to pay for it. Lately I have been air drying my clothes and it saves more time and money. I also started washing my dishes in the bathtub since I have no dishwasher, the tub gives me more space to wash them. I could never do anything of this stuff while I was living with family. Has anyone else have done things that are seen as eccentric ever since you started living by yourself?",7248,Air drying saves quarters,0,,,,1
361,ProserpinaFC,,2021-05-21 10:01:56,2021-05-21 10:02:06,self.wgtow,https://www.reddit.com/r/wgtow/comments/nhovb9/how_do_you_feel_about_allwomen_intentional/,nhovb9,False,/r/wgtow/comments/nhovb9/how_do_you_feel_about_allwomen_intentional/,False,False,15,wgtow,t5_31ux8,1,"What would you be interested in doing to support them? Would you ever want to become an urban donor to one?

Lesbian paradise: https://www.nytimes.com/2009/02/01/fashion/01womyn.html

Much like a start-up: https://aeon.co/essays/like-start-ups-most-intentional-communities-fail-why

People of color: https://www.ic.org/on-waiting-for-people-of-color/",7237,How do you feel about all-women intentional communities? They are dying out from lack of skilled participation from the next generation,0,,,,1
