,author,body,created_utc,id,parent_id,subreddit_id
0,-----Kyle-----,"You wouldn’t see a 100 mile cone of plasma at 900 miles away. Nope, wrong. I saw a normal falcon 9 launch clearly from 600 miles away. If you want to do the geometry yourself you can, but it is very obvious you can see almost the entire launch from over 1000 miles.",1570157607,f2dlq5e,t1_f2axlhf,t5_2srow
1,-----Kyle-----,"It’s dumb to do by the photographer, but far more dumb to not keep the site of an orbital rocket production/testing facility secured.",1570156380,f2dk581,t1_f2d90fm,t5_2srow
2,-----Kyle-----,"No, but its the #1 place I want to visit along with Singapore.",1570148247,f2d802a,t1_f2d7u7c,t5_2qm24
3,-----Kyle-----,For sure. I get chirashi don quite a lot because you just get much more value. And you can eat it with a fork without looking like a lunatic 😂,1570148098,f2d7o8m,t1_f2d77xp,t5_2qm24
4,-----Kyle-----,"Yeah I thought so too. ‘Cheapo’ sushi is kind of an oxymoron in the grand scheme of food as a whole, but I’ve had similar sushi for $70-$80 at a higher end place.",1570147733,f2d6eoz,t1_f2d65g9,t5_2qm24
5,-----Kyle-----,It’s from a sushi shop called Mt. Everest sushi. It’s a Nepalese chef. I’m a regular so he always puts an extra couple pieces in the meal for me. The poke bowls he does are top notch as well.,1570147630,f2d6777,t1_f2d5vbo,t5_2qm24
6,-----Kyle-----,"$25. Not cheap for a California roll and an eel roll, but cheap in my area for this quality.",1570147496,f2d5x5q,t1_f2d5ql7,t5_2qm24
7,-----Kyle-----,"Bought it as Akami and Chutoro. I thought it was cheapo for how good it was, they even included a ton of real wasabi.",1570147241,f2d55lk,t1_f2d38sa,t5_2qm24
8,-----Kyle-----,Nope. They are wise to that.,1570140670,f2colq4,t3_dcvma1,t5_2rhsl
9,-----Kyle-----,Trypophobia,1570118211,f2avama,t1_f23wvkq,t5_31s00
10,-----Kyle-----,What a fucking shame. Sad story if there ever was one.,1570073976,f28y6c8,t1_f28x9ae,t5_2xh58
11,-----Kyle-----,I’d be amazed if the trade is stopped by commish or vote. Extremely lopsided for you.,1569984049,f25uctv,t1_f25ilzp,t5_2qlqq
12,-----Kyle-----,"Man I had a teacher do that in 2nd grade and I was super into it. 

Weird that you can have crushes like that well before you hit maturity.",1569980491,f25pjzu,t1_f23wlkp,t5_2qh1i
13,-----Kyle-----,"If you are a HK police officer and you don’t lay down your badge, baton, and gun, you earn getting beaten to a pulp with pipes.",1569959712,f24t1sj,t1_f23tahz,t5_2yrq6
14,-----Kyle-----,Most fun I’ve had all season.,1569907427,f235yxa,t1_f22xo0w,t5_2qmg3
15,-----Kyle-----,"The ergonomics are second to none, all the controls are top notch. The latest PS4 controller is inarguably more technically advanced, but it doesn’t make it the better controller for usability reasons.",1570680299,f35kecv,t1_f33k064,t5_2qh1f
16,-----Kyle-----,Big time. Latest MBP trackpad is awesome but in boot camp on windows 10 it’s not the same. Multitouch and high precision means nothing if the gestures and features aren’t there.,1570679803,f35jtzx,t1_f33vw8u,t5_2qh1f
17,-----Kyle-----,You are correct. The replier is wrong/lying.,1570594237,f325i0t,t1_eydz71b,t5_3e7xo
18,-----Kyle-----,"Time for r/AskReddit to absolutely destroy what could have otherwise been small, quality subs.",1570593214,f324fo4,t3_df2tyg,t5_2qh1i
19,-----Kyle-----,How fucking shameful.,1570382612,f2sg7up,t3_de53y3,t5_2r526
20,-----Kyle-----,All clad factory seconds.,1571123456,f3t9a7r,t3_di3hb0,t5_2ss1q
21,-----Kyle-----,Yep hat plague will eventually be false,1571043645,f3p4u45,t3_dhkc86,t5_2qh33
22,-----Kyle-----,"Idk who’s pants they are, but the why pants player isn’t down in the picture you sent.",1571029966,f3ovb8o,t1_f3o03bt,t5_2qmg3
23,-----Kyle-----,That girl needs a brutal execution. Suck fucker,1571021667,f3om625,t3_d9h21n,t5_1vnbn1
24,-----Kyle-----,They should just let him rest it. The game is almost certainly wrapped up at his point.,1571019972,f3ojz2l,t1_f3ojwq3,t5_2r526
25,-----Kyle-----,Ugh. Well it’s the right call can’t really complain.,1571019383,f3oj7qt,t3_dhi6vq,t5_2r526
26,-----Kyle-----,I would pay them to fuck off.,1571018732,f3oid3n,t1_f3oibqv,t5_2qmg3
27,-----Kyle-----,"https://en.m.wikipedia.org/wiki/Flag_of_Pittsburgh#Coat_of_arms_and_seal

Check this out. 

From what I figured, because the Steelers and the pirates were founded the same year and I think the Steelers used the Pittsburgh coat of arms as their original logo.",1571016643,f3ofnti,t1_f3oemwn,t5_2qmg3
28,-----Kyle-----,If they were different it would be a lot weirder tbh.,1571015778,f3oejuf,t1_f3oega1,t5_2qmg3
29,-----Kyle-----,What? No we actually don’t think of them much at all. Frankly I lump them in with that massive sprawling metro region they share with a few other cities. Might as well not even be in PA as far as Pittsburghers.,1571004619,f3nzgh5,t3_dhel1c,t5_2qhrn
30,-----Kyle-----,"Had a cat, super timid and declawed before we got her. She disappeared for over 2 years, including the wicked cold winter a few years ago. One night she just shows up. The fuck did you do that whole time like what.",1570920289,f3h8eov,t3_dgjyqc,t5_2qhrn
31,-----Kyle-----,Because it’s true.,1570919265,f3h5pb2,t3_dh14tt,t5_2qhrn
32,-----Kyle-----,"I wasn’t being aggressive in any way. You are picking up a tone because you’re being upset by my view on this. 

You completely misread my point about weighing the respect I have for that person with me being willing to be wrong. I’m literally saying I’ll call anyone by their chosen pronouns, but if someone is militant or rude to me for no reason, I’m not going to respect their wish for me to call them something I disagree with.",1570907251,f3g455v,t1_f3g337p,t5_2r6rj
33,-----Kyle-----,"I think the polls are off as always but he’s not popular like he was in 2016 with people, at least not people 17-22 (swatch of people I primarily interact with closely enough to get an idea).",1570905282,f3fzkns,t1_f3fzd84,t5_2qh1i
34,-----Kyle-----,"To me, misgendering is calling someone by pronouns that are at odds with their sex chromosomes. 

So for me, I balance the level of respect I want to offer another human versus what is correct. I’ve never met a trans person in real life where I felt that they deserved so little respect from me that I would insult them by using the right words. 

I am happy to be wrong, barring some extremely bad actions/Behavior from the person.",1570903054,f3fuw33,t1_f3fubej,t5_2r6rj
35,-----Kyle-----,How so?,1570902511,f3ftrh8,t1_f3ftq5a,t5_2r6rj
36,-----Kyle-----,Sub should be instantly banned for this post.,1570902367,f3ftgo6,t3_dglexr,t5_3pvlw
37,-----Kyle-----,People want to use radically alarmist views on the climate as a boot loader for the installation of communism.,1570901606,f3frrrm,t1_f3f14oh,t5_2qm21
38,-----Kyle-----,"I’m with you there. I’ll use whatever someone wants if they don’t give me reason not to. But as far as technical terms it’s a dude. 

I really wish they would just do Karyotypes at birth and if you have XX you are female, if you’re XY you are male, if it’s something else you are intersex, as far as the law goes. I don’t owe Fallon fox the use of his bullshit pronouns given he switched sex (legally) for the purpose of brutalizing women.",1570900909,f3fq5z1,t1_f3fpkrr,t5_2r6rj
39,-----Kyle-----,*He.,1570900306,f3foq8f,t1_f3dz3vz,t5_2r6rj
40,-----Kyle-----,Absolute fact.,1570864548,f3e9qi3,t1_f3cf9km,t5_2qh1i
41,-----Kyle-----,"Anonymity first, wide variety of highly specific sites with great amounts of content is second.",1570859344,f3e61ly,t3_dgnbqj,t5_2qh1i
42,-----Kyle-----,You just described the antithesis of Trevor Noah.,1570858243,f3e570d,t1_f3c7eyd,t5_2qh1i
43,-----Kyle-----,Average actor with a great set of views that are thought out and not a knee-jerk response to the emotional pandering of the media.,1570858059,f3e51m4,t1_f3c9um0,t5_2qh1i
44,-----Kyle-----,"Warren, trump, Biden, all far more popular than old Bernie.",1570857953,f3e4yjb,t1_f3cqpj0,t5_2qh1i
45,-----Kyle-----,Big yikes. Ffs put tekashi in the Oval Office before that lying loon.,1570857913,f3e4xdr,t1_f3bhtx3,t5_2qh1i
46,-----Kyle-----,James woods.,1570857832,f3e4v1t,t3_dggvh3,t5_2qh1i
47,-----Kyle-----,"By the time your revolution starts my guess is you’ll all have had yourselves disarmed. Talk about shooting yourselves in the foot, pun not intended 😂",1570828984,f3cwbsm,t1_f3cv6sn,t5_39qgx
48,-----Kyle-----,Commies need death.,1570770172,f3aekvq,t1_f3adoy0,t5_39qgx
49,-----Kyle-----,"My mom gave me all sorts of foods to try as a baby. Mayo, chicken salad, and chicken cordon bleu are the ones I can think of now that I absolutely hate. No I don’t feel bad that she fed me food I didn’t necessarily like. She wanted me to try as much food as I could to make me less picky. I’m thankful for that. Even the stuff I definitely didn’t like at the time. 

I guess in retrospect I can say I’m glad I tried all sorts of foods as a baby because I might have been less likely to try them now. My mom knew I liked salmon when I first tried it as an infant. If I didn’t have salmon til I was 10 I may have never tried it. 

Wasabi... yeah a baby won’t understand what’s going on and what the point is... but I learned that Dijon mustard was good on sandwiches well before I knew why it was so spicy and why it cleared my sinuses.",1570766821,f3ab7eb,t3_dg6a9t,t5_32dy0
50,-----Kyle-----,Joe BS’es a lot but boy does he have a lot of gems come out in f his podcast.,1570766102,f3aaes1,t3_df624o,t5_3328c
51,-----Kyle-----,I hate seeing the head punches after they’re out. Stomp on their hands or something that’ll actually hurt and won’t kill them.,1570764994,f3a94n5,t3_d2cu9p,t5_2u5un
52,-----Kyle-----,"He protested against the flag and the national anthem. Want a video?

I don’t give a fuck what he says the protest is against, I care what he’s actually protesting. 

If I go protest outside a Taco Bell with a sign saying college tuition is too high, I’m still protesting that Taco Bell.",1570764259,f3a87if,t1_f3a75k6,t5_2qmg3
53,-----Kyle-----,"Micro-econ  (ECON0100), and game theory (ECON0200) are both easy classes. I really disliked micro because we had to do these annoying online homeworks but overall it was very easy material. Game theory is a little harder but the homework was very light and no studying besides doing the homework was necessary.",1570763193,f3a6su4,t3_dg296v,t5_2rhsl
54,-----Kyle-----,"Well when you make a protest based on false pretenses, and make that protest against America and it’s flag and not those allegedly responsible, people will not like you.",1570762335,f3a5nt6,t3_dg4948,t5_2qmg3
55,-----Kyle-----,Big yikes,1570760093,f3a24fs,t3_dfzsbs,t5_39qgx
56,-----Kyle-----,Thank you sir.,1571715615,f4p4atl,t1_f4p46jx,t5_2qlqq
57,-----Kyle-----,"I also must add, your username perfectly describes my last season in FF.",1571714641,f4p3385,t1_f4p2nel,t5_2qlqq
58,-----Kyle-----,"Well depends how you think. If I was going for point total then yes. If I wanted to the higher point total every given week, I clearly fucked up.

Still quite frustrating knowing your players did better but only in garbage time (fantasy wise).",1571714401,f4p2s2n,t1_f4p2nel,t5_2qlqq
59,-----Kyle-----,Drop Curtis Samuel for him?,1571714310,f4p2npl,t3_dl9rsj,t5_2qlqq
60,-----Kyle-----,Well I had the highest point total last season by almost 100 and missed the playoffs.,1571714149,f4p2fwy,t3_dlbu0a,t5_2qlqq
61,-----Kyle-----,"I feel quite uncomfortable having O’dell on my team, although he’s still projected highly the ROS. I love how ekeler has been playing before I traded to get him but I don’t know if the chargers will give him more carries after the past games with MG3 back. 

Anyone who knows football beyond just projections and basic stuff have any advice that could help me out? Much appreciated",1571705982,f4oqezf,t3_dla3ce,t5_2qlqq
62,-----Kyle-----,"I had the Eagles D, opponent had Howard for PHI and Prescott. Lead changed 3 times in the last 6 minutes!",1571628652,f4jxp2j,t3_dkulbi,t5_2qlqq
63,-----Kyle-----,"Statistically, no.",1571627466,f4jw6ew,t1_f475931,t5_2qhrn
64,-----Kyle-----,"Well their cause wouldn’t need more protesting, so I assume they’d just go on with their lives. 

I don’t think you’re right to assume the anger of the protestors is unfounded or at all not tied to exactly what they are protesting here.

That’s equivalent to someone saying “oh what would women who want an abortion do if abortions were banned, who would they search for to murder to quench their thirst for death?”",1571626530,f4juhs6,t1_f48k57g,t5_2qhrn
65,-----Kyle-----,The salsa bar really puts it over the line for me. Although I prefer the meats at Chip.,1571625473,f4jsiet,t1_f47flvo,t5_2rhsl
66,-----Kyle-----,Should I grab Cousins from waivers?,1571615454,f4j9mr2,t3_dkpcjk,t5_2qlqq
67,-----Kyle-----,Probably in a space ship accident I think.,1571512027,f4bg94y,t3_dk3ukm,t5_2qh1i
68,-----Kyle-----,Knowing where this comes from makes it 10x funnier lmao.,1571244668,f3xvsun,t1_f3xius9,t5_2qmg3
69,-----Kyle-----,"Regular. The time you’re watching the lectures doesn’t count toward your credits (hours spent a week in the class). 

Yeah, I know that they flip it so you do work in lecture and learn the material out of class, but I’ve found that it forces you to spend 3 hours a week practicing material when it’s usually not necessary. 

I really don’t like flipped classes. I’m in one now. The in-class meeting is a mandatory waste of time. So instead of having 150 minutes a week of 100% taken time, with a flipped class it’s more like 230-300 minutes. 


If you think you might struggle, so flipped, if you feel like you can handle it as a normal class, I’d do the non-flipped.",1571200934,f3wftw7,t3_di92q6,t5_2rhsl
70,-----Kyle-----,"You know you don’t have to prove my point for me, right?",1572225341,f5jdawk,t1_f5jd84x,t5_2sumr
71,-----Kyle-----,Fuck off you brainlet,1572225227,f5jd5uv,t1_f5dtjse,t5_2sumr
72,-----Kyle-----,Not liking shit policies.,1572223377,f5jab8k,t1_f5j6jvy,t5_2rh4c
73,-----Kyle-----,My best guess is someone named Jake Werth.,1572209363,f5hzbu0,t3_dnp9w7,t5_2rhsl
74,-1928825-,Yeah but it can completely fuck over the male partner,1572172445,f5embyu,t1_f5em8id,t5_xaiot
75,-----Kyle-----,I’d go for game theory. It’s quite easy and pretty interesting,1572122458,f5bjwk1,t3_dminzs,t5_2rhsl
76,-----Kyle-----,Fuck off loser. I hope you get your ass beat if you do that.,1572120264,f5bdlkf,t3_dn0ohl,t5_2rhsl
77,-----Kyle-----,Eh she was split on it. She’d attack more ferociously than you can imagine if she really didn’t like or know who was holding her baby.,1571975515,f54a6py,t1_f53w9c3,t5_2qh1o
78,-----Kyle-----,Yikes lol. Try to be more tactical in your sarcasm next time.,1571974429,f548x7b,t1_f548tv2,t5_xaiot
79,-----Kyle-----,"Noted. 

Calling someone a liar with no basis is equally as uncivil.",1571952536,f52qqr3,t1_f52qdur,t5_2qhrn
80,-----Kyle-----,No one give a fuck about FF9. The soccer player you doofus.,1571950818,f52jcaa,t1_f2lw09c,t5_2sokh
81,-----Kyle-----,"I’ve only heard the audio recording I had no knowledge there was video.

Still no crime, still bragging, try again. Give me one actual crime. 

Tell me: if Bill Clinton was recorded saying “oh yeah they’ll let you fuck their throat under a desk” does that mean he committed sexual assault? The answer is no, in case you were wondering. 

Also, I’m not a liar you f_cking piece of sh_t.",1571949659,f52ekx8,t1_f52dlx6,t5_2qhrn
82,-----Kyle-----,"With all the hit-jobs the left has been up to, example: Kavanaugh, I think we can agree that any claims without proof can be comfortably ignored.

Also, it’s quite funny that you’re examining a private conversation as if it was a court deposition.

If you can get any girl you want like it’s nothing, you very well might tell your male friends in passing that you could “stick your dick in their mouth and they’ll just let you”. It’s fucking bragging and it’s so obvious.",1571949363,f52demm,t1_f52bnww,t5_2qhrn
83,-----Kyle-----,"Hmmm it actually sounds like a rich, powerful man saying he can come on to pretty much any girl however forward he wants. Definitely nothing about sexual assault.

It literally said “they’ll let you do it”, which implies consent, even if not spoken consent.

*next*",1571948706,f52ao6v,t1_f529hha,t5_2qhrn
84,-----Kyle-----,"Shouldn’t that be done? Don’t they owe us that? I mean if you didn’t read or see pictures of the brutality of the holocaust and just knew the body-count, it doesn’t really convey the evil and brutality of the event.",1571948170,f528f1b,t1_f4ys6k8,t5_3jxuq
85,-----Kyle-----,"That’s not what that tape said at all. Try again, perhaps applying what critical reading skills you have.",1571947973,f527s6q,t1_f527mwv,t5_2qhrn
86,-----Kyle-----,"Don’t be obtuse. I obviously mean prove the baseless claim you just made. 

If you’re calling someone a lawless walking turd you better have some hard facts, unless of course you’re a total scumbag.",1571947822,f52788i,t1_f526sd6,t5_2qhrn
87,-----Kyle-----,Prove it.,1571947630,f526ddd,t1_f4ya3qe,t5_2qhrn
88,-----Kyle-----,Thank you so much for the detailed response. I really appreciate it.,1571943691,f51ruon,t1_f51rdtu,t5_2qlqq
89,-----Kyle-----,"So I’m somewhat new to fantasy and I have a question about some discrepancies I’ve noticed when evaluating a trade.

So here’s my hypothetical trade: Odell+Tate for Nuk.

CBS trade charts has Odell and Tate at 24.5 and Nuk at 33 for 1/2 point PPR. 

Yahoo has Odell projected 118.51 points ROS and Nuk projected 96.46 points ROS.

These tell 2 very different stories and make the trade sound lopsided in either direction depending on what I go by. 

How best do you make use of these two sets of info to make a legitimately fair trade (at least fair at the time of the trade)?",1571942190,f51lqgs,t3_dmihv4,t5_2qlqq
90,-----Kyle-----,"Idk I just like to think with objective, scientific figures. It helps me at visualizing amounts and understanding results. If you prefer another method, I don’t see any issue with that at all.",1571894680,f4z4nqk,t1_f4z4714,t5_2r9vp
91,-----Kyle-----,I just like to help. Stay fried my mans [8],1571893634,f4z3prb,t1_f4z36kz,t5_2r9vp
92,-----Kyle-----,"You are absolutely correct. Calling a specific type of body reaction that behaves a certain way as a ‘half-life exponential decay’ is certainly a simplification of the real-world effect that occur. You have to think about where those chemicals are located, the medium in which they are located, and the manner in which their decomposition occurs. It is a very complicated, multi-faceted problem. 

What we generally do is fit a well known function to experimental data. Apparently (and no I’m not checking the validity of this) is that the Blood TCH concentration follows a roughly exponentially decaying function in the human body. It will never be a perfect approximation but that’s a solid place to start from. 

If we wanted the exact THC blood concentration in YOUR body as a function of time, it may very well have a different time constant, or obey a function slightly different from an exponential decay function.

Science is a game of approximations though, and this is the best function for approximating first-order reaction kinetics in a solution, so it is used to get an idea of things in the body, even if there are extraneous factors that may complicate things on an individual basis.

The relation I gave assumes 1st order reaction kinetics of THC in what I assume is an isotonic solution. Anything else and you are in the land of guesses and/or approximation— or very complicated multivariate analysis. It also doesn’t care about the behavior of previously THC engulfed neurons. It is simply gross system reaction kinetics that yield this equation and the predictions that follow.",1571891247,f4z1d6e,t1_f4z0xq1,t5_2r9vp
93,-----Kyle-----,"An exponential decay function is positive across all reals.

How about exp(-x)? Positive for all values. Second derivative is also positive for all values?",1571889497,f4yzffa,t1_f4yz8ab,t5_2r9vp
94,-----Kyle-----,"These are listed from day 1 -&gt;day 20:

100%— day 1

84.1%

70.7%

59.5%

50%— day 4

42%

35.4%

29.7%

25%— day 8

21%

17.7%

14.9%

12.5%— day 12

10.5%

8.84%

7.43%

6.25%— day 16

5.25%

4.42%

3.72%

3.12%— day 20

Also, I’ll add that calling these percentages ‘tolerance’ is not correct. It’s simply the % of THC present in the body after those points. Reaction kinetics could be more complex than what would predicate a simple half-life decay function, but I’m just going off of that presupposition.",1571889447,f4yzdby,t1_f4yywg2,t5_2r9vp
95,-----Kyle-----,"Values are wrong. The interpolation of an exponential decay function don’t act linearly like that over terms. 50% at 4 days doesn’t mean 75% at 2 days. Half life is a continuous function that decays at an exponential rate. 

The function here is %left = exp(-.1733/time) where time is in units of days. 

So if you plug in 4 days as the time, you yield .5, or 50% of the THC left from when you last smoked. But if you plug in 2 days, you get .707, or 70.7%. So 4.3% less THC in your system than what linear interpolation would get you. 

If you look at an exponentially decaying function versus a linear function, the exponentially decaying function has a positive second derivative, meaning it’s slope increases and as a result an intermediate point is actually lower than what the linear interpolation would make you believe (think of the decay function being a concave-up looking curve that intersects a line, kind of like a cartoon smile, or a letter ‘D’ turned 90° clockwise). This explains why the linear interpolation between 100% and 50%—75%, is an overestimation of the actual half life function for THC in your body.

If you care enough, I can update those percentages to real values assuming THC in the body does indeed follow a half-life function (it probably does btw).",1571888475,f4yy7z9,t3_dma8ns,t5_2r9vp
96,-----Kyle-----,I’d like to add barbacoa.,1571879585,f4ylxui,t1_f4vqtql,t5_2qzb6
97,-----Kyle-----,Well it doesn’t change much. I’m still enjoying monster energy ™️ as much as always.,1571878739,f4ykp3p,t3_dm2amj,t5_2qh1i
98,-----Kyle-----,Wouldn’t go for that considering Josh Gordon is on IR and out for the season.,1571865365,f4xgexa,t1_f4xg2fv,t5_2qlqq
99,-----Kyle-----,"1/3 point PPR 12 team. 

Trade away: Odell, Fournetter, Kelce

Receive: Michael Thomas, Dalvin Cook, Hunter Henry


Is this a worthwhile trade?",1571865325,f4xgasj,t3_dm1e9f,t5_2qlqq
100,-----Kyle-----,"12 team 1/3 point PPR

QB: Matt Ryan, Ryan Tannehill


WR: Kenny Golladay, Odell, DJ Chark, Golden Tate, Jarvis Landry, Curtis Samuel

RB: Leonard Fournette, Austin Ekeler, Royce Freeman

TE: Kelce

K: Harrison Butker 

DST: PHI


Points for: 751.15
Points against: 679.46


I’m worried about my lack of depth at RB, but I feel as though my talent at WR is such that I should be looking more into trades and less into dropping a WR for a waiver RB (not that there’s anything promising sitting there right now). I also feel that my defense isn’t helpful. 

What changes should I try to be making?",1571860253,f4wvzs4,t3_dm1ds4,t5_2qlqq
101,-----Kyle-----,I do hope you know that a ‘gun license’ literally defeats the purpose of the 2nd amendment.,1571771435,f4rthk8,t1_f1e12hm,t5_2qm21
102,-----Kyle-----,Yikes on the post lmao.,1572643152,f61nri7,t3_dq6u1z,t5_2qhrn
103,-----Kyle-----,Because reddit mobile rotated my picture for no good reason. I’m gonna delete the post and see if I can re-upload a good version.,1572629005,f60ylb0,t1_f60yjbu,t5_2w9it
104,-----Kyle-----,"I feel like there’s so much good stuff out there for you to pick from. There’s probably a list of reputable barrel manufacturers to choose from. 

Me... I bought my upper all as one piece from Daniel defense, pretty cheap as it was a quad-rail upper. The thing shoots 1 MOA which for a 16” standard barrel is great in my opinion. 

I’m sorry I don’t have specific barrels for you to buy, but that comes down to preference more than anything. Look at a reputable brand and buy something that makes sense for your use-case. It’s hard to really go wrong.",1572412731,f5s5jry,t3_dp1z16,t5_2qhc8
105,-----Kyle-----,"Yeah fuck off, we aren’t all extreme leftists like /r/politics",1572328088,f5or8wa,t1_f5nb0pj,t5_2qhrn
106,-----Kyle-----,"Did discovery find clear and obvious proof that he was in the seat of his car when he struck your vehicle?

If you don’t have that then the cops were in the right.",1572327626,f5oqwiw,t1_f56zef8,t5_2u6os
107,-----Kyle-----,"Maybe a little chunkier, but only if you like it. I would also find better chips. Looks great though, nothing wrong at all 😊",1572326952,f5oqdse,t3_czati6,t5_s87mi
108,-----Kyle-----,He’s your president as much as ours. Pledge allegiance to the flag that he’s the chief executive of over the past 3 years.,1572325957,f5opkmf,t1_f5lq2ez,t5_2qh6p
109,-----Kyle-----,Pathetic lmao.,1572325789,f5opfin,t3_doamhz,t5_2qh6p
110,-----Kyle-----,What does this have to do with Pittsburgh?,1572296512,f5n4djs,t3_dof6kh,t5_2qhrn
111,-----Kyle-----,Maybe they aren’t tolerant to pro-death views?,1572296366,f5n3ouz,t3_dobxbs,t5_2rhsl
112,-----Kyle-----,Provide me one.,1573261949,f6xy49u,t1_f6we0n7,t5_2qh13
113,-----Kyle-----,"My profs either provide a PDF of their book or the departmental book, and if they don’t they just list the ISBNs and mention in class that there’s a way to find the books out there. Really nice of them.",1573253827,f6xnzee,t1_f6wfcoe,t5_2qh1i
114,-----Kyle-----,Hahahahaha. Gross but hilarious.,1573084128,f6qrkpv,t1_f6qrhm8,t5_2qh1o
