,author,body,created_utc,id,parent_id,subreddit_id
115,-----Kyle-----,Nooooo ☹️,1572978473,f6mtbhh,t3_drncqm,t5_2qhrn
116,-----Kyle-----,I’d say a Civ E with a PE is less of an engineer than a MechE with their bachelors.,1572925656,f6l0p4p,t3_dja432,t5_2sebk
117,-----Kyle-----,Please don’t make it a qualtrics survey.,1572834426,f6h0t7h,t1_f69vbmg,t5_2rhsl
118,-----Kyle-----,You’re always unwelcome,1572834166,f6h0dyc,t1_f6d6eoy,t5_2rhsl
119,-----Kyle-----,"Is there a reason they spotted the ball more than a 18 inches behind where the ball was actually down?

Edit: fucking clowns in NY keep up the good work this season.",1572824276,f6gcg70,t3_dr6kqs,t5_2qmg3
120,-----Kyle-----,NFL~NHL&gt;&gt;MLB~NBA,1572815469,f6fkvdh,t1_f6fk5yh,t5_2qmg3
121,-----Kyle-----,Turning this shit off. What a farce of a game.,1572814742,f6fipqu,t3_dr375l,t5_2r526
122,-----Kyle-----,Not even close to catchable.,1572814498,f6fht11,t3_dr375l,t5_2r526
123,-----Kyle-----,Lmao refs are incompetent at a professional level. Completely fair hit on that bum Switzer.,1572814100,f6fgk1u,t3_dr375l,t5_2r526
124,-----Kyle-----,Almost to the point where you could say he is deliberately making bad calls in the red zone.,1572813675,f6ff9v9,t3_dr375l,t5_2r526
125,-----Kyle-----,"Seeing how that was obvious DPI, they’ll probably overturn it. 🤡🌎",1572813478,f6fehcw,t3_dr375l,t5_2r526
126,-----Kyle-----,What a joke lol. Hoyer should have negative yards.,1572812925,f6fctl0,t3_dr375l,t5_2r526
127,-----Kyle-----,Man you can’t get anything right!,1573682244,f7flxdp,t1_f7bfgjo,t5_2qhrn
128,-----Kyle-----,I sure hope you’re right and he’s not simply falling off.,1573503625,f797ewy,t1_f78xzui,t5_2r526
129,-----Kyle-----,Fuckin A is all I can comment.,1573503565,f7979j3,t1_f78ocex,t5_2r526
130,-----Kyle-----,Awesome! I probably knocked into you at genes and didn’t know. Pickle shots are great tho right? Gene is the man. Sounds like you did it all right. Not blacking on your 21st is a skillful move 😂,1573503323,f796m6c,t1_f796ccw,t5_2qhrn
131,-----Kyle-----,How’d your night go my dude?,1573502964,f795pzr,t3_du1g1d,t5_2qhrn
132,-----Kyle-----,"When my mom got remarried a couple years ago we rented out the entirety of one of the fanciest restaurants in the city with a view of the whole area at night and a specially designed cake. The actual ceremony was just about the least fancy thing you could imagine. They decided to focus on the reception being small, very close friends and family, with great food and drinks. All in all it was less than $7K which blew my mind. When she told me the plans I thought it would be like $100K or something ridiculous. I still have no idea how she made that wedding day so affordable (relatively), perhaps it is that she had a experience lol 😂",1573502148,f793nkb,t1_f6uhkuk,t5_2ugf9
133,-----Kyle-----,That video really made me sad. That kind of reaction the day you are being married to the other person. The slap wasn’t even bad it was that it made clear who she would be stuck with for the foreseeable future.,1573501833,f792uey,t1_f6upucx,t5_2ugf9
134,-----Kyle-----,BosGod continues to prosper.,1573423974,f766pu8,t3_dugua8,t5_2r526
135,-----Kyle-----,Big brain over there at your place!,1573349856,f71x2ci,t1_f71wczb,t5_2qhrn
136,-----Kyle-----,I hope so!,1573349841,f71x18a,t1_f71eztd,t5_2qhrn
137,-----Kyle-----,"Probably:

Mortar and pestle

Sois vide

Shun knife

Big all clad copper core stock pot

Espresso machine and dedicated burr grinder



Idk maybe not pretentious to most people here, but very pretentious to my college roommates.",1573342778,f71jywo,t3_dsheez,t5_2qh7f
138,-----Kyle-----,"Genes-&gt;Bootleggers-&gt;G-Door-&gt;Hemingway’s-&gt;Mario’s, preferably in that order. 

Start with two PBR big boy cans at genes for like $5.50. At boots, get whatever but I’d go with a mixed drink like a whisky and coke or rum and coke. Then to G-door you need to get a pickle shot— no alcohol flavor and a nice change of pace. Once you get to Hemingway’s... you’ll need a shot pitcher (don’t worry they’re not full strength shots and everyone gets a pitcher for themself). Mario’s is a good place to finish up, they might still give out the horns like Peters used to. At Mario’s you can’t go wrong but a Whisky sour is fine there and everyone likes them.

Happy 21st! Pace yourself big time, this is key. Genes is always a good start to get a buzz going on the cheap, then you can get 1-2 drinks at the next 4 spots.",1573333571,f70wxax,t3_du1g1d,t5_2qhrn
139,-----Kyle-----,"Omega average is 1.5*2pi radians per second, omega final is 0, from this you will find that omega initial is 6pi radians per second, using theta=omega*t+.5*alpha*t^2 you can solve for alpha or the angular acceleration.",1574189963,f82f2gy,t3_dynl6q,t5_2r6f3
140,-----Kyle-----,Show me where they are forced to work for Amazon.,1574183347,f823r3w,t1_f80rii6,t5_2qh13
141,-----Kyle-----,It’s correct,1574180835,f81zmox,t1_f81x4bx,t5_2r6f3
142,-----Kyle-----,"Factor into (tan-2)(tan+1)=0, so either must be zero. 

The answer for the first part is a*pi+arctan(2) for any integer value of a. (There is no closer form of the inverse tangent of 2). For the second, the answer is:pi/4 + a*pi where a is any integer. 

My guess is your teacher is looking for values of theta between 0-2pi, so the answer would be pi/4, 3pi/4, then the arctan(2) in the first quadrant and the 3rd quadrant in the Cartesian plane.",1574143883,f80ztri,t3_dygf8a,t5_2r6f3
143,-----Kyle-----,Of course! What do you need help with?,1574143246,f80z8ix,t3_dygdho,t5_2r6f3
144,-----Kyle-----,"If you divide or multiple in an algebraic expression, do it to EVERY term separated by an addition or subtraction. This caused me issues in 8th grade algebra big time.",1574143088,f80z38q,t1_f80ytmy,t5_2r6f3
145,-----Kyle-----,I’m sorry but I can’t seem to get it right now ☹️,1574143019,f80z0xp,t1_f80wxxx,t5_2r6f3
146,-----Kyle-----,Where are you seeing the 15? I only divided by 5 at the very end.,1574142490,f80yivg,t1_f80wxn7,t5_2r6f3
147,-----Kyle-----,I have to shower but I’ll answer this when I’m out.,1574140856,f80ww8y,t3_dyff05,t5_2r6f3
148,-----Kyle-----,3m(3n-3p). Does this make sense?,1574140765,f80wsr3,t1_f80wr1z,t5_2r6f3
149,-----Kyle-----,"Given this is 9th grade, they may want you to do the algebra to simplify the answer although the answers provided are completely correct.",1574140224,f80w862,t1_f80vvuw,t5_2r6f3
150,-----Kyle-----,Add 3m to both sides. Then divide both sides by 5.,1574139873,f80vuf4,t3_dyfkpv,t5_2r6f3
151,-----Kyle-----,"I meant 125. s*(m/s^2 ) = m/s

Nonetheless I got the answer despite the book using incorrect units, I can PM you",1574137316,f80ssiu,t1_f80sjjb,t5_2r6f3
152,-----Kyle-----,What would acceleration have units of m/s? That’s what their function for v’ shows.,1574136457,f80rp96,t3_dyequq,t5_2r6f3
153,-----Kyle-----,You need to subtract the radius of the ball from the radius of the circular track. Think of the change in height of the center of mass of the ball.,1574133040,f80n3ay,t1_f80mwk8,t5_2r6f3
154,-----Kyle-----,"Girls be looking for guys with a pedo fetish 😂, sounds like they have a thing for their dad.",1574109113,f7zdjo9,t1_f7p250h,t5_3328c
155,-----Kyle-----,Moment she grabs the board fucking clock her in the chin and make a citizens arrest for theft from persons.,1574107337,f7z9c6c,t3_dqw72j,t5_11kyfy
156,-----Kyle-----,"I know all of that, and it infuriates me. My first comment was an unrealistic wish.",1574106648,f7z7pyz,t1_f7z7iw5,t5_3jj03
157,-----Kyle-----,Not the faintest fucking clue. I just wish there was a way to support Hong Kong without escalating to war. Seems like it would be like trying to use flex-seal to fix the titanic.,1574106003,f7z6cp9,t1_f7z66ol,t5_3jj03
158,-----Kyle-----,The US should quietly deliver thousands of unserialized assault rifles to the people of Hong Kong.,1574103676,f7z108j,t3_dy38bu,t5_3jj03
159,-----Kyle-----,"5 is B. Explanation: the cooling curves will start fast as the difference between the water temperature and the air in the fridge is very different, and the rate of change of temperature will plateau as the water gets close to the temperature of the fridge. The aluminum container will cool the water faster because it is a great thermal conductor and the glass isn’t. (Think about the cold air all around suckin heat away faster through aluminum than glass).

For 6, the answer is M. Explanation: the other options are purely scientific questions (although L is certainly a difficult task). M is a question that extends beyond science and into politics and economics of agriculture.",1574102073,f7yx8e6,t1_f7ydsvg,t5_2r6f3
160,-----Kyle-----,Can you clarify which variables here are constants and which are functions (and what they are functions of?),1574101659,f7yw9ay,t3_dy72f7,t5_2r6f3
161,-----Kyle-----,I’ll wait til it’s a good enough that Apple copies it and brings the tech to the level that it’s polished enough for everyone.,1574055730,f7xfmer,t3_dw97n6,t5_3lwod
162,-----Kyle-----,"Thanks! The algebra is tricky but if you do those substitutions and solve for r, you will always get the right answer",1574040901,f7wxqez,t1_f7wx7l1,t5_2r6f3
163,-----Kyle-----,"Just plug r*cos(theta) in for x and r*sin(theta) in for y, that should do it.

I’m getting:

R(theta) = 2[sqrt(2sin(theta)*cos(theta)+3)+cos(theta)+sin(theta)]

Edit: this is correct: http://www.wolframalpha.com/input/?i=R%28theta%29%20%3D%202%5Bsqrt%282sin%28theta%29%2Acos%28theta%29%2B3%29%2Bcos%28theta%29%2Bsin%28theta%29%5D%20%20polar",1574038995,f7wv9hi,t3_dxvlie,t5_2r6f3
164,-----Kyle-----,"Omega = 4.217 rad/s

If you want an explanation let me know.",1574037709,f7wtkb0,t1_f7wq90l,t5_2r6f3
165,-----Kyle-----,"Yes, you are listening to a circuit, an electromechanical circuit. There’s a transfer function for the recording equipment, a transfer function for the playback system, and a transfer function for your hearing reception of the played signal. If a set of headphones has the same transfer function when measured as another, they will sound identical to a given individual (only because we cannot easily characterize human hearing as a transfer function). If we could characterize the transfer function of two individuals’ hearing, we could identify (or design) two different headphones that would result in them experiencing the same exact sound. The electrical properties of the cables absolutely affect the transfer function of your system, but to a vanishingly small degree. 

There is zero room here for you to ‘hear’ something not explained through science. You might bias yourself based on the equipment you are listening on to give yourself the placebo affect, but that’s all it is at the end of the day. Nothing in audio is immeasurable, besides your perception, but that isn’t important because that’s between the equipment and you and the sound that hits your ear. 

The golden ears test essentially has a series of clips and sound tests that characterize your hearing. It is quite interesting, would recommend giving it a go.",1574032108,f7wd57u,t1_f7vazei,t5_2qmiy
166,-----Kyle-----,"As long as a cable is shielded properly, it is as though a faraday cage is surrounding each conductor. Then as long as the conductor has low resistance and negligible capacitance and inductance, anything will do. You could literally use I-beams for your speaker wires as long as they are shielded, just calculate the resistance/unit length and see for yourself.",1574014854,f7uhq43,t3_dxdkwp,t5_2qmiy
167,-----Kyle-----,"An oscilloscope can analyze if a circuit is clean much better than your intuition.

By the way, you cannot hear the difference between 320kbps audio compared to FLAC. Take the golden ears test.",1574014611,f7ugk8u,t1_f7rnpb9,t5_2qmiy
168,-----Kyle-----,"For that reason I hope they don’t. Be a fuckhead, get blackballed. Freedom of speech isn’t freedom from consequences of your speech.",1573978563,f7rbzdq,t1_f7pbce3,t5_2qmg3
169,-----Kyle-----,"I’m pretty sure it was in the rules lid out for the inquiry. Could be wrong, just heard it from someone (ironic I know given the situation 😂).",1573876708,f7mxea5,t1_f7mx9sm,t5_2qh6p
170,-----Kyle-----,"I wouldn’t recommend eating there if you have any immune issues or are old or pregnant, but as someone who has eaten there an average of at least once a week since early 2016, this doesn’t dissuade me at all.",1573860275,f7mdcwe,t3_dwsmco,t5_2qhrn
171,-----Kyle-----,Yikes 😂,1573858379,f7matll,t1_f7hf9op,t5_2qt55
172,-----Kyle-----,So does that mean Schiff committed the witness tampering by reading the tweets to her despite not being allowed to?,1573852304,f7m18fh,t1_f7m0xn1,t5_2qh6p
