,author,author_flair_text,created_utc,retrieved_on,domain,full_link,id,is_reddit_media_domain,permalink,is_video,locked,num_comments,subreddit,subreddit_id,score,selftext,subreddit_subscribers,title,total_awards_received,updated_utc,removed_by,poll_data,post
71,saraperche,,2020-11-26 03:55:37,2020-11-26 03:55:48,self.exfds,https://www.reddit.com/r/exfds/comments/k17uey/permanently_banned_lol/,k17uey,False,/r/exfds/comments/k17uey/permanently_banned_lol/,False,False,25,exfds,t5_2hokp6,1,"Just got banned without an explanation. I suspect they banned me for saying I prefer Bumble because I can chose who to talk to instead of being bombarded with unwanted messages from men I'm not interested in. Or for saying that I refuse to commit to a dinner on the first date becauseInsee it as a waste of time. But anyway, there are way too many crazy ladies there and apparently mods are also not very stable. 

The idea behind the sub is great - don't  be a doormat, don't entertain time wasters and fuckbois if you are looking for a relationship, remove yourself immediately form an uncomfortable situatuon, etc. with which I wholeheartedly agree and which got me interested in the sub in the first place. 

However, even though the handbook is mostly based on commin sense and couldbe useful for women who coulduse some guidance regarding boundaries and self respect, it seams that the sub itself it's not about dating at all but rather about hating ALL men and women who enjoy intimate relationships with men and who are still interested in dating. There are hardly any posts about actual dating strategies and mostly ""see, they are all monsters"" posts. 

There are, of course, incels and shitheads who make dating a little more difficult that I'd prefer, but my overall experience is so much better than experience of 99% of women in that sub which makes me think that they are not very good at vetting and keep choosing the wrong men and confirming their bias against the whole gender. 

The observation that shocked me is that there are way too many women there who had never enjoyed sex, never had a normal, not dysfunctional relationship, have never been loved or just treated well by men, and overall had only negative experience. It's very sad and sometimes disturbing to see that many women living like that and making a conscious choice to indulge in such misery and projecting it on the world around them. Aborting male fetuses, really? Hating your own son for being born male instead of a female? This shit is not cool at all.",385,Permanently banned lol,0,,,,1
74,anxiouseverywhere1,,2020-12-18 00:54:29,2020-12-18 03:12:07,self.exfds,https://www.reddit.com/r/exfds/comments/kfajhw/question_how_does_fds_define_who_an_hvm_or_fdsers/,kfajhw,False,/r/exfds/comments/kfajhw/question_how_does_fds_define_who_an_hvm_or_fdsers/,False,False,70,exfds,t5_2hokp6,8,"This question has been bothering me about FDS, FDS is full of women who keep insisting they are HVW and they know and deserve HVM. But it seems weird because if you go through most of the posts many will keep mentioning the famous HVM but never give full-out details how to spot an HVM.

Now  I realize after reading some of their posts for a few months their version of HVM is basically a simp. They want a simp to tolerate their toxic and crazy behavior while being at their beck and call and constantly give them money. They keep making it clear HVMs have to be attractive so basically they want this attractive simp to serve them for the rest of their marriage and be happy about it. Did I sum it up exactly what they are looking for? or does anyone know exactly FDSers suppose to date (who the hell going to read all those rule books of crap to pick out a man the mods want to date). It seems like mods over there only want you to date exactly what they think it's best for you, you can't have your own opinion even though it's your dating life. Anyone else finds their HVM definition confusing and controlling?",423,Question: How does FDS define who an HVM? Or FDSers have to be with only handbook approve men?,0,,,,1
75,shedragoness,,2020-12-16 19:29:13,2020-12-16 19:29:25,self.exfds,https://www.reddit.com/r/exfds/comments/kefzih/question_should_we_all_gather_and_form_a_new_and/,kefzih,False,/r/exfds/comments/kefzih/question_should_we_all_gather_and_form_a_new_and/,False,False,13,exfds,t5_2hokp6,1,And call it something like real female dating advice or something like it? Nothing about misandry or the like?,421,Question: should we all gather and form a new and improved female centric advice subreddit that's all around inclusive?,0,,,,1
