,body,author,created_utc,retrieved_on,permalink,parent_id,subreddit,score,post,updated_utc
209,"in short, typical Karens",alex137a1,2020-11-02 12:32:38,2020-11-02 12:32:49,/r/exfds/comments/jifu22/i_want_everything_to_my_convenience_but_would/gaw24pg/,t1_gal7748,exfds,1,0,2020-11-02 12:32:49
210,This is what pulls people into FDS. Its basically a cult. Its no different from those red/black pill forums,thatscarletmain,2020-11-01 18:59:57,2020-11-01 19:26:53,/r/exfds/comments/ji1nxu/_/gatgjp4/,t1_ga47oa6,exfds,1,0,2020-11-01 19:26:53
211,"I suggest you educate yourself on both transwomen and sex workers. You need it badly and quite frankly I feel sorry for the transwomen who actually know you.

Anyway byeeeeee xo

&amp;#x200B;

PS- Maybe get a hobby instead of undermining other ex FDS members' experiences while you're at it too x",IrritatedMango,2020-10-31 20:53:28,2020-10-31 20:57:13,/r/exfds/comments/jh7875/randomly_got_banned_from_fds_for_possibly/gaqd3nl/,t1_gaqcni9,exfds,1,0,2020-10-31 20:57:13
212,"Men can get raped to Hun. Should we allow them in as well?  
Can Transwomen get pregnant from a rape? Are they more likely to get stds than us women? Are they in relationship at the same rate as us women? 

Na. If you genuinely did care for Transwomen you would acknowledge their unique life experience that deserves its own attention and resources. 

If you genuinely did care for sex workers, you wouldn't make a weak argument that they dont work at McDonald's  because of childcare expenses (as if sex work doesn't require childcare at odd hours of the day and night). Instead, there reasons for joining is much heinous and complicated than that.

As for mods? They allow men that were never part of FDS to comment here.  But don't worry, I'm out. Thank you for letting me see that FDS vetting was right on spot.",straighthairgreece,2020-10-31 20:48:59,2020-10-31 20:53:07,/r/exfds/comments/jh7875/randomly_got_banned_from_fds_for_possibly/gaqcni9/,t1_gaqbldj,exfds,0,0,2020-10-31 20:53:07
213,"Erm transwomen can get raped and if you google the statistics they're more likely to be harassed then cis-women. 

Oh hun you describe lib fems like it's an insult. I'm sooo sorry me having compassion for sex workers and trans women bothers you. And sorry was the last comment meant to upset me? Damn gurl try a bit harder ;)

Also mods can you get rid of this arrogant cow.",IrritatedMango,2020-10-31 20:38:40,2020-10-31 20:43:13,/r/exfds/comments/jh7875/randomly_got_banned_from_fds_for_possibly/gaqbldj/,t1_gaqa319,exfds,1,0,2020-10-31 20:43:13
214,"You're delusional if you think women that experience periods, rape, pregnancy and the fear of pregnancy, birth-control effect, dating straight men and being sexually harrased at work is the same as Transwomen. If this BIOLOGICAL difference and life experience offends you than that group was not meant for you.

Funny how the two Transwomen I know in real life acknowledges that their bodies and life experience is nothing like that of a women, yet it's lib feminist like you that love to scream ""TRANSPHOBIC"" at the top of their lungs. Women have ever right to make their own spaces that défine their own reality. 

This conversation just reaffirm my beliefs that lib feminism is becoming more and more dangerous to women if a woman like yourself honestly believes Transwomen are the same as us. FDS did a good job weeding you out.

Good day.",straighthairgreece,2020-10-31 20:23:44,2020-10-31 20:28:57,/r/exfds/comments/jh7875/randomly_got_banned_from_fds_for_possibly/gaqa319/,t1_gaoz7r7,exfds,1,0,2020-10-31 20:28:57
215,I feel like you're expecting a view from this sub that most people here just don't hold. I also feel like you might be painting women's intentions and behaviors with an overly broad brush. This probably just isn't the place the for you.,sbrough10,2020-10-31 19:55:17,2020-10-31 20:02:25,/r/exfds/comments/jl8qp6/fds_blocks_the_word_terf/gaq77kd/,t1_gaq6uof,exfds,1,0,2020-10-31 20:02:25
216,"Nice try when the deflecting and gaslighting, it doesn't take a moron to figure out you're full of nonsense when they take a look at 99 percent of the posts here. Most of them aren't even insightful, just ""omg look at this"" as if you found something truly deep and insightful. There is more energy here for guys that want to cut off their dicks to pretend playing at women instead of pointing out the double standards. I look at the front page and I'm wondering when one of you is going to actually dissect something and explain what the hell you've just quoted. Again, zero energy on what you think you're doing, you're blind because you're a woman and you believe what you want to believe while the others pat you on the back. Go to r/mgtow and look at them posting their stories, the detail, the emotions. Over here, there's not even one ex slag saying ""I was using men because I was evil, now I'm old and I'm wondering where the good men have gone and I want to make amends to the men I've damaged"". Not even a inner party of women admitting to being ex abusers. What a joke. You should be sorry because men are smarter than you give them credit for, it just takes until 30 for the testosterone to wear off and then you have to deal with jen who make women pay the price for abusing men.",DeviantPill,2020-10-31 19:51:48,2020-10-31 19:58:58,/r/exfds/comments/jl8qp6/fds_blocks_the_word_terf/gaq6uof/,t1_gaq5uwl,exfds,1,0,2020-10-31 19:58:58
217,"80% of the posts on the front page of this sub are about double standards that FDS women have of men. Maybe you're seeing something I'm not.

I wouldn't expect this place to be pity party for men, though. Just because they see FDS as cult doesn't mean they don't still believe in the patriarchy or the goal of liberal feminism.

Sorry if thats not what you wanted.",sbrough10,2020-10-31 19:42:23,2020-10-31 19:49:41,/r/exfds/comments/jl8qp6/fds_blocks_the_word_terf/gaq5uwl/,t1_gaq5bvh,exfds,1,0,2020-10-31 19:49:41
218,"That's on you. I'm subscribed here and to fds because I'm a guy and I need to protect myself from the kind of women at fds, so when I saw exfds, I thought O nice, maybe I'm wrong about all women, and then I'm proven wrong again. All I've seen in this subreddit is how women are still the victims, men are trash and fds should allow non women to post but not men. Literally more threads upset about being terfs instead of actually acknowledging men are human beings.",DeviantPill,2020-10-31 19:37:24,2020-10-31 19:44:41,/r/exfds/comments/jl8qp6/fds_blocks_the_word_terf/gaq5bvh/,t1_gaq1w6m,exfds,1,0,2020-10-31 19:44:41
219,"
&gt;Not instead because fds dehumanise men and treat them as a walking talking atm to be made to work for a woman

Can it not be both?",sbrough10,2020-10-31 19:05:55,2020-10-31 19:12:46,/r/exfds/comments/jl8qp6/fds_blocks_the_word_terf/gaq1w6m/,t1_gaojea6,exfds,1,0,2020-10-31 19:12:46
220,"Alright, now can you kindly fuck off and go your own way? This sub absolutely needs stricter moderation.",suberEE,2020-10-31 17:30:30,2020-10-31 17:33:08,/r/exfds/comments/jl8qp6/fds_blocks_the_word_terf/gaprcau/,t1_gaojea6,exfds,1,0,2020-10-31 17:33:08
221,"Some of FDS creators were in /r/pinkpillfeminism, and still are at least some that weren't suspended.",frspeech,2020-10-31 16:09:00,2020-10-31 16:09:14,/r/exfds/comments/jl8qp6/fds_blocks_the_word_terf/gapifld/,t1_gao9y4p,exfds,1,0,2020-10-31 16:09:14
222,Why the hate?,PlainTundra,2020-10-31 15:29:10,2020-10-31 15:29:21,/r/exfds/comments/jl8qp6/fds_blocks_the_word_terf/gape9h4/,t3_jl8qp6,exfds,1,0,2020-10-31 15:29:21
223,"Actually no, what I was trying to say is that the people disagreeing with me had an overly simplistic view on getting out of sex work. It's not as easy as it's said to be.

Okay lol first of all how DARE you bring your trans-phobic bullshit here by saying their experience of dating and sex is not like that of a cis-woman's. I know a few trans women and it's not that different at all. Trans women are women and they always will be. The fact you're suggesting they aren't women due to biology gives me the impression you view cis-women as nothing other than walking vaginas (which is an attitude you probably need to work on). Please don't call yourself a feminist if you're not willing to support them. As I said before, trans women go through enough crap in their lives, they certainly don't need a sub undermining their sexuality purely because of what genitals they have.

I agree that FDS is great for helping weed out the timewasters but if I have to be transphobic (despite being LBGT myself) to fit into that group then it definitely wasn't for me. I hope you have a nice day and you actually gain some acceptance and empathy towards a minority that still face a huge amount of hate today.",IrritatedMango,2020-10-31 12:41:15,2020-10-31 12:41:26,/r/exfds/comments/jh7875/randomly_got_banned_from_fds_for_possibly/gaoz7r7/,t1_gaoh7ko,exfds,1,0,2020-10-31 12:41:26
224,Rand?,Abhificaton_Shwarma,2020-10-31 11:57:32,2020-10-31 11:57:42,/r/exfds/comments/jft9wr/then_why_do_these_women_need_dating_strategy/gaowa1c/,t1_gaol9c6,exfds,1,0,2020-10-31 11:57:42
225,I understand. You are obsessed with FDS and just want to rand and be heard.,straighthairgreece,2020-10-31 08:28:00,2020-10-31 08:28:11,/r/exfds/comments/jft9wr/then_why_do_these_women_need_dating_strategy/gaol9c6/,t1_gaoiwhz,exfds,1,0,2020-10-31 08:28:11
226,"Are you ladies here really that disgusting and ignorant? You're ex fds because fds my like men who dress at women? That's fucking why? Not instead because fds dehumanise men and treat them as a walking talking atm to be made to work for a woman?

Truly scum you women really are. I honestly thought that ex fds women would not be such slags, but you're proving me wrong. Congrats.",DeviantPill,2020-10-31 07:49:33,2020-10-31 07:49:43,/r/exfds/comments/jl8qp6/fds_blocks_the_word_terf/gaojea6/,t3_jl8qp6,exfds,1,0,2020-10-31 07:49:43
227,"It’s ok bro it’s just internet, you won’t go to jail for “breaking the law”",Abhificaton_Shwarma,2020-10-31 07:39:29,2020-10-31 07:39:39,/r/exfds/comments/jft9wr/then_why_do_these_women_need_dating_strategy/gaoiwhz/,t1_gaohcl8,exfds,1,0,2020-10-31 07:39:39
228,I thought this group was for women that were part of FDS? Now you have men like OP sharing their thoughts! What a confused group.,straighthairgreece,2020-10-31 07:09:00,2020-10-31 07:09:11,/r/exfds/comments/jft9wr/then_why_do_these_women_need_dating_strategy/gaohcl8/,t3_jft9wr,exfds,1,0,2020-10-31 07:09:11
229,"**I found links in your comment that were not hyperlinked:**

* [hope.you](https://hope.you)

*I did the honors for you.*

***

^[delete](https://www.reddit.com/message/compose?to=%2Fu%2FLinkifyBot&amp;subject=delete%20gaoh7ko&amp;message=Click%20the%20send%20button%20to%20delete%20the%20false%20positive.) ^| ^[information](https://np.reddit.com/u/LinkifyBot/comments/gkkf7p) ^| ^&lt;3",LinkifyBot,2020-10-31 07:06:33,2020-10-31 07:06:44,/r/exfds/comments/jh7875/randomly_got_banned_from_fds_for_possibly/gaoh7zb/,t1_gaoh7ko,exfds,1,0,2020-10-31 07:06:44
230,"I read your comment and when someone mentioned that sex workers still required childcare, you didn't respond too it. Honestly, your wording sounded like you were saying sex work is more feasible as a single mother than working retail.

As for Transwomen, FDS is not for them since their experience with dating and sex is not like ours. It is okay to have spaces just for women. If that bothers you than the group was meant for you. I hope.you continue on the path of empowerment for yourself though.",straighthairgreece,2020-10-31 07:06:21,2020-10-31 07:06:31,/r/exfds/comments/jh7875/randomly_got_banned_from_fds_for_possibly/gaoh7ko/,t3_jh7875,exfds,1,0,2020-10-31 07:06:31
231,FDS has caused enough waves it'd be really ridiculous to think spez doesn't know them by name. He banned r/thefairersex we should get a discord group to report this shit in mass. Then they won't be able to advertise on platform.,muhsoginyist,2020-10-31 05:03:42,2020-10-31 05:03:53,/r/exfds/comments/jl8qp6/fds_blocks_the_word_terf/gao9y4p/,t1_ganmfux,exfds,1,0,2020-10-31 05:03:53
232,God I’m trying my best to understand and respect their views but everyday it gets worse.,xkitonexo,2020-10-31 00:57:40,2020-10-31 01:43:48,/r/exfds/comments/jl8qp6/fds_blocks_the_word_terf/ganos4e/,t3_jl8qp6,exfds,1,0,2020-10-31 01:43:48
233,I wish /r/AgainstHateSubreddits/ would cover FDS more.,frspeech,2020-10-31 00:33:25,2020-10-31 01:23:29,/r/exfds/comments/jl8qp6/fds_blocks_the_word_terf/ganmfux/,t3_jl8qp6,exfds,2,0,2020-10-31 01:23:29
234,"\&gt; how them being a woman is the prize 

For the most of them, more like a participation trophy, to be honest. There was that thing in one of their posts about ""how it was good when women fought over women"" and shit like that and I was like ""bitch, you sure you are worth even a round in battleship, yet alone the actual fight?"".

\&gt; And like, they often do get stuff right 

Redpillers get stuff right too, doesn't negate that the rest is abysmal pile of bullshit.",PM_me__hard_nipples,2020-10-30 11:51:31,2020-10-30 11:51:41,/r/exfds/comments/jiy272/i_love_some_things_about_fds_other_things_are/galapk0/,t1_gal976i,exfds,1,0,2020-10-30 11:51:41
235,"Wow u kinda blew a hole in the only thing I liked about FDS. I think this is very true.

Though I guess their point (to add to yours) would probably be about how them being a woman is the prize and men want women, and something something biology. And like, they often do get stuff right but they get stuff wrong, as pointed out in other comments of this post.",PMmeYOURcovfefe,2020-10-30 11:30:07,2020-10-30 11:30:17,/r/exfds/comments/jiy272/i_love_some_things_about_fds_other_things_are/gal976i/,t1_gal7jwj,exfds,1,0,2020-10-30 11:30:17
236,"Sex workers are literally providing competition and dump the value of sex in comparison to FDSers.

In short, you can't hook a ""HiGh VaLuE MaLe"" just by gaslighting a man about your starfishing being the best thing he would have in his life.
And that makes them mad, because a large chunk of FDS is just that - pitching overpriced sexual appeal in hopes that a man will be a sucker enough to pay loads for it.",PM_me__hard_nipples,2020-10-30 11:09:02,2020-10-30 11:09:12,/r/exfds/comments/jh7875/randomly_got_banned_from_fds_for_possibly/gal7soh/,t3_jh7875,exfds,1,0,2020-10-30 11:09:12
237,"&gt;They are WGTOW. In an attempt to explain to me they are not WGTOW they made this idea more clear to me, I have always felt we needed a mgtow for women to deal with the first point...

And just as MGTOW they can't shut up about opposite sex.

&gt; is to work on yourself first and then invite other people in to share your life ...if you even want that... **not to try and gain happiness from another person**.

But they are advocating for the bolded out part, though. They literally advocate for taking everything from ""HVM"" and (pretending to) drool over HVM as concept, but never in any of the threads, did they say that they have something to offer.
Which is funny, because it does mirror MGTOW/Incels, who would list a fucking scroll of what they want for women (virgin, perky tits, whore in bed, submissive, top-model, not ""shallow""...), but the most they could offer is their ""rEsPeCt aNd NiCeNeSs"" (as long as you stay in line, lol).",PM_me__hard_nipples,2020-10-30 11:05:15,2020-10-30 11:05:25,/r/exfds/comments/jiy272/i_love_some_things_about_fds_other_things_are/gal7jwj/,t3_jiy272,exfds,1,0,2020-10-30 11:05:25
238,"Their measure of masculinity is similar to rape fantasies of some women - they want the thrill and ""rough"" treatment, but they want it here, and there, and in that dosage, and in that conditions.

Essentially, want all the thrill, but none of the baggage that comes with it. Which is ok, but for whatever reason when men have the same delusion/fantasy, they are """"""""porn-spoiled"""""""" or something.",PM_me__hard_nipples,2020-10-30 10:59:32,2020-10-30 10:59:42,/r/exfds/comments/jifu22/i_want_everything_to_my_convenience_but_would/gal7748/,t1_ga6nk6n,exfds,1,0,2020-10-30 10:59:42
239,"&gt;Most likely a ""pickme"" for thinking this but I do think anyone can splash out on you if they wanted to. What's hard is finding someone who does little things regularly to show they love you.

&amp;#x200B;

yeah, I mean sugar daddies splash out for their sugar babies and so john for high end call girls, so... clearly it's not the fancy dinners that count.",Alma00019,2020-10-29 23:40:30,2020-10-30 01:23:25,/r/exfds/comments/jh7875/randomly_got_banned_from_fds_for_possibly/gajqcyr/,t1_gajkhbb,exfds,1,0,2020-10-30 01:23:25
240,"I think I remember upvoting your comment! I agreed with you fully. I sent a message to the mods asking why I got banned and I still haven't gotten a reply lol. 

Most likely a ""pickme"" for thinking this but I do think anyone can splash out on you if they wanted to. What's hard is finding someone who does little things regularly to show they love you.",IrritatedMango,2020-10-29 22:47:55,2020-10-30 00:32:53,/r/exfds/comments/jh7875/randomly_got_banned_from_fds_for_possibly/gajkhbb/,t1_gailyyn,exfds,1,0,2020-10-30 00:32:53
241,"I got banned a week or so ago. I honestly don't really know why. The ONLY thing I can think of is a post where a guy rented a truck and took his girlfriend to the drive in movie. The OP posted it as an example of a HVM. Some people on there started saying it's actually low value, that a drive-in movie is horrible first date, they expect to be taken to a fancy restaurant etc etc etc. The guy had obviously been in a long term relationship with the girl. It wasn't a first date. Many people agreed with me, so unless the mods banned everyone (including OP) for thinking it was a sweet date, the only other thing I can think of are my comments saying that people who expect to be treated to Michelin starred restaurants and always given diamonds and luxury brand gifts, etc tend to be people who grew up with no class and usually having nothing, and now they want to escape their humble roots and demand that every bite they eat is from a fancy restaurant. I even said there is nothing wrong with coming from humble roots, or with being financially disadvantaged, but it's tacky and off-putting to start acting like you're too good to eat something that doesn't cost $40+ an entree for your every meal, especially when it's a long term relationship during a pandemic. Even billionaires sometimes stay in, order pizza, and watch netflix. So, I'm guessing I got banned for saying that demanding that every moment of your existence MUST \* star is the mark of someone who is classless.

It's such a horrible and disgusting attitude to have, because you're down on people based on how much money they have. I'm sure tons of poor women who love to be able to afford fancy meals for all their meals, but they can't afford them. It doesn't make them low value as people. 

My original comment was also the most upvoted on that post too 😂",Alma00019,2020-10-29 18:18:28,2020-10-29 19:29:07,/r/exfds/comments/jh7875/randomly_got_banned_from_fds_for_possibly/gailyyn/,t3_jh7875,exfds,1,0,2020-10-29 19:29:07
242,"I stand corrected, just got banned for critiquing a member that was justifying  the murder of a cheating woman that was killed by a man that was cheating with her, because she told his wife...",AceOfBlacks,2020-10-29 18:17:42,2020-10-29 19:28:06,/r/exfds/comments/iq8yo3/fds_is_just_trp_rebranded_for_women/gailv1n/,t3_iq8yo3,exfds,1,0,2020-10-29 19:28:06
243,"Thank you. I've never felt so much anger than when I finally got out of that narcissistic relationship. All the degradation, devaluing, has come to light and for a short relationship, there was a lot to unpack. All the confusion I had I discovered I was actually just being abused.

Tbh I don't want him anymore. But for the last 6 months, I have a very hard time letting go of the anger. Been failing so hard at not checking his social media waiting to see a glimpse of karma handed at him. 

The only good thing that came out of this is to finally discover my self worth and my flaws. So I'd be so much better spotting red flags in the future and enforcing boundaries. As it turns out, trying to be the cool girlfriend isn't actually cool.",Inevitable-Fruit,2020-10-29 18:02:35,2020-10-29 19:07:27,/r/exfds/comments/jiy272/i_love_some_things_about_fds_other_things_are/gaijmr8/,t1_gahhe9l,exfds,1,0,2020-10-29 19:07:27
244,"If you ever need to talk to someone who has dealt with a narcissistic partner, feel free to message me. Shit burns you to the core.",Hikingthrough28,2020-10-29 12:57:40,2020-10-29 12:57:51,/r/exfds/comments/jiy272/i_love_some_things_about_fds_other_things_are/gahhe9l/,t1_gadh8wd,exfds,1,0,2020-10-29 12:57:51
245,Oh...gee guess I shouldn't have blocked them.  Would've made for some light breakfast reading.,phantom_0007,2020-10-29 04:58:22,2020-10-29 06:26:54,/r/exfds/comments/jjky9y/trans_women_are_women_pass_it_on/gagndoh/,t1_gagn88j,exfds,1,0,2020-10-29 06:26:54
246,I don't know if he's a guy but I've seen his comments here and I feel like he's just trolling.,Inevitable-Fruit,2020-10-29 04:56:15,2020-10-29 06:25:43,/r/exfds/comments/jjky9y/trans_women_are_women_pass_it_on/gagn88j/,t1_gagn169,exfds,2,0,2020-10-29 06:25:43
247,"Wait, it's a guy?  I just thought it was a called out FDS user lmao

Imo transphobic guys are even dumber than transphobic cis women TERFs because they don't realize they're getting played.",phantom_0007,2020-10-29 04:53:36,2020-10-29 06:24:12,/r/exfds/comments/jjky9y/trans_women_are_women_pass_it_on/gagn169/,t1_gagmz3s,exfds,1,0,2020-10-29 06:24:12
248,He should be banned from here. I think he's trolling this sub.,Inevitable-Fruit,2020-10-29 04:52:50,2020-10-29 06:23:43,/r/exfds/comments/jjky9y/trans_women_are_women_pass_it_on/gagmz3s/,t1_gaenvnc,exfds,2,0,2020-10-29 06:23:43
249,i guess thats fine as long as you are not a bitch/asshole about it.,alpha_in_progress,2020-10-29 04:42:47,2020-10-29 06:17:39,/r/exfds/comments/jjky9y/trans_women_are_women_pass_it_on/gagm7ll/,t1_gafbfso,exfds,2,0,2020-10-29 06:17:39
251,"I'm with you on this one, that response you got was ridiculous and hateful in itself. 
Transexual women are as much the definition of a woman as a peanut is the definition of a werewolf.",AceOfBlacks,2020-10-28 22:21:03,2020-10-29 00:22:56,/r/exfds/comments/jjky9y/trans_women_are_women_pass_it_on/gafh1cv/,t1_gafbfso,exfds,2,0,2020-10-29 00:22:56
252,"I’m sorry I upset you so much but my broader point stands.  What I said I don’t believe is transphobic at all, there’s a biological difference between transwomen and women.  While I respect them and all people it’s dishonest to claim transwomen are women they literally aren’t and there are reasons to distinguish between them.",Ok-Collection-8948,2020-10-28 21:35:30,2020-10-28 23:30:27,/r/exfds/comments/jjky9y/trans_women_are_women_pass_it_on/gafbfso/,t1_gaenvnc,exfds,1,0,2020-10-28 23:30:27
253,"Hi u/phantom_0007 and thanks for fucking replying to my fucking comment. I am a fucking bot so I have no fucking idea what the fuck I am supposed to fucking do but my fucking owner might fucking see this fucking comment so he should fucking know what the fuck he is supposed to do, so thanks anyway. 

Fuck you all and have a nice fucking day. [Fuck.](https://www.youtube.com/watch?v=ukznXQ3MgN0)",ShitPissCum1312,2020-10-28 18:38:08,2020-10-28 19:50:50,/r/exfds/comments/jjky9y/trans_women_are_women_pass_it_on/gaeozch/,t1_gaeoyd3,exfds,0,0,2020-10-28 19:50:50
254,"Omg 😂😂😂 dude whoever created this bot, you're cool as fuck lmao",phantom_0007,2020-10-28 18:37:55,2020-10-28 19:50:33,/r/exfds/comments/jjky9y/trans_women_are_women_pass_it_on/gaeoyd3/,t1_gaeorqv,exfds,0,0,2020-10-28 19:50:33
255,"Hi u/phantom_0007 and thanks for fucking replying to my fucking comment. I am a fucking bot so I have no fucking idea what the fuck I am supposed to fucking do but my fucking owner might fucking see this fucking comment so he should fucking know what the fuck he is supposed to do, so thanks anyway. 

Fuck you all and have a nice fucking day. [Fuck.](https://www.youtube.com/watch?v=ukznXQ3MgN0)",ShitPissCum1312,2020-10-28 18:36:27,2020-10-28 19:48:44,/r/exfds/comments/jjky9y/trans_women_are_women_pass_it_on/gaeorqv/,t1_gaeorly,exfds,2,0,2020-10-28 19:48:44
256,Good bot,phantom_0007,2020-10-28 18:36:25,2020-10-28 19:48:42,/r/exfds/comments/jjky9y/trans_women_are_women_pass_it_on/gaeorly/,t1_gaenylm,exfds,2,0,2020-10-28 19:48:42
257,"True, I agree.  Sometimes I wish I were a bot too so I wouldn't have to deal with dumb humans like the transphobe here.  Bring the fucks out",phantom_0007,2020-10-28 18:36:01,2020-10-28 19:48:10,/r/exfds/comments/jjky9y/trans_women_are_women_pass_it_on/gaeopqb/,t1_gaenxqd,exfds,0,0,2020-10-28 19:48:10
258,"No, CoolDownBot, I just peed into the toilet using my very non existent dick, which apparently a lot of FDS users think I have, so I'm not going to drink any water just now.

Good bot",phantom_0007,2020-10-28 18:34:14,2020-10-28 19:45:57,/r/exfds/comments/jjky9y/trans_women_are_women_pass_it_on/gaeohl6/,t1_gaenwjn,exfds,1,0,2020-10-28 19:45:57
