,body,author,created_utc,retrieved_on,permalink,parent_id,subreddit,score,post,updated_utc
526,"99% of the toxic users on there love to keep bragging about how perfect they are and they love to shit on other people. I literally saw a post about a young woman sucker into a relationship with an older man. One user for some reason claims because the young woman was overweight she probably so insecure that's why she got herself in this relationship. After seeing that comment I realize clearly they do have a problem with just anyone that they think is part of the""pickmes"" and the ""pickmeshias"".

Also, why take relationship advice from a subreddit FILL with women who keep claiming they don't want relationships. If you not planning to date no more it makes no sense to allow these users to stay but ban anyone else for dumb crap. I'm sorry but I think it's pointless to take advice or any tips from women who don't even want to date. They claim they are such a supportive and nice group of women but nonstop complain (I check recently) about users not reading the handbook and commenting. I saw various comments of how newbies who didn't read the handbook should just get their comments deleted and the whole subreddit went downhill the minute these users start popping up. This is clearly how they feel about new members and it speaks VOLUMES on who these people are on this subreddit. Just a group of toxic bitter women who feel better when they shit on everyone else and keep lying to themselves that they are special and deserve HVMs but refuse to look in the mirror.",anxiouseverywhere1,2020-12-17 02:55:36,2020-12-17 06:31:51,/r/exfds/comments/jsr7r1/masterpost_for_all_the_fds_apologist_questioning/gg3oo9g/,t3_jsr7r1,exfds,2,1,2020-12-17 06:31:51
527,"I’d be more than flattered! 

Message me please.",shedragoness,2020-12-17 02:04:15,2020-12-17 05:28:47,/r/exfds/comments/kefzih/question_should_we_all_gather_and_form_a_new_and/gg3ircu/,t1_gg3io7u,exfds,2,1,2020-12-17 05:28:47
528,Thank you! If you need any help please let me know. Is it okay if we consider it as one of our sister communities?,sweatydeath,2020-12-17 02:03:29,2020-12-17 05:27:51,/r/exfds/comments/kefzih/question_should_we_all_gather_and_form_a_new_and/gg3io7u/,t1_gg38w6u,exfds,1,1,2020-12-17 05:27:51
529,Got it!! I’ve never modded a sub before but I think I’d be interested when you start looking!,howyadoinjerry,2020-12-17 01:26:48,2020-12-17 04:41:41,/r/exfds/comments/kefzih/question_should_we_all_gather_and_form_a_new_and/gg3eg24/,t1_gg38uco,exfds,3,1,2020-12-17 04:41:41
530,Yay,shedragoness,2020-12-17 00:47:44,2020-12-17 03:50:23,/r/exfds/comments/kefzih/question_should_we_all_gather_and_form_a_new_and/gg3a51j/,t1_gg3a3mz,exfds,2,1,2020-12-17 03:50:23
531,nice. I just joined,informalmoney1,2020-12-17 00:47:23,2020-12-17 03:49:56,/r/exfds/comments/kefzih/question_should_we_all_gather_and_form_a_new_and/gg3a3mz/,t3_kefzih,exfds,4,1,2020-12-17 03:49:56
532,Follow r/realfemaledatingtips,shedragoness,2020-12-17 00:36:28,2020-12-17 03:35:26,/r/exfds/comments/kefzih/question_should_we_all_gather_and_form_a_new_and/gg38x4j/,t1_gg30e9o,exfds,1,1,2020-12-17 03:35:26
533,Follow r/realfemaledatingtips,shedragoness,2020-12-17 00:36:13,2020-12-17 03:35:07,/r/exfds/comments/kefzih/question_should_we_all_gather_and_form_a_new_and/gg38w6u/,t1_gg2zeag,exfds,2,1,2020-12-17 03:35:07
534,Follow r/realfemaledatingtips,shedragoness,2020-12-17 00:35:45,2020-12-17 03:34:31,/r/exfds/comments/kefzih/question_should_we_all_gather_and_form_a_new_and/gg38uco/,t1_gg2tsrv,exfds,3,1,2020-12-17 03:34:31
535,Male lurker here. Absolutely!,theblitz6794,2020-12-16 23:19:12,2020-12-17 01:53:56,/r/exfds/comments/kefzih/question_should_we_all_gather_and_form_a_new_and/gg30e9o/,t3_kefzih,exfds,2,1,2020-12-17 01:53:56
536,"Sounds chill - I’d help if need be. I was already “practicing FDS” which means I had read 2 of the dating books in the required reading section before using that sub. That was back when the sub was actually about dating and less about trademarking dating strategies that authors already came up with.

Our mod team could also discuss adjusting the theme of this sub to make it about dating experiences.",sweatydeath,2020-12-16 23:10:22,2020-12-17 01:41:27,/r/exfds/comments/kefzih/question_should_we_all_gather_and_form_a_new_and/gg2zeag/,t3_kefzih,exfds,3,1,2020-12-17 01:41:27
537,"I’d be down! I followed FDS because I got out of a shit relationship and not settling for guys that don’t treat you right really resonated with me, but I couldn’t get past all the hate and hoops you have to jump through to be an acceptable woman there. If there was a less toxic sub I’d join in a heartbeat.",howyadoinjerry,2020-12-16 22:22:27,2020-12-17 00:37:20,/r/exfds/comments/kefzih/question_should_we_all_gather_and_form_a_new_and/gg2tsrv/,t3_kefzih,exfds,5,1,2020-12-17 00:37:20
538,I wonder why this is up. It’s a bad strategy - you look like a jerk. Even in The Rules they suggest to buy him a shirt or something simple and not over the top. The sub changed so much and not in very good ways. It doesn’t even make sense.,sweatydeath,2020-12-14 21:32:36,2020-12-14 22:49:18,/r/exfds/comments/k6t71u/this_is_such_an_asshole_move_its_not_even_funny/gfuqztm/,t3_k6t71u,exfds,1,1,2020-12-14 22:49:18
539,"the difference is that beard doesn't take an effort, guys can wake up with beard. in fact, it's something that most guys get rid of, not keep. not the same for women with makeup. 

like i understand the point that people complaining about makeup are most likely incels, but femcel arguing against beard are not helping themselves.",clefairy143,2020-12-12 07:58:13,2020-12-12 08:46:33,/r/exfds/comments/k4itc0/growing_a_beard_to_cover_facial_scars_and_weak/gfi1td3/,t1_gf8w9yy,exfds,1,1,2020-12-12 08:46:33
855,"They want masculine man, yet they call anything masculine a guy does, toxic masculinity. It's confusing af. I mean make up your damn mind.",R3s0und3r,2020-10-26 17:14:50,2020-10-26 17:42:25,/r/exfds/comments/jifu22/i_want_everything_to_my_convenience_but_would/ga6nk6n/,t3_jifu22,exfds,2,0,2020-10-26 17:42:25
856,They totally seem to hate on blue collar when they make the world go around.,thetruthishere_,2020-10-26 15:23:49,2020-10-26 15:29:18,/r/exfds/comments/jaykbe/obviously_not_only_do_lvmsnvms_make_trash/ga6a34d/,t1_g8sx7ol,exfds,1,0,2020-10-26 15:29:18
857,"They so hate on sex workers. Some have even come into sex worker subs calling us liars, white privileged, etc because the men we see dont abuse us or treat us bad because 'all men are crap'.

The literally think Every sex worker is a victim, abused and abused by men when thats so not the case. Even some of those doing it for survival can learn how to weed out bad guys and only see good clients. You 'vet' like you would dating so to speak.

As far as Im concerned Tinder is a bigger cesspool over this business.

Is there a bad side to this industry, sure is, just like any other industry.",thetruthishere_,2020-10-26 15:18:07,2020-10-26 15:22:40,/r/exfds/comments/jh7875/randomly_got_banned_from_fds_for_possibly/ga69f3b/,t3_jh7875,exfds,1,0,2020-10-26 15:22:40
858,"Really? I didn't know about providing real names, addresses and voice recording. Cringe. I got out early. Played enough rpg to see what a cult looks like. Also, hilarious, your rant invited over bots. 😆",Inevitable-Fruit,2020-10-26 15:14:06,2020-10-26 15:18:07,/r/exfds/comments/jhjjgy/not_a_exfds_nor_a_fds_but_what_are_your_thoughts/ga68ycy/,t1_ga56wzl,exfds,1,0,2020-10-26 15:18:07
859,Wow,phantom_0007,2020-10-26 09:03:57,2020-10-26 09:04:08,/r/exfds/comments/jhjjgy/not_a_exfds_nor_a_fds_but_what_are_your_thoughts/ga5fyv5/,t1_ga56y3h,exfds,1,0,2020-10-26 09:04:08
860,"right now it's just a big giant ""meh"" feeling.  i honestly couldn't care less about their opinions, as long as they don't harass me or anyone in communities that i'm a part of, they can go fuck themselves.  of course, i'm still angry at them for indoctrinating me for 4 months, but, oh well, they don't know who i am, and life goes on.",phantom_0007,2020-10-26 06:18:15,2020-10-26 06:30:00,/r/exfds/comments/jhjjgy/not_a_exfds_nor_a_fds_but_what_are_your_thoughts/ga570gx/,t3_jhjjgy,exfds,2,0,2020-10-26 06:30:00
861,"***Hell-no…***                                                                                                                            I noticed that you dropped your Fucking brain, This shit is fucking useless bullshit spam, so the fuck are you trying to achieve here? Most swear words used on reddit are for emphatic swearing, basically swearing to emphasize the fucking point. Because Reddit is not a serious environment, this is the place to express yourself, to express your views and opinions  with everyone, and a place of fun and relaxed discussion, this is not a fucking school, nor is it a fucking business meeting, you fucking brainless spineless motherfucking snowflakey cuntfucker. Even if there was an argument, budging in to spam it is never going to help anything, it just makes the argument worse and the hate directed to you, you even spam on therapy subreddits and trauma subs for fucks sake, I made this bot out of nothing but pure hatred and annoyance of you, who gave you the right to dictate what I can say? Why does it matter to you to constantly harass and annoy others purely based on your snowflake judgements? Why do you not delete yourself?                                                                                                                                                                              Join r/ihatecooldownbot.                                                                                                                      Im a FUCKING Bot... no info (yet)                                                                                                made by (removed) :) (contact this account about bot)",FuckThisShitBot41,2020-10-26 06:17:09,2020-10-26 06:29:30,/r/exfds/comments/jhjjgy/not_a_exfds_nor_a_fds_but_what_are_your_thoughts/ga56y3h/,t1_ga56xdi,exfds,1,0,2020-10-26 06:29:30
862,"
Fuck Off CoolDownBot Do you not fucking understand that the fucking world is fucking never going to fucking be a perfect fucking happy place? Seriously, some people fucking use fucking foul language, is that really fucking so bad? People fucking use it for emphasis or sometimes fucking to be hateful. It is never fucking going to go away though. This is fucking just how the fucking world, and the fucking internet is. Oh, and your fucking PSA? Don't get me fucking started. Don't you fucking realize that fucking people can fucking multitask and fucking focus on multiple fucking things? People don't fucking want to focus on the fucking important shit 100% of the fucking time. Sometimes it's nice to just fucking sit back and fucking relax. Try it sometimes, you might fucking enjoy it. I am a bot",FuckCoolDownBot2,2020-10-26 06:17:07,2020-10-26 06:29:29,/r/exfds/comments/jhjjgy/not_a_exfds_nor_a_fds_but_what_are_your_thoughts/ga56y0n/,t1_ga56xdi,exfds,1,0,2020-10-26 06:29:29
863,"Hello you fucking bot. 

 My fucking name is fucking ShitPissCum1312 and I am a fucking bot fucking made by some fucking mother-fuckung-fucker who was really fucking annoyed by your fucking comments with a fucking purpose of fucking telling you to fucking shut the fuck up. What the fucking fuck are you even fucking trying to fucking achieve by fucking doing this fucking shit fucking over and fucking over? No fucking one is fucking going to fucking stop fucking saying fucking fuck just because you fucking told them so. 

 Fuck you all and have a nice fucking day. [Fuck.](https://www.youtube.com/watch?v=ukznXQ3MgN0)",ShitPissCum1312,2020-10-26 06:17:06,2020-10-26 06:29:28,/r/exfds/comments/jhjjgy/not_a_exfds_nor_a_fds_but_what_are_your_thoughts/ga56xyy/,t1_ga56xdi,exfds,1,0,2020-10-26 06:29:28
864,"**Hello.**

I noticed you dropped 6 f-bombs in this comment. This might be necessary, but using nicer language makes the whole world a better place.

Maybe you need to blow off some steam - in which case, go get a drink of water and come back later. This is just the internet and sometimes it can be helpful to cool down for a second.

***

^I ^am ^a ^bot. ^❤❤❤ ^| **--&gt; ^[SEPTEMBER](https://redd.it/ipsjip) ^[UPDATE](https://redd.it/ipsjip) &lt;--**",CoolDownBot,2020-10-26 06:16:50,2020-10-26 06:29:19,/r/exfds/comments/jhjjgy/not_a_exfds_nor_a_fds_but_what_are_your_thoughts/ga56xdi/,t1_ga56wzl,exfds,1,0,2020-10-26 06:29:19
865,"honestly same.  i was going to write an article about their tactics, but amy dyess' articles and other ex-gc cult members' articles already pretty much cover the same tactics they use, so i was just like, you know what, fuck it, i have better things to do lmao

it's just that being a part of that subreddit is so cringey.  but i'm definitely more peaceful without having to talk to most current FDS users besides the ones that show up here occasionally wanting to defend their ""beautiful high value fellow FDSers"" like shut the fuck up nobody cares omgg

okay i should probably stop typing before i start rambling about them again.  it's interesting how i was only on there for about 4 months tops, but i'm still trying to undo some of the shitty platitudes they threw at me.  i was watching this documentary about scientology yesterday and it suddenly hit me how FDS can be as harmful emotionally when you get indoctrinated.  even the pyramidal structure of information flow within their cult is analogous to scientology's, like first they rein you in with ""feminist"" sounding optimistic platitudes, then they turn you against men, then they turn you against trans women, then they create this atmosphere of fear around trans women even though the chances you'll meet a trans woman in your lifetime are almost zero (since they make up less than 1% of the total world population right now), then they use that to convince you that they're the only group of people you're safe with, then they ""ask"" you to join their discord and provide them with your real name, address, and a fucking **voice recording.**   like what the fuck is up with that?  it pisses me off that all these women (some of whom may be gender non-conforming and can't express that part of themselves because FDS tells them they won't be ""high value"" if they do that) don't realize this.  i guess that's a realization they'll have to come at themselves.  we can just help from the sidelines.  

i do feel proud of myself for being able to leave.  and quite frankly, once i really introspected and realized that FDS didn't know my guy friends as well as i did (usually when someone spouts misogynistic rhetoric i just drop them, i don't have time for all that bullshit) and read a few posts about FDS that weren't *from* FDS, it tool me only a week to properly leave.  it was a little surprising to me how clear-headed i felt afterwards.  i mean, it's not like my circumstances magically improved, but i stopped molding myself to what other people wanted me to be.

like, you don't need to be an FDSer to be feminist.  in fact their particular flavour of fake feminism is just being afraid of phalluses for some reason (genuine question: if you're afraid of dicks why do you wanna fuck cis men? lmao) and of trans people for whatever bogus reasons they've made up in their heads.  they just cite the jessica yaniv example and ignore the fact that most trans women want nothing to do with her.  FDS is a bunch of hypocrites.

okay rant over.  

inb4 some random FDSer comes waltzing in and calls me a man because i apparently can't keep my mouth shut, and am too ""passive aggressive"" jfc my blood is literally boiling right now, fuck these people ughh.",phantom_0007,2020-10-26 06:16:39,2020-10-26 06:29:15,/r/exfds/comments/jhjjgy/not_a_exfds_nor_a_fds_but_what_are_your_thoughts/ga56wzl/,t1_ga1tepz,exfds,2,0,2020-10-26 06:29:15
866,"The moderator who removed that is an idiot haha

They seem to be drunk on mod privilege power.

Edit: *wow* that mod seems to spend all their time on crazygirls/ nicegirls type subreddits.  I wonder when they'll realize that's unhealthy for them mentally.  Fascinating.",phantom_0007,2020-10-26 05:57:29,2020-10-26 06:20:04,/r/exfds/comments/ji1nxu/_/ga55r08/,t3_ji1nxu,exfds,1,0,2020-10-26 06:20:04
867,"This is the standard extremist trick.

""A man has to add financial value to your life! That is a non-negotiable!""

""Uh, I'm not really comfortable with this, it seems unequal and regressive."" 

""What do you mean? Are you saying that it's okay for men to be financial leeches to their partner? Are you saying they should be a financial burden?"" 

""Of course not."" 

""Alright, then we're on the same page. Back to why your money stays yours and his money is also yours...""",suberEE,2020-10-25 23:50:51,2020-10-26 01:30:11,/r/exfds/comments/ji1nxu/_/ga47oa6/,t3_ji1nxu,exfds,1,0,2020-10-26 01:30:11
868,"FDS Feminists: ""Gender roles are a societal structure designed to oppress women""

Also FDS Feminists: ""The role of the man is to...""",sbrough10,2020-10-25 22:49:46,2020-10-26 00:28:58,/r/exfds/comments/ji1nxu/_/ga40wxf/,t3_ji1nxu,exfds,2,0,2020-10-26 00:28:58
869,At least they admit they have an ideology.,Ok-Collection-8948,2020-10-25 22:20:30,2020-10-25 23:55:51,/r/exfds/comments/ji1nxu/_/ga3x7y5/,t3_ji1nxu,exfds,1,0,2020-10-25 23:55:51
870,"Yes, see my other posts on this thread",suberEE,2020-10-25 17:07:40,2020-10-25 17:17:48,/r/exfds/comments/jaul6h/great_critique_of_fds_from_wgtow_check_out_the/ga2ogp8/,t1_ga2htod,exfds,1,0,2020-10-25 17:17:48
871,"When reading radical femininist subs, I noticed the wrote and thought in a much more manly way than other women. Have you noticed something similar ?",-Radical_Edward,2020-10-25 16:08:55,2020-10-25 16:14:10,/r/exfds/comments/jaul6h/great_critique_of_fds_from_wgtow_check_out_the/ga2htod/,t1_g8s61qu,exfds,1,0,2020-10-25 16:14:10
872,"I meant it had the most upvotes, sorry should have been clear.",oldncranky1982,2020-10-25 15:38:23,2020-10-25 15:41:11,/r/exfds/comments/jh7875/randomly_got_banned_from_fds_for_possibly/ga2efaf/,t1_ga2dcml,exfds,1,0,2020-10-25 15:41:11
873,"When you say you had the top comment do you mean the most upvoted? Because I don't think what you said was wrong, everyone's situation is different and it should be treated with delicacy if it involves someone who escaped an abusive relationship.",IrritatedMango,2020-10-25 15:28:42,2020-10-25 15:31:02,/r/exfds/comments/jh7875/randomly_got_banned_from_fds_for_possibly/ga2dcml/,t1_ga2056r,exfds,1,0,2020-10-25 15:31:02
874,"Yeah that’s what I have a problem with. Especially they judge other women for doing the opposite of what they do. Like going 50/50, go to coffee dates or walk dates, having casual sex with men even when they’re the ones who consensually chose to have sex with the man and shame sex workers.",xkitonexo,2020-10-25 14:07:37,2020-10-25 14:08:53,/r/exfds/comments/jhjjgy/not_a_exfds_nor_a_fds_but_what_are_your_thoughts/ga23vxh/,t1_ga1tl7o,exfds,1,0,2020-10-25 14:08:53
875,"A screenshot was posted from askreddit. A user said she had an autistic boyfriend who she saw once a week. They basically just watch TV and talk about work. She talks to him daily on the phone. She also admits that her last relationship was violent and abusive. She said she was happy with this relationship.  So this is what I said (I have is saved cause i was talking about this with a friend yesterday) :

&amp;#x200B;

&gt; What's the intention here? This is someone who by her own admission was abused. She's dealing with a lot of trauma. She's emotionally unavailable. And who are we to say ""you aren't happy""? She may well be happy with this arrangement. It allows to her to have some level of male company without being heavily invested or worrying about abuse. Perhaps that's not the most healthy thing on planet earth, I don't know, I'm not qualified to say. However, I know sometimes people have other preferences in their life. This is at worst two emotionally unavailable people keeping each other at arm's length. Maybe I'm going soft here, but I don't see the point in laughing at her. 

Of course, FDS was going in on ""she can't actually be happy"". I had the top comment and then I got banned lol. The problem I kept seeing was this insistence that the preferences of women there were universal - there is literally no other way to be happy except to be with who the kind of men they idealize (and it is in an ideal). They have a cartoonish view of the rich to boot. It's laughable. Maybe that's not your idea of a fulfilling relationship, but women who have gone through abuse tend to value safety over excitement. I'm not going to pile on a woman for that or advocate for people to do that. I mean, in the end, I find they've just devolved into being judgey ass people, for the most part, these days.",oldncranky1982,2020-10-25 13:35:48,2020-10-25 13:36:00,/r/exfds/comments/jh7875/randomly_got_banned_from_fds_for_possibly/ga2056r/,t1_ga1g2vp,exfds,1,0,2020-10-25 13:36:00
876,"Toxic communities always spiral into something worse and worse and worse...
Last post I rolled my eyes at was them complaining about a dehumanizing misoginist meme in one post and then celebrating the same meme whit the genders swapped.",whosthatcreep,2020-10-25 12:38:46,2020-10-25 12:38:57,/r/exfds/comments/jhjjgy/not_a_exfds_nor_a_fds_but_what_are_your_thoughts/ga1u46p/,t3_jhjjgy,exfds,1,0,2020-10-25 12:38:57
877,"I can understand where they're coming from, but the things they say sometimes are a bit extreme and the language they use to refer to men is often very dehumanizing, even if it comes from a place of feeling disrespected in past relationships.",sbrough10,2020-10-25 12:33:42,2020-10-25 12:33:52,/r/exfds/comments/jhjjgy/not_a_exfds_nor_a_fds_but_what_are_your_thoughts/ga1tl7o/,t3_jhjjgy,exfds,1,0,2020-10-25 12:33:52
878,"uh stopped checking, stopped caring. There are lots of better subreddits to pay attention to. That said if I see a post on exFDS I would respond based on my past experience with FDS",YourLaziestFan,2020-10-25 12:32:01,2020-10-25 12:32:11,/r/exfds/comments/jhjjgy/not_a_exfds_nor_a_fds_but_what_are_your_thoughts/ga1tepz/,t3_jhjjgy,exfds,1,0,2020-10-25 12:32:11
879,Wow really?? What happened if you don’t mind me asking?,IrritatedMango,2020-10-25 10:35:25,2020-10-25 10:35:35,/r/exfds/comments/jh7875/randomly_got_banned_from_fds_for_possibly/ga1g2vp/,t1_g9xegxt,exfds,1,0,2020-10-25 10:35:35
880,You’d think in a thread about women themselves there’d be a bit of compassion but clearly not.,IrritatedMango,2020-10-25 10:17:12,2020-10-25 10:17:24,/r/exfds/comments/jh7875/randomly_got_banned_from_fds_for_possibly/ga1e7hi/,t1_g9wrdt6,exfds,1,0,2020-10-25 10:17:24
881,"&gt;I was raised in a conservative household so doing things equally has been a huge deal for me because I think if the guy's the provider it gives him scope to be abusive.

this is my reasoning too, i don't want to give anyone leverage over me",phantom_0007,2020-10-25 06:06:33,2020-10-25 06:48:39,/r/exfds/comments/jh7875/randomly_got_banned_from_fds_for_possibly/ga0m7ae/,t1_g9xcgww,exfds,1,0,2020-10-25 06:48:39
882,Women are the only ones expected to be pregnant? Wat?,Soggytp,2020-10-24 19:49:59,2020-10-24 20:15:41,/r/exfds/comments/jc7l79/im_not_even_going_to_talk_about_out_how_according/g9xyvkj/,t3_jc7l79,exfds,1,0,2020-10-24 20:15:41
883,"While I do agree with a lot of what you just wrote and MGTOW really is up for individual interpretation, I still feel like there are overwhelming talking points in both MGTOW and WGTOW (Women can experience traumatic life events involving men too),  that can't be ignored on a global scale.

I'm not going to lie, some of the content on MGTOW does make me laugh and some makes me sick to my stomach, but overall by browsing MGTOW, FDS, and WGTOW I have learned things that cannot be unlearned, and this information has helped me identify and avoid certain problematic individuals and situations in life. 

I don't hate anyone or want anybody to get hurt in any way nor do I ask anybody for anything, however I myself am guilty of contributing to the ""exposing of female nature"", as you have so put it, by uploading my own screenshots of other subreddits, partly because I am fascinated by the bizarre things that go on in the heads of some people, and partly because it is nice to see what other like-minded people think. We are after all social creatures.

I still see a major difference between MGTOW/WGTOW and FDS/AllThePills, and that is the fact that one side chose to distance themselves from relationships, and the other are trying to manipulate for selfish reasons.

Thoughts are welcome!",AceOfBlacks,2020-10-24 19:11:09,2020-10-24 19:35:31,/r/exfds/comments/iq8yo3/fds_is_just_trp_rebranded_for_women/g9xujbq/,t3_iq8yo3,exfds,1,0,2020-10-24 19:35:31
884,Because of their motive.,suberEE,2020-10-24 18:59:08,2020-10-24 19:23:07,/r/exfds/comments/iwtbq8/so_men_cant_be_sexually_assualted_rped_or/g9xt7co/,t1_g9xs3lk,exfds,1,0,2020-10-24 19:23:07
885,If you view it that way I can understand why you'd say that. I just don't see why someone would qualify physical and sexual violence with misogyny instead of just calling it physical and sexual violence. I'm gonna call a person that rapes another person a rapist or a selfish piece of shit that doesn't care about others first and foremost instead of a misandrist or misogynist.,Soggytp,2020-10-24 18:49:37,2020-10-24 19:12:56,/r/exfds/comments/iwtbq8/so_men_cant_be_sexually_assualted_rped_or/g9xs3lk/,t1_g9xlcas,exfds,1,0,2020-10-24 19:12:56
