,author,author_flair_text,created_utc,retrieved_on,domain,full_link,id,is_reddit_media_domain,permalink,is_video,locked,num_comments,subreddit,subreddit_id,score,selftext,subreddit_subscribers,title,total_awards_received,updated_utc,removed_by,poll_data,post
55,phantom_0007,,2020-11-12 08:35:04,2020-11-12 08:35:15,self.exfds,https://www.reddit.com/r/exfds/comments/jsr7r1/masterpost_for_all_the_fds_apologist_questioning/,jsr7r1,False,/r/exfds/comments/jsr7r1/masterpost_for_all_the_fds_apologist_questioning/,False,False,8,exfds,t5_2hokp6,1,"In the interest of not endangering users here or opening ourselves up to TERF/ MGTOW brigades, I won't be posting links from the actual FDS subreddit.  Instead I'll be posting some compilations I've found over the last few months.

First, I'd like to get some obvious points about FDS out of the way that are unrelated or loosely related to the 'hate' part.

1. the flair 'FDS Rescue Mission' was used to brigade subreddits like r/AITA and r/relationships and other relationship advice subreddits under the guise of ""rescuing p\*ckmeishas"" (note that the definition of ""p\*ckmeisha"" itself varies depending on who you talk to and how much of a TERF they are)
2. the flair 'Male Depravity' was used to systematically indoctrinate FDSers into thinking that AMALT (""All Men Are Like That"").  Instances of men being abusive are documented here.  While I was on the subreddit, there was an appeal to the moderators to remove the flair because it was affecting the mental health of a lot of users adversely.  The moderators told us to ""filter the flair"" which is something that can only be done when you're on the subreddit itself, and not from your Reddit main feed/ homepage.  As a ""female"" dating strategy subreddit, I don't think it was out of line for us to expect that our needs be taken care of by the moderators first, since most women already agreed that posts appearing under the 'Male Depravity' flair showcase, well, sufficiently depraved behaviour (like sexual harassment, rape, FGM -- female genital mutilation, child molestation etc) for us to never ever date these men.  So it was a bit of a useless flair, and the comments always turned to AMALTing anyway, and some Newbies (including me) didn't like that because we knew that, well, NAMALT. **NOTE**: **this flair has also been used against trans women in the past! (obviously, this qualifies as hatred)** Something else to think about is how, in order to avoid potentially triggering content, FDS users are forced to stay on the subreddit and browse FDS only.  
3. their Twitter account, [@FemDatStrat](https://twitter.com/FemDatStrat), retweets almost exclusively from TERFs and transphobic Twitter accounts.  Liberal feminists (or ""libfems"" in femcel speak) are regularly degraded in these retweets.  This, however, can't be used against the subreddit itself because we don't know which of the moderators runs that account.  It's quite possible that FDS just happened to be infiltrated by TERFs and wasn't originally intended for that purpose, but it must be noted that if you do want to at least pretend to support trans people, you would ban TERFs from your subreddit, which is something FDS does not do.  (**Also hate)**
4. The 'Roast-A-Scrote' flair has been used to shame plus-sized men, men with undiagnosed mental illnesses, and also to dox men.  Names and photos aren't blurred out.   Personally I detested this flair when I was on FDS.
5. The flair 'Scrotation Report' is a classic gender reversal of the MRA/ PUA/ incel 'plate spinning' rhetoric.  FDS says women should stay away from men who date multiple women, but don't refrain from encouraging their users to date multiple men themselves.  There is a common thread of dehumanizing the opposite gender (doesn't matter to them if said members of the opposite gender is a chill person or an abuser).  MRA/ MGTOW/ PUA/ incels like to make arbitrary rhetorical excuses when called out on this dehumanization.  FDS and MGTOW users both use random unrelated events to bolster their generalist sexist rhetoric.  Frequently, on both types of fora, racist hatred is seen, sometimes propagated by people who belong to that race themselves.  (Sorry, I don't know the proper term for this, English is not my first language.  But basically it's r/AsABlackMan material.)  A lot of... dick shaming (like actual penis shaming where FDSers wax eloquent about how PENIS MAN BAD) also happens on this flair.
6. the flair 'Cockholm Syndrome' is used as a proxy flair to dehumanize women who don't conform to FDS's arbitrary standards for not being a ""p\*ckmeisha"".  How do we know the standards are arbitrary?  Because whenever you ask an FDSer what characterizes a ""p\*ckmeisha"" they'll throw some random feminist buzzwords at you (which have actual academic definitions, btw, but it's not like FDSers care about that anyway \*rolls eyes\*) and will contradict themselves in the next comment.  We can see this happening in real-time on this subreddit sometimes.  Come watch the show!
7. FDS thinks everyone on here is a cis man.  This speaks for itself, really.  If you search for exfds using the Reddit search bar, you'll see a recent post about how ""male LARPers"" (I don't know exactly who this is talking about) ""crying about getting banned from FDS at r/exfds"".  And if you consider how 'stringent' the mods claim to be about doing background checks to see if new members are cis women or not, shouldn't there *not* be as high an influx of cis men as they claim there is?  So are the mods very competent, or are they incompetent?  Which one is it?
8. Back when I was on FDS, the mods were heavily advertising for some sort of official FDS Discord server.  To join the Discord server, you had to provide a photo of yourself with your Reddit username (or something along those lines, probably your real name), proof of address or a voice recording.  [TERF groups have used this recruitment tactic in the past.](https://www.pinknews.co.uk/2020/05/17/terf-gender-critical-feminism-movement-lesbian-cult-amy-dyess-transphobia/) (TW: documentation of extreme transphobia, homophobia, cults, ""gender critical"" cults, online transphobia, international transphobic coalitions, indoctrination, exploitation of vulnerability.  You'll probably feel like shit after reading this article.  Amy Dyess has published a few articles about their time in the GC TERF ""movement"" and how it affected them.)  [This is another article about how TERF cults gaslight women into believing they're the only ""safe"" group to hang out with](https://medium.com/@amydyess83/last-pride-a-lesbian-showed-me-gender-critics-were-using-us-c10bad16e9f9).  (TW: gaslighting, extreme homophobia, racism, sexism, mlm exclusionism, cult tactics, TERF rhetoric)
9. [What happens when a lesbian goes against the GC herd? They crucify her.](https://medium.com/@amydyess83/last-pride-a-lesbian-showed-me-gender-critics-were-using-us-c10bad16e9f9)   What happens when an FDS user goes against the FDS herd?  They get downvoted to oblivion and flaired ""p\*ckmeisha,"" as we have seen from screenshots posted on this subreddit.  (TW: extreme transphobia and cult tactics.  As always, the GCs have nothing else to do except fearmonger about THE TRANSSS and THE GAYSSS and THE PENISSSS.)

Enough dunking.  Now for the receipts.

[An r/ unpopularopinion post causes mods of r/ femaledatingstrategy to lock down the sub](https://www.reddit.com/r/SubredditDrama/comments/ik8of4/an_runpopularopinion_post_causes_mods_of/) If you go to this link and click through the thread on r/ unpopularopinion, you'll find a guy detailing his experiences dating someone who was on FDS.  Needless to say ***\*narrator voice\**** that shit was pretty bad.  SRD is a pretty chill subreddit though, people there just laugh at everything.  Also no hate speech is allowed, unlike most of the rest of Reddit, which is a very welcome change from being called a ""White man's wh\*re"" because you decide not to date misogynists who happen to be POC.  Sweet mother of God, u/spez really needs to get his shit together and stop wanking to the next Hot racist sexist Nazi subreddit (sorry, spez, but you had a chance to fix this and you still haven't.  Very annoying for the snowflakes like us who'd rather not be targeted by racist hatred online).  

ANYWAY

[FemaleDatingStrategy using religion as an excuse to make men pay for everything, shaming men and women that want egalitarian relationships.](https://www.reddit.com/r/AgainstHateSubreddits/comments/jrta87/femaledatingstrategy_using_religion_as_an_excuse/)   

[we got a FEMCEL sighting in AreTheStraightsOK when a user dedicates 80 HB9 children to defending /r/ FemaleDatingStrategy](https://www.reddit.com/r/SubredditDrama/comments/ixarh1/we_got_a_femcel_sighting_in_arethestraightsok/)

[r/ FemaleDatingStrategy is the women's equivalent of the ""redpill"" filled with bad advise and shouldn't be viewed as a positive community.](https://www.reddit.com/r/librandu/comments/jn3vtp/rfemaledatingstrategy_is_the_womens_equivalent_of/)

 [r/ FemaleDatingStrategy mods tried to do damage control by saying they were not trans-exclusive. Post history says otherwise.](https://www.reddit.com/r/AgainstHateSubreddits/comments/ir28xg/rfemaledatingstrategy_mods_tried_to_do_damage/)  (this is from a former FDS mod who has since left the subreddit.  Hi!) 

 [Crosspost from r/ Femaledatingstrategy. This subreddit routinely posts this delusional content.](https://www.reddit.com/r/EntitledBitch/comments/hnj2ja/crosspost_from_rfemaledatingstrategy_this/) 

[r/ FemaleDatingStrategy is run by mods that routinely spread their transphobic ideals on Reddit](https://www.reddit.com/r/AgainstHateSubreddits/comments/iady9k/rfemaledatingstrategy_is_run_by_mods_that/)

 [I’m irritated with the consistent homophobia on r/ femaledatingstrategy.](https://www.reddit.com/r/bisexual/comments/iu7w4i/im_irritated_with_the_consistent_homophobia_on/) 

 [JU from r/ FemaleDatingStrategy for being anti polyamory](https://www.reddit.com/r/JustUnsubbed/comments/irn3ef/ju_from_rfemaledatingstrategy_for_being_anti/)

 [Fitncurly used the n-word (hard-R) on /r/ FemaleDatingStrategy!](https://www.reddit.com/r/nworder/comments/jpmlya/fitncurly_used_the_nword_hardr_on/) **(this is so incredibly racist.  I can't even.  do people not realize Black women are also women?!  wikipedia page about this song title says:**  Due to its use of an offensive racial epithet and what was perceived as an inappropriate comparison of women's rights to the oppression of African-Americans, most radio stations in the US declined to play the record.**)**  

 [Two posts from FemaleDatingStrategy](https://www.reddit.com/r/blatantfuckingsexism/comments/isua89/two_posts_from_femaledatingstrategy/) 

 [The same sub that says men don't have options also says that men have plenty of options. Inconsistent ideology and sexists, name a more iconic duo.](https://www.reddit.com/r/im14andthisisdeep/comments/iqp877/rfemaledatingstrategy_is_a_goldmine_for_this_kind/)

 [The problem with FDS.](https://www.reddit.com/r/wgtow/comments/j9v98a/the_problem_with_fds/)  (personally I dislike this subreddit, but they raise some good points.  I don't agree with that last paragraph though.) (TW: WGTOW material, misandry.  Better if you don't read the comments, there's an FDSer in there.)

 [6 days ago, there was a post on a post from r/ femaledatingstrategy, which I didn't get, but apparently was already annoying. But take a moment to read this. Because it's way worse.](https://www.reddit.com/r/HateSubsInAction/comments/jhgyyl/6_days_ago_there_was_a_post_on_a_post_from/)

 [R/ FemaleDatingStrategy Starter Pack](https://www.reddit.com/r/starterpacks/comments/i787aa/rfemaledatingstrategy_starter_pack/) (for the laughs, sifting through FDS content is very taxing on the psyche)

 [Founding mod of FemaleDatingStrategy gets downvoted to oblivion by own members after saying that lube is not a good remedy for vaginal dryness](https://www.reddit.com/r/SubredditDrama/comments/gd78lq/founding_mod_of_femaledatingstrategy_gets/) (another SRD thread!  thank goodness)

 [CMV: /r/ femaledatingstrategy is an atrocious subreddit for struggling females, and breeds toxicity](https://www.reddit.com/r/changemyview/comments/hfpekz/cmv_rfemaledatingstrategy_is_an_atrocious/)

[Minor Evidence that FDS brigades other subreddits](https://www.reddit.com/r/SubredditDramaDrama/comments/ikv5jz/user_shows_up_to_defend_femaledatingstrategy/)

 [Ladies be careful of the miserable, entitled and narcissist women over at r/ femaledatingstrategy](https://www.reddit.com/r/dating/comments/gf0oq6/ladies_be_careful_of_the_miserable_entitled_and/)

[Just Unsubbed from r/ FemaleDatingStrategy. Yeah, I know. I found solace there as someone who’s kind of jaded by dating, but they’re completely deluded and I know that now. And in no way is it a woman’s fault for being murdered because she was a “pickme”.](https://www.reddit.com/r/JustUnsubbed/comments/ieqhvt/just_unsubbed_from_rfemaledatingstrategy_yeah_i/) (FDS misogyny on display)

 [CMV: r/ FemaleDatingStrategy is a toxic, hateful sub filled with bad advice and shouldn't be viewed as a positive community on reddit.](https://www.reddit.com/r/changemyview/comments/fof2q9/cmv_rfemaledatingstrategy_is_a_toxic_hateful_sub/) Only comments defending FDS are from FDS users or from people who don't know what FDS is.

 [An oldie but a favorite of mine. Banned from r/ FemaleDatingStrategy cause I asked what a person brought to the table when she demanded $100+ dates.](https://www.reddit.com/r/banned/comments/hk1iiq/an_oldie_but_a_favorite_of_mine_banned_from/)

Someone on here said I should ""engage with FDS rhetoric and debunk it because that's the only viable way to get women to leave"" (paraphrasing).  Fuck no, I'm not going back to that sinkhole ever again, even if it's just to see what they think.   If you're a decent, not homophobic, not transphobic, not racist person, you'll leave on your own.  Being in FDS in 2020 for more than a year is like being in Scientology because some rando celebrity believes in it.  

Remember the rules: **No excessive FDS sympathizing is allowed.**  

This post will be edited as I find more links.  Bye now, I have shit to do.",323,"Masterpost for all the FDS apologist/ questioning people who are uncertain whether or not FDS qualifies as a hate subreddit. CW mention of transphobia, homophobia, racism, misogyny, sexual assault, rape, etc.",0,,,,0
57,Mellymel1030,,2020-11-12 00:53:26,2020-11-12 00:53:37,self.exfds,https://www.reddit.com/r/exfds/comments/jskog3/i_survived_fds/,jskog3,False,/r/exfds/comments/jskog3/i_survived_fds/,False,False,2,exfds,t5_2hokp6,1,"I recently got banned for speaking up about how women need to have a discussion of their likes and dislikes about sex before having sex with someone and how you should get to know your own body so you can tell your partner what you need. (Unlike their comments about how men are bad at sex. anyone can be if you don't speak up about what you want. They sound like a lot of women who are limp fish in bed)

Too many women on there complain about how shitty common sex acts are and how men are so unclean. Literally,  are they scaping the bottom of the barrel? I've had plenty of sex in my 39 years and have never once had the complaints these women have. They bitch about wanting a HVM, but clearly they are low value or you wouldn't attract such low value men. 

Sure many of them are trying to improve themselves and yes we should have standards but the creators and moderators give women such a bad name. I'm so embarrassed for them. 

In the end, I realized by the comments that many of these women have been abused in relationships and struggle to find an identity and are right back in the cycle of latching into another unhealthy relationship (with FDS) and having someone tell them how to think and act. 

I'm embarrassed that those women represent us.",306,I survived FDS,0,,,,0
58,22morfeen22,,2020-11-12 00:51:36,2020-11-12 00:51:47,self.exfds,https://www.reddit.com/r/exfds/comments/jsknbu/so_whiny/,jsknbu,False,/r/exfds/comments/jsknbu/so_whiny/,False,False,3,exfds,t5_2hokp6,1,"omg i cant believe you folks getting so butthurt about fds. that sub is just teaching girls how to avoid the bottom feeders of the male dating pool so to speak, and also having fun and memes and whatnot, and youre like 'ban them'.

honestly, you fellas need to grow a cock tbh. the only thing i can think of why you want them banned is coz you're worried about the effects of fds on previously winnable lvw's

also, if you censor this post, you can never diss people wanting safe spaces again.",306,so whiny,0,,,,0
63,RachelStorm98,,2020-11-07 13:56:35,2020-11-07 13:56:45,self.exfds,https://www.reddit.com/r/exfds/comments/jpr8at/im_an_ex_fdser_i_wanted_to_share_my_story/,jpr8at,False,/r/exfds/comments/jpr8at/im_an_ex_fdser_i_wanted_to_share_my_story/,False,False,60,exfds,t5_2hokp6,1,"First post on this subreddit. I am so glad that this subreddit exists. ❤ I hope more women someday will wake up and see that FDS is a terrible subreddit and that they will leave the toxicity and come here instead. 

I wanted to share my story on this subreddit. 

I was banned from FDS last night with no warning and wondered what the hell I could of have possibly done wrong because I followed all of their ridiculous strict as fuck rules, and I got banned from there all because in the FDS chatroom I said I was going to make a subreddit teaching men how they could be a HVM (and learn to be good men, if they struggle with things.) Instead of being supported *gasp* I thought they loved HVM! 🙄 I got jumped on and I'm sure some of the ladies in that chatroom reported me to the mods and I got banned. I messaged the mods finding out at least why I got banned. No response, OFC. I was so angry at first that I had to go and journal to try to calm myself down. I'll admit, I was vulernable to them... I recently got my heartbroken nearly 2 months ago and I thought that FDS was the way to go. Now I see that it's not the way to go. I now saw the subreddit for what it really is... A toxic, hateful subreddit towards men and women. I have lurked FDS for almost a year, so I have seen a lot of things. 

They are misandrist. I thought maybe they would like at least some men. Nope. They hate ALL men. Even the HVM from the few snippets I have come across. That and the reason I was banned solidifies that point. They hate ALL men. Even HVM. They even so much as think that HVM don't even exist... What even... They have no right to call themselves feminists. They are feminazis. 

They are Misogynistic. Believe it or not, FDS is also misogynistic because they are inwardly misogynistic towards women. They hate pickmeishas or any woman that doesn't agree with FDS or follow FDS THEIR way or 100%. They hate sex workers and trans women. 

They are Ableist. I have aspergers syndrome and am on the autism specturm. All of the hate towards people with autism is DISGUSTING! It's insulting for someone who actually has it to see all of that shit. It's hurtful. They also are Ableist towards anyone that is ADHD, neurodiverse, or has any kind of mental illness... 

I have heard some stories saying that they are also homophobic, racist, and transphobic. The thing I know for sure is that they are SWERFS and TERFS and that the hate transgendered folk and that they are not allowed near that subreddit with a ten foot pole. 

I have seen them make male genocide comments ages ago... I remember browsing almost a year ago and on a post about abortions they said something about ""aborting all male babies."" And I felt that was so fucking disgusting! I would NEVER abort my baby if I found out it was gonna be a male. I would love him, just like I would still love the child if it was a female. 

I am honestly so surprised Reddit hasn't banned or quarantined them yet... They should be! Just like GC and PPF and even the male subreddits that got banned like Red pill, Incels, and MGTOW... They are nothing but a hate group. 

And they say they are nothing like the Red Pill. Yeah right. They are the female equilivillent. 

The only good thing I liked about FDS was the fact they promote trying to level up and avoiding bad men and unhealthy relationships. Common sense shit that you could probably find on another subreddit. 🙄 The rest of it is a dumpster fire. They just complain about men and Pickmeishas. 

Goodbye FDS! Thank you for banning me. I am glad to be freed from your toxic ass subreddit. Oh and btw... I did make my own subreddit. I hope it will grow someday. 💁

What is your Ex FDS story? Why were you banned? Is your life better without that subreddit?",287,I'm an EX FDSER. I wanted to share my story.,0,,,,0
68,Momdieddontbemean,,2020-12-01 18:04:40,2020-12-01 18:04:51,self.exfds,https://www.reddit.com/r/exfds/comments/k4q9zw/hey_guys_questions_for_former_members/,k4q9zw,False,/r/exfds/comments/k4q9zw/hey_guys_questions_for_former_members/,False,False,6,exfds,t5_2hokp6,1,"FDS seems classist. An ex-question that wouldn’t get posted on FDS.

Full disclaimer: I am a man. Leftist / I admit we live in a patriarchy. I’d love some honest answers and feedback.

1.

The whole concept of a HVM and anticipating men to pay for most everything is absurd. I can understand if, when looking for a long term relationship, you want somebody to be stable. But doesn’t this discount all the potential HVMs that are struggling financially? I mean isn’t the economy in utter shit? Especially for young people, having to set aside income for student loans, as well as a deteriorating job market, it seems to me the concept of “poverty” on /r/FDS associated with a lack of ability and character flaws as opposed to anything substantive.

I just don’t understand how you can subscribe to the belief in a patriarchy (which in my eyes seems fairly leftist and “woke”) and not acknowledge society’s disenfranchisement of the poor.

2.

Wouldn’t a lot of “high value males” see a rigorous philosophy regarding men and dating as a negative quality within a woman? I mean we understand how women feel about MGTOW and TheRedPill. Why wouldn’t it go both ways?


I’m asking these questions in good faith and /r/askFDS won’t bite at all. Let me know what you all think.",393,Hey guys! Questions for former members:,0,,,,1
70,MyDarlingGirl,,2020-11-27 17:51:20,2020-11-27 17:51:30,self.exfds,https://www.reddit.com/r/exfds/comments/k25x2h/does_the_avoidantpassive_approach_to_dating_that/,k25x2h,False,/r/exfds/comments/k25x2h/does_the_avoidantpassive_approach_to_dating_that/,False,False,7,exfds,t5_2hokp6,1,"I grew up pretty shy and religious, so I've always been naturally passive when it comes to dating. 

I think the women at FDS really don't consider that a lot of guys are not going to pursue you if they don't feel like they have at least a little bit of a chance with you.

My main problem with dating was that I wasn't making guys feel comfortable around me. I came off very unapproachable and cold at times. I never initiated any dates or texts and eventually guys (IRL) would just stop trying and revert back to acquaintance/friend. 

When I genuinely tried to be warmer, and more receptive to them, and maybe tried to initiate a few texts here or there, I found the response from men was much better. They felt more comfortable around me and therefore were more enthusiastic about me. 

I just don't understand FDS playbook of waiting for the guy to make all the moves or acting disinterested, etc. Has this actually worked for anyone?",387,Does the avoidant/passive approach to dating that FDS supports work for anyone? I've done this all my life and it's never helped me.,0,,,,1
