,body,author,created_utc,retrieved_on,permalink,parent_id,subreddit,score,post,updated_utc
349,"You’re probably right, I was saying how I’m in a really good place to work on myself right now because I have a supportive partner. I’ve dealt with abusive behaviour before but I think if you’re a healthy person you surround yourself with other emotionally healthy men and women naturally. I’ve worked my ass off to heal from my past and things are getting better, but as soon as you state you’re happy people get defensive instead of trying to learn from it. 

If these women have never dated a man that wasn’t shitty you have to wonder how HV they actually are. Wouldn’t you be attracting lots of people, with at least a small percentage being good human beings? 

I feel bad for potentially making these women feel bad about themselves but I can’t see how stewing in these ideals is anything but self defeating. I just don’t see how you can move towards a healthier perspective while employing their tactics.  I shouldn’t have tried to influence anything there.",weeblepeeble-,2020-11-30 04:25:31,2020-11-30 05:43:56,/r/exfds/comments/k17uey/permanently_banned_lol/ge49f0b/,t1_ge3v6ku,exfds,1,1,2020-11-30 05:43:56
350,I think someone got jealous there. That's the only way I can explain it.,saraperche,2020-11-30 02:06:57,2020-11-30 03:43:43,/r/exfds/comments/k17uey/permanently_banned_lol/ge3v6ku/,t1_ge35a71,exfds,1,1,2020-11-30 03:43:43
351,"I love Ex Machina! Have you seen Tau? You have to watch it, if you haven't yet.

I agree that the sub isn't capable of a dialogue and won't let anyone to challenge their opinion, which inhibits any growth or further development of the idea. It's a sign of stagnation and expectation of a blind following, like a cult, yes. And it's very bad for women who trust them because this rigid philosophy is ignoring various circumstances and fails to adopt to change. 

Because adaptability is so crucial for any intelligent approach to such delicate area as dating, those women will be stuck in a rut, trying to follow those outdated and very narrominded rules. Some of those rules, however, are based on a personal opinion and aren't supported by data or a collective experience. 

If we could share different strategies that work for us, exchange ideas and discuss dating issues without worrying that we get banned for saying something wrong, it would serve women so much better! 

I think the sub name is misleading, judging by how it's ran and the main theme there. Instead of a handbook on dating it should have only two sentences: ""All men suck. Don't date."" Because that's the only acceptable opinion there right now.",saraperche,2020-11-30 02:04:45,2020-11-30 03:41:35,/r/exfds/comments/k17uey/permanently_banned_lol/ge3uxss/,t1_ge1gwqv,exfds,1,1,2020-11-30 03:41:35
352,"&gt; Acting uninterested does not help.   
   
How it would? Seriously. If there isn't the slightlest sign of interest it means there's no interest.",PlainTundra,2020-11-29 18:25:31,2020-11-29 19:11:45,/r/exfds/comments/k25x2h/does_the_avoidantpassive_approach_to_dating_that/ge29muf/,t1_gduixb4,exfds,2,1,2020-11-29 19:11:45
353,"I just got banned as well lol, I agree the idea behind the sub is good but trying to have any open dialogue there will get you banned and accused of being a man. Legit, just decided I was a man (I’m not). It’s run a lot like a cult, it doesn’t take to outsiders and fights like hell to preserve its narrow minded perspective. I went to their group chat to ask questions and got talking to a lady about some experiences and I said “it seems like a lot of women here have been traumatized by men, It reads as a bit bitter and angry but I do understand why”. I was trying to connect and say I am also traumatized by men but they took it as something else. The mods I was talking to refused to believe my boyfriend is actually a great person and said my comment history is full of libfem stuff?(I commented on one feminist sub on a post about Ex Machina (a SciFi) just saying its a well made movie). 

I do feel that it’s a way these women are processing their trauma, that’s why it’s so volatile there. The mods seemed like they weren’t very articulate as well and shut down any intelligent conversation I tried to make. 

Really bizarre experience all around, some of the content was really good but there’s a lot of dysfunction there and I think they prefer it that way. Sometimes holding onto anger kind of protects the ego from feeling deeper emotions like sadness. They don’t want anything crumbling their world they’ve created there, which is fine and I respect it. I’m glad I’m out though, it’s not a happy sub.",weeblepeeble-,2020-11-29 15:07:19,2020-11-29 15:15:05,/r/exfds/comments/k17uey/permanently_banned_lol/ge1gwqv/,t3_k17uey,exfds,1,1,2020-11-29 15:15:05
354,"They might like the fake ego boost it gives by just waiting around and letting the guys send messages. The gender ratio helps them regarding the aspect. Unfortunately for them, it does not look like it is working. It seems somehow that those attractive guys they want never reach out, which might be explained if they look as arrogant and hateful as on their sub. No mentally stable man would want a relationship with such a woman.  
They are desperate however you analyse their situations, they just like to cling to the idea that they are something special (queens as they call themselves); the idea of an average woman being inundated by messages and who selects men, gives them power, until they see there's hardly anything to select for and it can be rather time-consuming.",HoolaPooba,2020-11-28 11:53:20,2020-11-28 11:53:30,/r/exfds/comments/k17uey/permanently_banned_lol/gdv0ptf/,t1_gdq7dk9,exfds,1,1,2020-11-28 11:53:30
355,"Acting uninterested does not help. The dating book All The Rules encourages smiling, asking questions and keeping a light conversation - it worked for me. It also kept me lighthearted, and aloof. Approaching guys worked in the short term but definitely not for the long term. I preferred not to approach",sweatydeath,2020-11-28 08:04:05,2020-11-28 08:04:15,/r/exfds/comments/k25x2h/does_the_avoidantpassive_approach_to_dating_that/gduixb4/,t3_k25x2h,exfds,1,1,2020-11-28 08:04:15
356,Funnily enough this is why I'm not on FDS anymore. It became a drain and was clouding how I saw the rest of the world,duckfeatherduvet,2020-11-28 02:21:11,2020-11-28 02:21:23,/r/exfds/comments/k25x2h/does_the_avoidantpassive_approach_to_dating_that/gdts0sr/,t1_gdtrv51,exfds,1,1,2020-11-28 02:21:23
357,"Yes I think there's a lot of truth to it. I can be warmer with people (not just guys but friends and work colleagues) because my heads not all over the place from trying to keep up with people who are messing me about. Before I started being 'more passive/avoidant', I was ironically really grumpy and distant all the time because I wasn't prioritising the right people. My reciprocatey was unhealthy. the people I did focus my time on were awful and it clouded how I saw the rest of the world. It was exhausting. Nowadays these people are not in my life and I can focus on spending my time with good people and having good relationships. It took a while to adjust though because I had to recover my energy and learn how to reciprocate healthily",duckfeatherduvet,2020-11-28 02:19:32,2020-11-28 02:19:43,/r/exfds/comments/k25x2h/does_the_avoidantpassive_approach_to_dating_that/gdtrv51/,t3_k25x2h,exfds,1,1,2020-11-28 02:19:43
358,Sounds like the FDS mod team’s age range now,sweatydeath,2020-11-28 00:47:10,2020-11-28 00:47:22,/r/exfds/comments/juhr10/fds_no_man_who_plays_video_games_could_be_high/gdtixjx/,t1_gcmzugf,exfds,1,1,2020-11-28 00:47:22
359,"I think the person who wrote the hand book at that moment assumed that people have common sense, but some members and even mods took is too seriously, too radically and definitely lack the common sense.",saraperche,2020-11-27 18:19:51,2020-11-27 18:31:48,/r/exfds/comments/k25x2h/does_the_avoidantpassive_approach_to_dating_that/gdsdec1/,t1_gdsd1q8,exfds,1,1,2020-11-27 18:31:48
360,"I agree with all of this, but there's a difference between chasing some dude or being his doormat and doing things to increase your desirability. 

&gt;But you do have to reciprocate and send the clear signals that you are also interested. It's your body language, touch, smile, eye contact, etc. 

This is more along the lines of what I meant. This is not obvious to a lot of women who struggle with dating and I feel like FDS barely mentions it (maybe because they think it's obvious?).",MyDarlingGirl,2020-11-27 18:17:15,2020-11-27 18:28:54,/r/exfds/comments/k25x2h/does_the_avoidantpassive_approach_to_dating_that/gdsd1q8/,t1_gdsbhu6,exfds,1,1,2020-11-27 18:28:54
361,"Hinge is a little different, it takes a few weeks or even months to pick up and begin showing you profiles that you prefer. There are so many similar complaints on their sub! The women and men who ask for a profile review  and say they have ZERO matches  are very good looking with solid bios, they shouldn't have trouble at all but they still do. There's something wrong with that app and it's algorithm. 

All the guys that I dated on Bumble are professionals and are very food looking. I only date people on the same financial level as me. All my single coworkers are also on the apps and they are definitely not trash. That generalization is just as silly as ""all men are monsters"" or ""all women are gold diggers.""",saraperche,2020-11-27 18:16:41,2020-11-27 18:28:18,/r/exfds/comments/k17uey/permanently_banned_lol/gdscyye/,t1_gdsb1ot,exfds,1,1,2020-11-27 18:28:18
362,"There's a certain truth to it - if he is interested he will make all the moves and will pursue you. You won't have to guess what's going on and where you are standing. But you do have to reciprocate and send the clear signals that you are also interested. It's your body language, touch, smile, eye contact, etc. You don't have to be an emotionless, cold statue if naturally you are a warm person who loves to laugh.

The point is to remain cold headed even if you really like him. Don't let anyone to string you along or take advantage of you. Be very clear of what you are looking for and don't compromise. Don't let bad behavior to slip through, hoping it will never be repeated. Have boundaries and standards that aren't negotiable. And don't agree for less when you want more.",saraperche,2020-11-27 18:05:53,2020-11-27 18:16:09,/r/exfds/comments/k25x2h/does_the_avoidantpassive_approach_to_dating_that/gdsbhu6/,t3_k25x2h,exfds,1,1,2020-11-27 18:16:09
363,"&gt;""There's only trash on the apps""

Yeah I remember getting into an argument with an FDS user about this. She kept saying that there are ONLY trash men on the apps and that any man ""of value"" is not going to be on the apps.

But that's simply not true. There's been a cultural shift in the past 10 years or so. Almost everyone is on the apps. If you're attractive with a good job and are generally socially aware/kind, you'll likely meet someone else who's similar if you keep trying.

As for the attractiveness rankings, honestly that scares me simply because of my terrible hinge experience. I think I'm pretty cute but the guys on Hinge would disagree apparently lol.",MyDarlingGirl,2020-11-27 18:02:31,2020-11-27 18:12:26,/r/exfds/comments/k17uey/permanently_banned_lol/gdsb1ot/,t1_gdsa135,exfds,2,1,2020-11-27 18:12:26
364,"I don't think they even know how apps work. You have to actively swipe, match and engage for the algorithm to pick up on your preferences and a feedback from other users. Apps rank your attractiveness based on that feedback of how others engage with your profile and if you only see shitty men for a while that means your profile is not very good and it's not Bumble's fault. 

""There's only trash on the apps"", they like to say, but that only means that those women weren't even shown to decent men and were ranked among overweight, trashy men. 

Passively sitting and hoping for prince charming to magically find and pick you IS pickmesha behavior. And yes, you have to pay to reap the full benefits of the app.",saraperche,2020-11-27 17:55:04,2020-11-27 18:04:03,/r/exfds/comments/k17uey/permanently_banned_lol/gdsa135/,t1_gds6nm5,exfds,1,1,2020-11-27 18:04:03
365,"I wouldn't say FDS folks are femcels though. Back when I was in high school I came across the forever alone women sub. Now those are true femcels. Their stories are awful. People have basically treated them like total shit for most of their lives. Men treat them with disgust and women ignore them. The only kind of sexual activity they get are quick pump and dump scenarios if they're ""lucky.""

I think some of them have severely below average bone structure or disabilities. Others have severe social skills deficits. At least this is what I remember from their posts.",MyDarlingGirl,2020-11-27 17:36:10,2020-11-27 17:42:47,/r/exfds/comments/k17uey/permanently_banned_lol/gds7gyc/,t1_gdnfuly,exfds,1,1,2020-11-27 17:42:47
366,"The only guy I met over the past year who I would consider dating long-term I found on bumble. If it wasn't for my insane work/study schedule that basically made dating impossible and led me to reluctantly break things off, he would probably be my SO right now.

Also, do they not realize that you can pay to see the dudes who liked you on bumble? I only paid for 1 week and selected someone cute who had already liked me. We clicked remarkably well.

FDS loves Hinge because they wait passively until the likes trickle in. My problem with this? The only guys who were liking me on Hinge were overweight, jobless, or completely boring. I really started questioning my attractiveness at that point, but tbh I tried bumble and there were cool, attractive guys more on my level (i.e. good job, good body, cute face) who were genuinely interested in me. There's something about the Hinge algorithm that favors men. I've heard many men who don't get likes on other apps are fairly successful on Hinge. 

If I had listened to FDS, I would have gone on a lot of useless dinner dates with guys I wasn't truly attracted to.",MyDarlingGirl,2020-11-27 17:30:07,2020-11-27 17:35:54,/r/exfds/comments/k17uey/permanently_banned_lol/gds6nm5/,t3_k17uey,exfds,1,1,2020-11-27 17:35:54
367,how did you even find the sub? what are somethings you disagree with?,throwawaygod12x,2020-11-27 11:11:48,2020-11-27 11:11:59,/r/exfds/comments/k17uey/permanently_banned_lol/gdr89mo/,t1_gdollg8,exfds,1,1,2020-11-27 11:11:59
368,But isn't it more desperate to sort through hundreds of bullshit messages from men you'd never date to find something decent? I don't get the logic.,saraperche,2020-11-27 02:37:06,2020-11-27 02:37:17,/r/exfds/comments/k17uey/permanently_banned_lol/gdq7dk9/,t1_gdp26zr,exfds,1,1,2020-11-27 02:37:17
369,"I think you got banned because you said you use bumble, which is wrong and opposed to the sectarian teachings of not approaching men (because queens like them don't - you are desperate libfem if you do), and maybe you did not agree to some other regressive ideas regarding gender roles they would gladly enforce cherrypicked to their advantage, like putting women down for proposing to men. You actually were not influenced by their narrow-mindedness, good for you for having a critical mind.",HoolaPooba,2020-11-26 19:55:52,2020-11-26 20:17:17,/r/exfds/comments/k17uey/permanently_banned_lol/gdp26zr/,t3_k17uey,exfds,1,1,2020-11-26 20:17:17
370,Nice try,TrainingBluejay,2020-11-26 18:43:21,2020-11-26 18:56:49,/r/exfds/comments/jyptj6/i_made_a_petition_to_takedown_fds_spread_it_around/gdosdzs/,t3_jyptj6,exfds,1,1,2020-11-26 18:56:49
371,"Nah, I like men too much ))) It's just some people swing too far to the opposite sides (pickme - femcel, fuckboi - incel) due to the rigid personality and inability to cope with changes and circumstances.",saraperche,2020-11-26 17:54:01,2020-11-26 18:00:09,/r/exfds/comments/k17uey/permanently_banned_lol/gdollg8/,t1_gdnfuly,exfds,1,1,2020-11-26 18:00:09
372,It's a bunch of black women who are super mad about the skewed sex ratio in their community along with some super hardcore (imagine some green or red hair) white lesbians.,Kittykingg,2020-11-26 13:54:01,2020-11-26 13:54:11,/r/exfds/comments/k17uey/permanently_banned_lol/gdnulrd/,t3_k17uey,exfds,1,1,2020-11-26 13:54:11
373,"They are literally just femcels. Celibacy has a different meaning with women though. It's not quite zero sex, as a woman can always get some, but rather, never being in a satisfying relationship. It's the female equivalent to no sex for a man.


It's good you got out, you would have wound up a full blown Femcel.",GunnzzNRoses,2020-11-26 10:59:20,2020-11-26 10:59:31,/r/exfds/comments/k17uey/permanently_banned_lol/gdnfuly/,t3_k17uey,exfds,1,1,2020-11-26 10:59:31
374,No problem :),phantom_0007,2020-11-26 09:50:22,2020-11-26 09:50:33,/r/exfds/comments/jsr7r1/masterpost_for_all_the_fds_apologist_questioning/gdnaata/,t1_gdn9r4x,exfds,1,1,2020-11-26 09:50:33
375,Thank you! I will look into this! ❤❤,blzrgurl71,2020-11-26 09:43:40,2020-11-26 09:43:51,/r/exfds/comments/jsr7r1/masterpost_for_all_the_fds_apologist_questioning/gdn9r4x/,t1_gdn9bp0,exfds,1,1,2020-11-26 09:43:51
376,"Oh right, looks like they're just TERFs then.  I just block them whenever I see them, I used to argue with them but they're usually not interested in reading actual science so I just gave up eventually.  For Twitter you can download the Block Chain Extension for Chrome, it lets you block multiple profiles at once, it's very useful!  On Reddit you have this tool called mass tagger, but I don't know how to use it yet.",phantom_0007,2020-11-26 09:37:59,2020-11-26 09:38:10,/r/exfds/comments/jsr7r1/masterpost_for_all_the_fds_apologist_questioning/gdn9bp0/,t1_gdn88ox,exfds,1,1,2020-11-26 09:38:10
377,"So the yelling isn't in real life...it usually happens when I comment on something I like and then random weirdos come at me. FB, TT, Reddit...they seem to be everywhere and they get braver and meaner every day. And I won't lie I have definitely misgendered people but not because I don't think they told me the truth. Everybody makes mistakes. The big one that got me was this cool post that I've been seeing everywhere that I reblogged. I liked it so I posted it end of story right? Wrong. The post said something like...""Funny how if someone meets your dog and misgenders it they fall all over themselves to correct it once they know but fight with you on principle because they thought YOU were some other gender."" I liked it and reblogged...not sure why this was such a controversial act. But people I'll never meet felt compelled to ""correct"" my misunderstanding of basic ""science"", which they clearly need to take again because there are definitely more than two genders per bio101. So it definitely made me cranky and a little hesitant to re-post things that I think are nice.",blzrgurl71,2020-11-26 09:23:24,2020-11-26 09:23:34,/r/exfds/comments/jsr7r1/masterpost_for_all_the_fds_apologist_questioning/gdn88ox/,t1_gdmzqb1,exfds,1,1,2020-11-26 09:23:34
378,"&gt;My personal feeling is if you tell me that you are a woman and you use she/her...that is the truth and the correct way to have a relationship with you. If you say you're a man and you use he/him, or you say that you are NB and you use whatever terms you use then...that is the truth and the correct way to have a relationship with you. 

yes that's what we usually do, I don't see anything wrong with that.  Do you mean someone in real life yelled at you, or was that on Reddit?  I'm a little confused.  I won't lie, it does take a while to get used to new pronouns.  I even misgender myself sometimes!",phantom_0007,2020-11-26 07:36:11,2020-11-26 07:36:21,/r/exfds/comments/jsr7r1/masterpost_for_all_the_fds_apologist_questioning/gdmzqb1/,t1_gdmxosm,exfds,1,1,2020-11-26 07:36:21
379,"Okay old lady here. Can I get some easy ways to recognize these people before they've scarred me for life. I think I'm talking to liberal feminists, which I think is what I am and then all of a sudden I say the wrong thing and I'm being screamed at. My personal feeling is if you tell me that you are a woman and you use she/her...that is the truth and the correct way to have a relationship with you. If you say you're a man and you use he/him, or you say that you are NB and you use whatever terms you use then...that is the truth and the correct way to have a relationship with you. Lol I thought this was super easy until someone yelled at me. So do I only get to go on threads that have been vetted for me damnit???? I feel like they are getting trickier.",blzrgurl71,2020-11-26 07:06:18,2020-11-26 07:06:28,/r/exfds/comments/jsr7r1/masterpost_for_all_the_fds_apologist_questioning/gdmxosm/,t3_jsr7r1,exfds,1,1,2020-11-26 07:06:28
380,Erm this is a good idea but can someone please verify this is not against Reddit TOS?,phantom_0007,2020-11-22 08:47:52,2020-11-22 15:26:43,/r/exfds/comments/jyptj6/i_made_a_petition_to_takedown_fds_spread_it_around/gd6un9q/,t3_jyptj6,exfds,1,0,2020-11-22 15:26:43
381,Thank you!,bossbabekaren2point0,2020-11-22 06:30:04,2020-11-22 13:24:58,/r/exfds/comments/juqqgo/welp_just_got_banned_and_muted_for_saying_i_watch/gd6bage/,t1_gd5rsgg,exfds,2,0,2020-11-22 13:24:58
382,I'll see if I can find it!,phantom_0007,2020-11-22 04:25:57,2020-11-22 11:28:27,/r/exfds/comments/juqqgo/welp_just_got_banned_and_muted_for_saying_i_watch/gd5rsgg/,t1_gd5pv2f,exfds,1,0,2020-11-22 11:28:27
383,Do you happen to know the name? I found a relatively popular that I enjoy that isn’t like the mainstream one and wanted to find another,bossbabekaren2point0,2020-11-22 04:12:49,2020-11-22 11:16:15,/r/exfds/comments/juqqgo/welp_just_got_banned_and_muted_for_saying_i_watch/gd5pv2f/,t1_gd1erwv,exfds,1,0,2020-11-22 11:16:15
384,Money and time spent in videogames is money and time not spent in them. This is the logic behind it.,PlainTundra,2020-11-21 17:41:18,2020-11-21 23:52:49,/r/exfds/comments/juhr10/fds_no_man_who_plays_video_games_could_be_high/gd2za63/,t1_gcmzugf,exfds,1,0,2020-11-21 23:52:49
385,What's wrong with no-vanilla sex with them?,PlainTundra,2020-11-21 17:24:30,2020-11-21 23:32:03,/r/exfds/comments/jy117b/i_want_to_make_another_reddit_account_to_post_on/gd2wiwj/,t3_jy117b,exfds,2,0,2020-11-21 23:32:03
386,"Eh, I don't watch it myself but I've heard of feminist porn directors that don't have hostile work environments.  They aren't very mainstream though.",phantom_0007,2020-11-21 10:16:26,2020-11-21 16:57:18,/r/exfds/comments/juqqgo/welp_just_got_banned_and_muted_for_saying_i_watch/gd1erwv/,t3_juqqgo,exfds,1,0,2020-11-21 16:57:18
387,Goes along with their 666 rule,IWishIWasDead19,2020-11-21 06:45:25,2020-11-21 14:43:44,/r/exfds/comments/iw311q/high_value_women/gd0wdeo/,t3_iw311q,exfds,1,0,2020-11-21 14:43:44
388,"To quote Friday, “How you gonna get fired on your day off?”",IWishIWasDead19,2020-11-21 06:32:25,2020-11-21 14:35:52,/r/exfds/comments/jxr1qq/i_dont_even_go_to_fds_and_got_banned_for/gd0vgus/,t3_jxr1qq,exfds,2,0,2020-11-21 14:35:52
389,"i made a post about FDS once in r/ATSOK and then suddenly got banned from fds. 

the mods there have no jobs other than sifting through other subs that are critical of fds.",clefairy143,2020-11-21 03:53:39,2020-11-21 12:45:45,/r/exfds/comments/jxr1qq/i_dont_even_go_to_fds_and_got_banned_for/gd0igkm/,t3_jxr1qq,exfds,2,0,2020-11-21 12:45:45
390,Sadly ban evasion is against the rules :( nice thinking though lmao,phantom_0007,2020-11-21 03:29:04,2020-11-21 12:26:58,/r/exfds/comments/jy117b/i_want_to_make_another_reddit_account_to_post_on/gd0g49k/,t3_jy117b,exfds,3,0,2020-11-21 12:26:58
391,Don't.,suberEE,2020-11-21 02:54:35,2020-11-21 12:00:35,/r/exfds/comments/jy117b/i_want_to_make_another_reddit_account_to_post_on/gd0cpzv/,t3_jy117b,exfds,4,0,2020-11-21 12:00:35
392,Lollll,Ingrowntoenailsyummy,2020-11-21 01:32:43,2020-11-21 10:58:19,/r/exfds/comments/jy117b/i_want_to_make_another_reddit_account_to_post_on/gd04heq/,t1_gd017ko,exfds,5,0,2020-11-21 10:58:19
393,YES!,Ingrowntoenailsyummy,2020-11-21 01:32:22,2020-11-21 10:58:03,/r/exfds/comments/jy117b/i_want_to_make_another_reddit_account_to_post_on/gd04g58/,t1_gczzd6a,exfds,4,0,2020-11-21 10:58:03
394,"those might be a little too obvious, and most of those high-level queens probably lurk here.

Were I to do it, I would play a long con and not post about it until it's done.",rudebii,2020-11-21 01:00:18,2020-11-21 10:34:04,/r/exfds/comments/jy117b/i_want_to_make_another_reddit_account_to_post_on/gd017ko/,t3_jy117b,exfds,8,0,2020-11-21 10:34:04
395,"What a great idea! 
Maybe describe a perfect fds date, and then end up with “I woke up”, because it is that unrealistic ahahahah",gate_to_hell,2020-11-21 00:42:18,2020-11-21 10:20:18,/r/exfds/comments/jy117b/i_want_to_make_another_reddit_account_to_post_on/gczzd6a/,t3_jy117b,exfds,6,0,2020-11-21 10:20:18
399,"Yes but being a sugar baby is basically long term prostitution and requires good looks, willingness to have sex semi-on-demand, and willingness to perform emotional labor (in the same way as a retail or customer-service worker).   It requires actual work which makes it unappealing to the chronically entitled.",esgellman,2020-11-20 22:36:13,2020-11-21 08:36:54,/r/exfds/comments/iozfzk/the_fds_handbook_or_whatever_its_called/gczlgfu/,t1_g4h9n9n,exfds,1,0,2020-11-21 08:36:54
400,Lmaoo. It really runs so much like a cult tbh.,Ingrowntoenailsyummy,2020-11-20 21:57:38,2020-11-21 08:03:24,/r/exfds/comments/jxr1qq/i_dont_even_go_to_fds_and_got_banned_for/gczgzgp/,t1_gcz9ycs,exfds,2,0,2020-11-21 08:03:24
