,body,author,created_utc,retrieved_on,permalink,parent_id,subreddit,score,post,updated_utc
994,"If you don’t know what the ACLU or the Southern Poverty Law Center, you can Google them yourself. They’re very well known. 

And if I am a basement dweller, why would I accept another loser basement dweller as an authority on anything? What individuals Redditors posts on r/AHS has as much credibility as the FDSer posting “all men are trash” on FDS.

My point is your weird ideation of r/AHS. It’s weird. 


I honestly don’t care to discuss comments, posts or FDS mods. They’re all suck. I have already said above they suck. 

What I care about is strategies themselves. I think they’re actually decent women-focused strategies for the beginning stages of a relationship, as good if not better than most dating advice out there. If you have links to the studies you claimed contradict FDS, please put them up. I am really curious. If 50/50 is actually a good dating strategy for women, I would like know, as i want to help my little 3 months old romance flourish. If you have resources, articles criticizing the strategies endorsed by FDS, put them up. I am interested in dating strategies, not branches of feminism. So all of the stuff you cited are irrelevant. I don’t see what Amy Dyess can tell me about dating men.",throwawayjune30th,2020-11-12 06:33:37,2020-11-12 06:33:48,/r/exfds/comments/jsllf8/fds_women_should_take_a_look_at_themselves_with/gc0oamj/,t1_gc0kz47,exfds,1,0,2020-11-12 06:33:48
995,"Wait, are you seriously trying to say FDS isn't a hate subreddit?  I just need clarification for that one point of yours.  Because that Center you're talking about isn't an authority on hate subreddits either (I haven't even heard of it, actually, do you have a link?).  

We aren't aiming to ""convert"" people.  This is just a safe space for people to discuss how they've been hurt by TERF cults in the past.  Reddit admins have acknowledged r/AgainstHateSubreddits in the past, it's the most reliable resource on Reddit to find hate subreddits.  AHS has already covered TERF and TERF adjacent subreddits using logical arguments and studies.  I'll reiterate that we're not out here to convince people FDS is bad, any reasonable individual would know that themselves, this discourse is all over the place, on Twitter, Facebook, actual studies, etc.  You can type ""trans exclusionary radical feminism"" into Google Scholar and you'll get a bunch of hits.  Most of us have other things to do, and personally I don't want to waste my time trying to convince someone FDS is a TERF subreddit if they aren't open to reading well-documented TERF post compilations (from FDS) themselves.  We literally have disgruntled FDSers reporting screenshot posts here, taken from their own sub, as misinformation.  And we get the occasional butthurt FDS mod too.  If they weren't a hate subreddit, they would ignore us entirely because we wouldn't be worth their time.  TwoX mods don't go around brigading random subs like FDSers do.

(And by the way, AHS also has anti-MGTOW posts.  So they're not the stereotypical incel basement dwellers. I've made a post on AGS about TERFs myself.  I can state categorically that I'm not a basement dweller.  I live in a very well ventilated house.)

Oh, and while we're at it, how do we know you're not a basement dweller?  Lol.

Anyway, jokes aside, my main point is that we can't do your deprogramming work for you.  I'll try to collect a masterlist of posts pointing out certain bad things about FDS, but that'll take me a lot of time and I might even forget about it, so yeah.  I can point you to some off-Reddit resources though.  Amy Dyess' articles and Gemma Stone's Medium articles are good.  Pink News has some articles about TERF recruiting tactics.  And I follow a bunch of Twitter accounts like GC Homophobia, GC Racism etc.  If you look through their posts and compare those with FDS posts, you'll notice some similarities.  The issue with debunking TERF rhetoric is that it's so filled with dogwhistles that it takes a lot of time to debunk even one paragraph.  Any attempt to call them out is seen as misogyny (if other trans-inclusive cis women so it, they say we have internalized misogyny...lmaoo) so that's usually where the discussion stops because most not-TERF folks realize by then that there's no point engaging in actual conversation with a TERF.  They're like Nazis (they have, in fact, colluded with far right hate groups in the past, who also hate LGBTQ+ people.  Pink News has some articles about that too).",phantom_0007,2020-11-12 05:58:31,2020-11-12 06:01:51,/r/exfds/comments/jsllf8/fds_women_should_take_a_look_at_themselves_with/gc0kz47/,t1_gc0ftby,exfds,1,0,2020-11-12 06:01:51
996,"My point is that you are concern trolling about ""women from 3rd world countries"" lemme break this down.  First off, not all 3rd world countries have problems with education and hygiene.  Second off, just because we're women from South Asian countries doesn't mean some of us don't have class/ religious privilege.  Most Indian women you see on FDS have jobs, are Hindu, some even live in the US (which doesn't have universal healthcare and has terrible class disparity yet somehow isn't classified as a third world country because... reasons and imperialism I guess).  I don't remember the specifics of what you said in your comment, but I did pick up on an eagerness on your part to blame men from all these countries for these women on FDS being extremists.  These aren't your run-of-the-mill occasional ""i hate men"" Facebook shitposter feminists who want to vent after a tiring day being catcalled outside.  These are women who are homophobic, racist (because White women on the sub who are racist homophobic TERFs agree that they're oppressed, so they feel the need to agree with them.  If you read studies about 60s White separatist feminism, you'll get a better idea of what I'm talking about here, I can't articulate it properly) and TERFs.  The only excuse they have to be hateful is themselves.  Don't you think, given the abuse I've been through in my life (since you took the liberty to see my post history), I should have become a man hating ""feminist"" as well?  On FDS, the hatred directed towards Indian men (for example) comes from a White TERF perspective.  Indian women (like myself) tend to agree with that hatred because 1.  there's no denying we are oppressed, obviously and 2.  we don't want to get kicked out of FDS for defending men of colour from that kind of racist hatred, because FDS labels that as excessive male sympathizing.  There are very few active spaces for Indian women on Reddit, and most of us have experienced sexual harassment to some degree, which is what FDS capitalizes on as a TERF recruiting ground.

In your comment, you've generalized POC culture entirely, which is racist.  That's what I was trying to get at.  It's one thing to acknowledge nuances (which, again, you are not doing because you just painted us all with a very broad brush.  Black women, Latino women, South Asian women, Native American women, East Asian women, Middle Eastern women etc all face different kinds of misogyny and even that depends on a whole lot of other factors) and another to say something that makes all POC cultures look the same.  Usually the racist evangelical Christian patriarchy we have to face when we emigrate to Western countries is also upheld by White women (just look at voting stats by demographic in the recent US election).

I get that you're concerned I'm a moderator because of my past (well, and present) and you seem to insinuate that being anxious makes me somehow unfit to moderate a subreddit...which is a very ableist and ageist notion, but let's not go there.  I'm intentionally sitting out my ""drunk on power"" phase of moderating here.  It'll go away in a few days when the novelty wears off.  I already got called a ""White man's whore"" because I decided to remove some polygynous dickhead's comment because he thought I wouldn't date him because (apparently) he was Black.  Sweet Jesus Reddit has really done a great job toning down on the hate speech, huh. /s 

The reason I said pro FDS brownie points was that you are regurgitating the exact rhetoric not-White TERFs have used on FDS to hate on South Asian trans women.  I'm sure you can understand why I wouldn't be too happy about that.  I'm genderfluid and I take that shit personally because it literally fuels hate based on identity.  It's very triggering to read something like that because TERFs have sent me hate online and have tried to dox me in the past.  I have no interest in sympathizing with them because they are the kinds of women who uphold the patriarchy in South Asian countries while claiming to fight against it.

I do have a question for you though: are you White?  Because so far I haven't seen any BIPOC feminist woman have this unintersectional a take, neither in real life nor on major subs like TwoX.",phantom_0007,2020-11-12 05:31:12,2020-11-12 05:42:51,/r/exfds/comments/jsllf8/fds_women_should_take_a_look_at_themselves_with/gc0i99y/,t1_gc0deuq,exfds,1,0,2020-11-12 05:42:51
997,"Here's a sneak peek of /r/AgainstHateSubreddits using the [top posts](https://np.reddit.com/r/AgainstHateSubreddits/top/?sort=top&amp;t=year) of the year!

\#1: [Open Letter to Steve Huffman and the Board of Directors of Reddit, Inc– If you believe in standing up to hate and supporting black lives, you need to act](https://np.reddit.com/r/AgainstHateSubreddits/comments/gyyqem/open_letter_to_steve_huffman_and_the_board_of/)  
\#2: [Steve “Spez” Huffman is finally claiming that Black Lives Matter, but has spent years as CEO defending white supremacy and racism on Reddit](https://np.reddit.com/r/AgainstHateSubreddits/comments/gv7mtn/steve_spez_huffman_is_finally_claiming_that_black/)  
\#3: [r/gamersriseup banned](https://np.reddit.com/r/AgainstHateSubreddits/comments/feeqz8/rgamersriseup_banned/)

----
^^I'm ^^a ^^bot, ^^beep ^^boop ^^| ^^Downvote ^^to ^^remove ^^| [^^Contact ^^me](https://www.reddit.com/message/compose/?to=sneakpeekbot) ^^| [^^Info](https://np.reddit.com/r/sneakpeekbot/) ^^| [^^Opt-out](https://np.reddit.com/r/sneakpeekbot/comments/joo7mb/blacklist_viii/)",sneakpeekbot,2020-11-12 05:07:49,2020-11-12 05:25:39,/r/exfds/comments/jsllf8/fds_women_should_take_a_look_at_themselves_with/gc0fuou/,t1_gc0ftby,exfds,1,0,2020-11-12 05:25:39
998,"There are no pro-fds brownie points here. I don't agree with FDS at all. You're so defensive that I think you are missing the point. 

I think you need to chill for a second and take a breath. I'm very concered that you are a moderator",Mellymel1030,2020-11-12 04:44:45,2020-11-12 05:07:39,/r/exfds/comments/jsllf8/fds_women_should_take_a_look_at_themselves_with/gc0deuq/,t1_gc0d6ty,exfds,0,0,2020-11-12 05:07:39
999,"I understand you're young and still figuring things out. Sounds like you still live at home, trying to go to school and have some severe anxiety disorders so I'll take that into consideration. However I am a feminist, and a woman, not a female hating person. Nothing I said was misogynistic nor racists. If you go to FDS you'll see many of the commentors are from third world countries where misogyny runs deep and that's why they are extremists on that sub. It's not racist to state facts that hygiene and education in third world countries are lacking. It's also not racists that many cultures value marriage and materialised things which is why they haven't embraced feminism yet. It's not racists to state that black women are rated low for attractiveness and desirability because there was a study published about this very thing. 
These all culminate to why the FDS moderators and commentors are so angry with men. 

I understand that you might be confused with how the world works with being so young and all, but you're gonna have to tone down the God complex with ban people for something you have no understanding on.",Mellymel1030,2020-11-12 04:34:03,2020-11-12 04:59:31,/r/exfds/comments/jsllf8/fds_women_should_take_a_look_at_themselves_with/gc0cfwq/,t1_gc0b8yr,exfds,0,0,2020-11-12 04:59:31
1000,"I'm a moderator, still figuring out how to get the green username on mobile.  Nevertheless, this is your second warning.  MGTOW/ incels/ misogynists/ racists etc are not welcome here.",phantom_0007,2020-11-12 04:21:05,2020-11-12 04:49:47,/r/exfds/comments/jsllf8/fds_women_should_take_a_look_at_themselves_with/gc0b8yr/,t1_gc09wo3,exfds,1,0,2020-11-12 04:49:47
1001,Lol ok dude,Mellymel1030,2020-11-12 04:06:41,2020-11-12 04:38:34,/r/exfds/comments/jsllf8/fds_women_should_take_a_look_at_themselves_with/gc09wo3/,t1_gc09kle,exfds,0,0,2020-11-12 04:38:34
1002,I am not making excuses for them. It’s my genuine opinion that FDS(at least the philosophy itself) is mostly a decent dating strategy. Better than most out there. You’re welcome to read my other comment on this thread.,throwawayjune30th,2020-11-12 04:04:58,2020-11-12 04:37:13,/r/exfds/comments/jsllf8/fds_women_should_take_a_look_at_themselves_with/gc09qsx/,t1_gc090k8,exfds,0,0,2020-11-12 04:37:13
1003,"This is an incredibly racist, classist, and misogynistic comment.  Such comments are not tolerated on this subreddit.  We are not an anti-feminist sub.  We don't like FDS because they're TERF, not because they're women.  This is your first warning.",phantom_0007,2020-11-12 04:03:09,2020-11-12 04:35:45,/r/exfds/comments/jsllf8/fds_women_should_take_a_look_at_themselves_with/gc09kle/,t1_gc057py,exfds,0,0,2020-11-12 04:35:45
1004,It's literally a TERF racist homophobic subreddit.  They know what they're doing and we shouldn't be making excuses for them.,phantom_0007,2020-11-12 03:57:23,2020-11-12 04:31:05,/r/exfds/comments/jsllf8/fds_women_should_take_a_look_at_themselves_with/gc090k8/,t1_gc006sw,exfds,1,0,2020-11-12 04:31:05
1005,"&gt; 
&gt; 
&gt; 
&gt; 
&gt; Reminder from the Reddit staff: I

I must of have missed something because I had no idea that they were just as bad in that subreddit. It's sad, because it seems like a promising idea, but they of coarse had to ruin it. :/",RachelStorm98,2020-11-12 03:44:12,2020-11-12 04:20:02,/r/exfds/comments/jsllf8/fds_women_should_take_a_look_at_themselves_with/gc07pwt/,t1_gc07gkd,exfds,2,0,2020-11-12 04:20:02
1006,"Ah, most those women are trash in that sub so consider it a favor.",Mellymel1030,2020-11-12 03:41:35,2020-11-12 04:17:52,/r/exfds/comments/jsllf8/fds_women_should_take_a_look_at_themselves_with/gc07gkd/,t1_gc06r55,exfds,2,0,2020-11-12 04:17:52
1007,"Yeah, it's ridiculous. They will leave a man the 2nd he doesn't fit their mold of what the ""perfect man"" should be. They talk very much about holding the men they want to date up to high standards, but they refuse to meet that themselves. 

I tried to reply to this as on topic as possible. I hope what I said above somewhat matches what your post/picture was trying to get at.

They legit just banned me last night from FLS too! Like I liked FLS. I liked that it is empowering for women. It was less toxic imo than FDS. And I got banned. I was banned from FDS because I wanted to make a subreddit helping men become high value men (Good men.) They banned me for that. They banned me from FLS probably because I was banned from FDS and they probably thought I was a male lol. There is only one rule on FLS and I didn't break it at all. I am a female but I guess that don't think I am. XD",RachelStorm98,2020-11-12 03:34:26,2020-11-12 04:11:56,/r/exfds/comments/jsllf8/fds_women_should_take_a_look_at_themselves_with/gc06r55/,t3_jsllf8,exfds,2,0,2020-11-12 04:11:56
1008,"Transphobia and hatred are exactly why I left fds, thank you!",howyadoinjerry,2020-11-12 03:29:09,2020-11-12 04:07:31,/r/exfds/comments/jjky9y/trans_women_are_women_pass_it_on/gc0689p/,t3_jjky9y,exfds,2,0,2020-11-12 04:07:31
1009,"That escalated quickly! Well, good luck to you.",throwawayjune30th,2020-11-12 03:28:57,2020-11-12 04:07:20,/r/exfds/comments/jsllf8/fds_women_should_take_a_look_at_themselves_with/gc067gk/,t1_gc057py,exfds,1,0,2020-11-12 04:07:20
1010,"I don't disagree. I do agree that a typical dinner date is an opportunity to put your best foot forward... But Christ, it's covid. Knowing your worth and setting boundaries and expectations are totally good ideas but some of the stuff in the handbook is outrageous.

 I can see how this advice is useful for women in undeveloped and third world countries where they fight deep rooted misogyny every day. You can tell which ones are from these countries due to the abundance of low quality men they talk about/date and the low education rates, poor hygiene issues, and little availability of a career (however this is also typical of immigrants in the states and POC because they come from these countries). However, I can tell which ones are from the states because they are what we would call ""welfare queens"" because they leach off one system or another. They have this constant need to validate themselves because, in the states, black women are usually rated fairly low for attractiveness and desirability. But I can also tell if they are immigrants to the states because of their internalized misogyny and cultural differences with American men.  They have expectations to be taken care of as a vestige of their previous culture but can't reconcile the women's liberation movement here in America. Culturally they are told they need to be married and they need materialistic things, but here in the states, that's not our philosophy so much anymore. most white Americans (Gen Z and millennials) prefer to live a minimal lifestyle and do not want to feed the corporate machine of expensive dinners and dates.",Mellymel1030,2020-11-12 03:19:10,2020-11-12 03:58:44,/r/exfds/comments/jsllf8/fds_women_should_take_a_look_at_themselves_with/gc057py/,t1_gc02qjy,exfds,1,0,2020-11-12 03:58:44
1011,"Oh I get that, but look at the posts from today even. They were telling a woman to divorce her husband because he quit his job to support her career.",Mellymel1030,2020-11-12 02:32:50,2020-11-12 03:17:00,/r/exfds/comments/jsllf8/fds_women_should_take_a_look_at_themselves_with/gc00e4p/,t1_gc006sw,exfds,2,0,2020-11-12 03:17:00
1012,"I feel so bad for them because I realized there are women who were abused and was treated poorly by bad men out there. When they finally found a safe space for women. They feel free and happy. Because finally there’s a group of women who’s been going through the same thing as me. But no, no. FDS became unhealthy, they give them a void and a bad perspective of men. Because of them used to be abused, it gives them this hatred and anger. There’s a lot of shitty bad men out there. I feel as though they thought every man out there was good and caring and sweet. No sweetie not all of them. There are very bad men. I think they was never taught to keep their guard and easily attached themself to a man that they thought at first glance was a good man. Without keeping a big check on the man before dating them. I get sad every time when I realize that.",xkitonexo,2020-11-12 01:17:11,2020-11-12 02:03:35,/r/exfds/comments/jskog3/i_survived_fds/gbzrue6/,t3_jskog3,exfds,3,0,2020-11-12 02:03:35
1013,"They basically want a ""Pretty Woman"" moment where they marry their highly attractive sugar daddy. 

Sorry, not sorry, they give off the welfare queen vibe",Mellymel1030,2020-11-12 01:15:41,2020-11-12 02:01:54,/r/exfds/comments/iozfzk/the_fds_handbook_or_whatever_its_called/gbzrnno/,t3_iozfzk,exfds,1,0,2020-11-12 02:01:54
1014,"Because most often these creators and mods have been physically abused in past relationships and don't understand how BDSM work. 

I generally get the vibe they are women from third world countries where treatment of women is pretty bad. I can only imagine in my head this: you know the bad guys from the movie Taken, you know, the ones who sex traffic women. Well I get the feeling these are women from those countries who do that and they have dated a man who has the same values as a sex trafficker, hence their absolute hated towards men",Mellymel1030,2020-11-12 01:13:30,2020-11-12 01:59:22,/r/exfds/comments/iuqdb6/fds_and_kink_shaming/gbzrdgw/,t3_iuqdb6,exfds,1,0,2020-11-12 01:59:22
1015,"It's called the ""women are wonderful"" effect in psychology",whosthatcreep,2020-11-12 01:04:21,2020-11-12 01:49:44,/r/exfds/comments/jiyy1i/why_some_people_think_fds_is_created_by_men/gbzq8qh/,t3_jiyy1i,exfds,1,0,2020-11-12 01:49:44
1016,"What they don't even realize is that you are a LVW if you are getting your ass and tits done to attract a guy. That means you only value yourself as an object to be viewed. You are only going to attract a LVM by doing that because a real gentleman likes you for you and for your personality. 

Many of the women there are very superficial. And I get the feeling they come from very oppressed third world countries so they struggle with their internalized misogyny.",Mellymel1030,2020-11-12 01:02:11,2020-11-12 01:47:26,/r/exfds/comments/j4w4zu/everyone_has_their_preferences_and_has_every/gbzpzdq/,t3_j4w4zu,exfds,1,0,2020-11-12 01:47:26
1017,I don’t have a problem with women having a safe space. I honestly don’t care if they do. It’s not effecting me in any way. Women should have their own spaces.,xkitonexo,2020-11-12 01:00:22,2020-11-12 01:45:33,/r/exfds/comments/jsknbu/so_whiny/gbzprjh/,t3_jsknbu,exfds,1,0,2020-11-12 01:45:33
1018,"That dead fish comment got me, that's spot on.
Those women don't represent anyone but themselves, dont worry.",whosthatcreep,2020-11-12 00:59:27,2020-11-12 01:44:36,/r/exfds/comments/jskog3/i_survived_fds/gbzpnlb/,t3_jskog3,exfds,1,0,2020-11-12 01:44:36
1019,"No, I honestly used to support FDS. I want women out there to find the right guy for them and not waste time on douchey men. I believe women should be single and focus on themselves. It’s better and healthier that way to not depend on men. That’s a good thing and I love that. FDS is also very good at teaching women that they should know their own worth to leave bad abusive relationships and also vetting men before you date them. That again is a good thing. What I have a problem with is that they lost touch.",xkitonexo,2020-11-12 00:58:28,2020-11-12 01:43:34,/r/exfds/comments/jsknbu/so_whiny/gbzpjam/,t3_jsknbu,exfds,1,0,2020-11-12 01:43:34
1020,"I personally love fds, because it's so blatantly hateful that people just can't deny any longer what I've been saying for years now. how toxic large parts of feminism have become, how incredible entitled some women are these days and that women are just as capable at creating toxic hate groups as men are.",whosthatcreep,2020-11-12 00:57:09,2020-11-12 01:42:10,/r/exfds/comments/jsknbu/so_whiny/gbzpdjn/,t3_jsknbu,exfds,2,0,2020-11-12 01:42:10
1021,They have so much internalized misogyny,Mellymel1030,2020-11-12 00:56:33,2020-11-12 01:41:33,/r/exfds/comments/jiy272/i_love_some_things_about_fds_other_things_are/gbzpb03/,t1_gaagld4,exfds,1,0,2020-11-12 01:41:33
1022,In short I've seen FDS go from inclusive to exclusive...quickly. It's a mean girls club. Where I thought I could find decent support and ideas....I just see hate and bullying. The mods of that sub need to do better.,ditanow,2020-11-11 23:35:20,2020-11-12 00:16:23,/r/exfds/comments/jhjjgy/not_a_exfds_nor_a_fds_but_what_are_your_thoughts/gbzg6nf/,t3_jhjjgy,exfds,1,0,2020-11-12 00:16:23
1023,"Well like how racism works. Only against it when racism strikes. All these time you must be having fun calling men trash, useless, etc.",Zachvishek,2020-11-11 18:34:07,2020-11-11 19:06:57,/r/exfds/comments/jpr8at/im_an_ex_fdser_i_wanted_to_share_my_story/gbyjqzk/,t1_gbgcemq,exfds,1,0,2020-11-11 19:06:57
1024,In all honesty FDS gives brilliant  advice for dealing with dudes that actually are trash. The problem is that they think nearly all men are trash and set insane standards for them all while acting like they themselves are perfect princesses. It's really obnoxious.,rsoko,2020-11-11 03:36:08,2020-11-11 05:01:58,/r/exfds/comments/jiy272/i_love_some_things_about_fds_other_things_are/gbwgo3e/,t3_jiy272,exfds,1,0,2020-11-11 05:01:58
1025,That's what cracks me up the most about them.,Alma00019,2020-11-11 01:00:12,2020-11-11 02:38:39,/r/exfds/comments/jpr8at/im_an_ex_fdser_i_wanted_to_share_my_story/gbw0276/,t1_gbi6j4i,exfds,1,0,2020-11-11 02:38:39
1026,How do you figure out if an account is an FDSer LARPing as MGTOW?  (Or vice versa?),phantom_0007,2020-11-10 13:03:55,2020-11-10 13:04:05,/r/exfds/comments/jqmakc/hi_exfds_ladies_interesting_stats_on_our_overlaps/gbtngbi/,t1_gbt271r,exfds,1,0,2020-11-10 13:04:05
1027,Oh good.  My ex is still low key stalking profiles associated with my number so I have no idea what to do besides blocking him everywhere; it's very infuriating.,phantom_0007,2020-11-10 12:21:09,2020-11-10 12:21:19,/r/exfds/comments/jiy272/i_love_some_things_about_fds_other_things_are/gbtk6ka/,t1_gbti71t,exfds,1,0,2020-11-10 12:21:19
1028,"For fuck's sake Google words before you use them.  And differences between demographics are always statistical, not absolute.",phantom_0007,2020-11-10 12:20:06,2020-11-10 12:20:16,/r/exfds/comments/jaul6h/great_critique_of_fds_from_wgtow_check_out_the/gbtk3vd/,t1_gbth9i0,exfds,1,0,2020-11-10 12:20:16
1029,"I'll see what I can do, I just got mod privileges.  This idiots need to be banned asap",phantom_0007,2020-11-10 12:18:06,2020-11-10 12:18:16,/r/exfds/comments/jqmakc/hi_exfds_ladies_interesting_stats_on_our_overlaps/gbtjyqh/,t1_gbt9389,exfds,1,0,2020-11-10 12:18:16
