,author,author_flair_text,created_utc,retrieved_on,domain,full_link,id,is_reddit_media_domain,permalink,is_video,locked,num_comments,subreddit,subreddit_id,score,selftext,subreddit_subscribers,title,total_awards_received,updated_utc,removed_by,poll_data,post
27,OkLetterhead10,,2020-10-28 13:36:36,2020-10-28 13:36:47,self.exfds,https://www.reddit.com/r/exfds/comments/jjnuxi/it_was_hard_to_come_to_terms_with_the_fact_that_i/,jjnuxi,False,/r/exfds/comments/jjnuxi/it_was_hard_to_come_to_terms_with_the_fact_that_i/,False,False,0,exfds,t5_2hokp6,1," This [interview](https://www.theblaze.com/news/pregnant-supermodel-emily-ratajkowski-baby-gender) is shocking:

&amp;#x200B;

&gt;Ratajkowski added to her essay, ""I like the idea of forcing as few gender stereotypes on my child as possible""  
&gt;  
&gt;I've known far too many white men who move through the world unaware of their privilege, and I've been traumatized by many of my experiences with them  
And boys too; it's shocking to realize how early young boys gain a sense of entitlement — to girls' bodies and to the world in general  
How do I raise a child who learns to like themself while also teaching them about their position of power in the world?

Why they can't see the contradiction ! you can't be against gender stereotypes and then perpetuate the stereotype that only men and boys are abusers and only women and girls are victims ! apparently feminists only oppose stereotypes that are harmful to women and girls (misogyny) but not stereotypes that harm men and boys (misandry)

And what about female privilige ? they still pretend that it dosn't exist ! ask a male and a female friends to call government funded domestic violence shelter and see who is the priviliged.

&amp;#x200B;

&gt;My friend who is the mother to a three-year-old boy tells me that she didn't think she cared about gender until her doctor broke the news that she was having a son. She burst into tears in her office. ""And then I continued to cry for a whole month,"" she says matter-of-factly. After a difficult birth experience, she developed postpartum depression and decided that she resented her husband more than she'd ever imagined possible. She told me she particularly hated — and she made an actual, physical list that she kept in her journal, editing it daily — how peacefully he slept. ""There is nothing worse than the undisturbed sleep of a white man in a patriarchal world.""

What is this ? gender equality ? no. this is hate. this is pure hatred against men and boys. what caused the hate is the patriarchy theory. All feminists (radical, liberal and intersectional) support the patriarchy theory. men are considered oppressors simply for existing as men. Robin Morgan the editor of Ms Magazine the biggest feminist magazine said "" I feel that ‘man-hating’ is an honorable and viable political act, that the oppressed have a right to class-hatred against the class that is oppressing them.""

&amp;#x200B;

&gt;***It was hard to come to terms with the fact that I was bringing yet another white man into the world***. But now I adore him and can't imagine it any other way."" She also eventually learned to love her husband again. The sound of his perfect sleep next to her at night is now tolerable.

You can't believe in feminism (radical and liberal) and not hate men, boys and masculinity. and if you believe intersectional feminism the hate will also include white people too.",271,""" It was hard to come to terms with the fact that I was bringing yet another white man into the world. "" FDS are in the mainstream, why the society never hold women accountable for their hatred against men and boys ?",0,,,,0
29,PMmeYOURcovfefe,,2020-10-27 09:37:48,2020-10-27 09:37:58,self.exfds,https://www.reddit.com/r/exfds/comments/jiy272/i_love_some_things_about_fds_other_things_are/,jiy272,False,/r/exfds/comments/jiy272/i_love_some_things_about_fds_other_things_are/,False,False,30,exfds,t5_2hokp6,1,"I wanted to put this out there to get my bearings with ladies that had left the group, and really see whats what. 

Firstly, I'm married I dont need a dating strategy (... who does?). But I talk to young people alot about many things including love and relationships. FDS caught my eye because it was the first time someone else was saying something I was too which leads me to the first points Ill lay out the things I like about FDS;

1. They challenge the idea women need men (to be happy). The best dating strategy (or whatever) is to work on yourself first and then invite other people in to share your life ...if you even want that... not to try and gain happiness from another person. 
2. They are WGTOW. In an attempt to explain to me they are not WGTOW they made this idea more clear to me, I have always felt we needed a mgtow for women to deal with the first point...

Now what I dont like or at least what ruined the illusion that this was meaningful change;

1. Wgtow isnt women going there own way its literally mgtow for women that is to say, they sit around and complain about the opposite sex all the time instead of you know ...going there own way. I really dont know what I expected. mgtow and wgtow are birds in a cage with the door open talking about flying away when they could just fly away instead.
2. The misogyny. This is the first thing I noticed that sowed the seeds of discontent for me. Fair enough they hate men and whatever like their hot takes are adorable and tired and not revolutionary at all, but the hatred they spew for pickmes and non-FDS is unacceptable. Pickmes and whatever else need to be viewed with charity and patience.
3. Eugenics. Female sexual selection may be important and may be good. But, eugenics is a giant red flag. Unacceptable. Any doctrine with eugenics in it is automatically unacceptable, giant red flags with white circles and black swastika territory. Yes free speech is a thing, yes debate is a thing yes we can have a discussion about eugenics - conveinently its already been had and won not by the pro-eugenics side. There was even a war involved in that discussion, like the largest war in all history. Like holy fuck. Pro-eugenic rhetoric the whole thing, that was the fuck this I'm out point. Their inability to accept things like men with disability leads me to wonder what they would think of women with disabilties for example.
3. The lgbt-phobia, I am not a hvm, or a hvw, im not trying to be, im trying to be a good person. Their disallowance of alternative gender expression and male lgbt culture is not congruent with basic human decency and leads to to question how they treat lgbt women - not as well as they could afaik

I might be off the mark here, but something that started out so promising just had the ass fall out of it for me, Im so dissapointed in the movement and in myself for getting my hopes up.

Given this and any other feedback I can gain from you guys I wanna lay out what an acceptable format of FDS might look like.",264,"I love some things about FDS, other things... are kinda icky",0,,,,0
32,IrritatedMango,,2020-10-24 11:15:16,2020-10-24 11:15:26,self.exfds,https://www.reddit.com/r/exfds/comments/jh7875/randomly_got_banned_from_fds_for_possibly/,jh7875,False,/r/exfds/comments/jh7875/randomly_got_banned_from_fds_for_possibly/,False,False,45,exfds,t5_2hokp6,1,"I've been on FDS for about a year and the sub helped me become a lot more confident with things like being more assertive, how to be more comfortable being alone and how to avoid being strung along (which has been great). I've not always agreed with every single thing (the idea of the man providing has always made me quite uncomfortable) and I encountered a few rays of sunshine (""You're gonna get date raped if you continue like this""). I always ignored comments like these and did my own thing.

Anyway about two days ago there was a thread about sex workers and I mentioned that some of them might not necessarily have the resources to find other jobs (I have a sociology qualification where I researched about the sex industry and why women can't get out of it so I like to think I know a decent amount). I was attacked for that. I mentioned minimum wage jobs might not necessarily help single mothers because of extra costs like childcare and medication. Got attacked for that as well despite me saying I didn't support the conditions sex workers are in. I consider myself a huge feminist but I do also think if you're not willing to support all kinds of women, you're not really a feminist at all. 

This morning I get a message saying I've been permanently banned from the sub. I have no clue why but the more I think about it the more I can't help wondering if it was because of that comment. Has anyone else had this?",235,Randomly got banned from FDS for possibly defending sex workers?,0,,,,0
39,IWishIWasDead19,,2020-11-21 06:53:48,2020-11-21 06:53:59,self.exfds,https://www.reddit.com/r/exfds/comments/jy6fwv/thank_you/,jy6fwv,False,/r/exfds/comments/jy6fwv/thank_you/,False,False,2,exfds,t5_2hokp6,1,"Guy here, just saying thanks for making this place.",368,Thank you,0,,,,0
40,Ingrowntoenailsyummy,,2020-11-21 00:29:22,2020-11-21 00:29:33,self.exfds,https://www.reddit.com/r/exfds/comments/jy117b/i_want_to_make_another_reddit_account_to_post_on/,jy117b,False,/r/exfds/comments/jy117b/i_want_to_make_another_reddit_account_to_post_on/,False,False,7,exfds,t5_2hokp6,1,"I got banned for no reason so now I just wanna spam them for fun. Give me some post ideas.
So far I have;
- Pickmeisha success story 
Ill title it “My FDS success story”, but actually do all the things a pickmeisha would do 😂

- weird kinky sexual stuff
“If a man doesn’t xyz to you, he’s not a HVM”
Xyz can be “suck ur toes” etc... 

- my level up story (pickmeisha style) 
Another success story of being a girl that turns heads, but is actually a pickmeisha. 

- lesbian/trans FDS story",367,I want to make another Reddit account to post on FDS,0,,,,0
45,clefairy143,,2020-11-19 18:28:31,2020-11-19 18:56:37,self.exfds,https://www.reddit.com/r/exfds/comments/jx87ro/for_all_this_reversebragging_about_bad_sex_in/,jx87ro,False,/r/exfds/comments/jx87ro/for_all_this_reversebragging_about_bad_sex_in/,False,False,2,exfds,t5_2hokp6,1,"i mean, that's already kinda proven via various studies. 

let's face it, with all the slutshaming around, it's just impossible for a more conservative woman to learn about their own bodies, so what can you expect from strangers? 

i've heard so many stories of bad sex, women literally just lay there and be totally passive.

another thing is that, people are just not supposed to click sexually. and sometimes you just don't and that's ok. that does not make them a bad person. that could mean a lot of different things. not everyone is supposed to have sexual chemistry with you. and even if they are genuinely bad at sex, that does not make them a bad person, or low quality. no one wants to be bad at sex. that's why people date, to check for sexual chemistry, because sex is a huge part of relationship and can be a source of tension. 

not to mention that you're just as responsible for your own orgasm, if not more, than your partner. i've been with a lot of guys and so far none of them have been selfish or refused to do what i ask of them. most of them seem to prioritize me more and put myself first during sex. it makes me wonder what kind of men FDS women have been seeing. could it be maybe they treat sex as some kind of test to see how this guy would do and treat it like some kind of test and again fall into the self fulfilling prophecy syndrome? i mean, there are many comments there literally talking about how they will not tell men this or that or give them clues, and proudly saying they will not reciprocate. girl, that sounds like you're setting this up for failure anyways so maybe don't be so shocked. 

idk, maybe  try masturbating while watching some gay porn, maybe that will teach you that good sex require work.",348,"for all this reverse-bragging about bad sex in r/fds, can we just admit that straight people are just bad at sex, and part of that is because of all of the slut shaming and how women often forbid themselves from exploring and understanding their sexuality.",0,,,,0
46,clefairy143,,2020-11-17 10:40:07,2020-11-17 20:09:17,self.exfds,https://www.reddit.com/r/exfds/comments/jvqwf3/the_way_that_we_tell_women_not_to_pursue_good_men/,jvqwf3,False,/r/exfds/comments/jvqwf3/the_way_that_we_tell_women_not_to_pursue_good_men/,False,False,2,exfds,t5_2hokp6,12,"FDS users say they have all the options and therefore they have power to choose.

well kinda, i guess it goes without saying that straight men don't usually get matches on tinder as opposed to women who always get unwanted attention. but   hot men with high prospects do, and they have options here too, even more so than an average woman, because ultimately, by the way that they operate, it's the men who eventually chooses. 

tbh i haven't think about it like this before because dating has been fun and easy to me. but  you can't seriously think that when all the men who has pursued you are bad, it's not because you haven't done any active decision in choosing a man and then go through the same pattern again. lol.",344,the way that we tell women not to pursue good men because good men will do the pursuing and then get mad when we are pursued by bad men is quite funny.,0,,,,0
47,bossbabekaren2point0,,2020-11-15 18:32:40,2020-11-16 10:45:22,self.exfds,https://www.reddit.com/r/exfds/comments/juqqgo/welp_just_got_banned_and_muted_for_saying_i_watch/,juqqgo,False,/r/exfds/comments/juqqgo/welp_just_got_banned_and_muted_for_saying_i_watch/,False,False,52,exfds,t5_2hokp6,12,"You know the type of acting that is almost on the same level as The Room. Got downvoted to hell, but I didn’t really care; it’s reddit, so it’s expected. Woke up today to find I was muted for 3 days and perma banned. Tbh, I’m surprised I didn’t get banned earlier when defending a sex worker, because apparently they think all women live in first world countries and have the same opportunities as each other. 

I knew they were a bit hive minded, but imagine banning someone who doesn’t think the same way you do. I joined the group because it’s exclusively for women and has some good memes/provides insight, but a lot of their posts and mindsets just really feel toxic. Are there any other groups like this that are less.... like them?",345,Welp just got banned and muted for saying I watch p0rn with crappy acting/for women yesterday.,0,,,,0
51,clefairy143,,2020-11-14 06:50:29,2020-11-14 06:50:40,self.exfds,https://www.reddit.com/r/exfds/comments/jtxkk3/not_sure_who_needs_to_hear_this_but_your/,jtxkk3,False,/r/exfds/comments/jtxkk3/not_sure_who_needs_to_hear_this_but_your/,False,False,10,exfds,t5_2hokp6,1,"reading FDS made me realize a lot of tips given are just doomed to failure. FDS women typically suffer self fulfilling prophecy syndrome. 

they insist males to fulfill 100% physical labor but refuse any emotional labor. I mean how narcissistic are you to think that's a labor like it's billable. 

and being high strung and keeping scores  with all  the brainwashing that happens in r/FDS , are just proof of emotional baggage which demands emotional labor from your partner, which means you are just as much of an emotional black hole. 

this could have been solved if everyone just strives to be a normal person in a normal couple instead of looking at everything transactionally, like incels do. which explains that fds are just teaching women to be gold diggers, both figuratively and literally. if your emotional baggage is too heavy, you need a therapist, not a boyfriend, and none of your relationship will succeed.",335,not sure who needs to hear this but your emotional baggage is still an emotional labor for your partner to endure.,0,,,,0
52,Askybluesky,,2020-11-13 01:31:41,2020-11-13 01:31:52,self.exfds,https://www.reddit.com/r/exfds/comments/jt7wkz/just_got_banned_from_fds/,jt7wkz,False,/r/exfds/comments/jt7wkz/just_got_banned_from_fds/,False,False,0,exfds,t5_2hokp6,1,"Not sure why, but this list of spicy posts might explain my fall from grace, from a beloved sub that is part Solana’s infamous SCUM Manifesto + 1995 dating guide The Rules.

\- I called out a user who said men’s legs are hairy and ugly, and that men’s bodies were ugly. 😯 That’s not nice. I love men’s legs. I asked if he should shave them for her. probably flagged the police. 🚨 

\- I said his legs are muscular. A self proclaimed fitness person said actually they are fat legs. wups.

\- I asked if the sub was terf 🚨 👮‍♀️ in response to some sourceless statistics shared by a terf tumblr account. This post got cancelled shortly after my comment. I cant find any declarations on trans people on FDS and realized, wow I don’t know if this is legit. maybe I’m dumb for not realizing how pseudo terf the operation is. if this is the case, they are skating on thin ice skirting hate speech to our trans sisters.

\- I questioned whether it was a big deal if your gift was something you went out and bought yourself with money gifted to you, versus something a guy went and picked out for you and bought.

\- I said I don’t let guys buy me clothes because they never get me what I want, and I like picking it out.

\- “He can look up your size, or go on your Pinterest, he has no excuse not to find you nice clothes! A gift card, cmon. (I actually agree, yeah)

\- I said I wasn’t gifty and people in my family never bought gifts and literally just chilled on xmas, and were there for each other year round.. and made extra careful to say After, “but buying gifts is important and good, and Im trying to come at you from a perspective that explains where some women are coming from.“ because this is what I believe, but maybe came off as insincere.

\- a user said in response to my downvoted non gifty comment, that her dad bought her mom designer stuff Every year. 💅  like sassily..  I said mine didn’t do that and my mom doesn’t want designer shoes or bags or rings from my dad, but gets support writing books, and I grew up thinking that it was trashy and bad to ask men for stuff, but am growing out of it and learning to appreciate material stuff bc FDS, and de-program that inside of me......... and i think they hit the eject button.

hm maybe that sounds bad, maybe that was it. 

i would always try to bring the topic back to FDS, if there was dissonance, and affirm,

 “but I am not saying this to deny the ideology, x is important” 

or “i used to x, but I have changed since”, 

or “but this can offer perspective as to why some women are in x position” 

but it’s a lot of work to curate posts to a thin skinned group of people who may be running a hate speech sub, akin to somehow mashing the a SCUM manifesto into The Rules. (which is why I love FDS  💕)

  
Honestly, it was a good time, and some of the advice is actually very solid, so it’s really a shame. 🤷‍♀️   


Anyways im free to Devolve into pickmeisha trash who doesn’t ask for designer purses and likes men’s hairy ugly bodies, and loves her trans sisters and brothers.",329,Just got banned from FDS,0,,,,0
54,pakkyun,,2020-11-12 11:35:11,2020-11-12 11:35:22,self.exfds,https://www.reddit.com/r/exfds/comments/jst4d9/fds_was_what_helped_me_escape_a_dangerous/,jst4d9,False,/r/exfds/comments/jst4d9/fds_was_what_helped_me_escape_a_dangerous/,False,False,15,exfds,t5_2hokp6,1,"Several months ago I discovered FDS by chance. It helped me to realize I was not safe - I got involved in a dangerous grooming situation in which I was manipulated into an eventually sexually and financially exploitative long distance relationship thru reddit.

 I used the vetting advice and other tips to help detect his abusive behavior bc I have grown up in a dysfunctional family and have a hard time knowing when I am being mistreated. It ended up being beneficial and I sucessfully cut contact with my abuser. 

However, I noticed I went from reading the sub multiple times a day to just a few times a week in the last month or so. Thinking of reading the sub makes me uncomfortable. 

Realizing that I am single again and can have a relationship with a woman for the first time is very exciting. I also have  been trying to come to terms with my non binary identity. Since I was a toddler I have felt like I am NOT a man and NOT a woman. Now that I am no longer engaging in compulsory heterosexuality I feel a strong desire to express my androgyny freely. 

However, I'm suddenly being hit with thoughts that my feelings cant be real. That I'm some flavour of pickme or I am trying to erase womanhood or I'm rejecting femininity bc a LVM has left me bitter. 

I struggle with several mental illnesses and am prone to self harm, and I am starting to internalize the transphobia I read on the sub and I want to cut myself because of it. 

I feel so hurt and confused at the moment. I would love to hear from other LGBT+ ex-fdsers.",324,"FDS was what helped me escape a dangerous relationship, but now that I am trying to come to terms with my LGBT identity, its making me hate myself",0,,,,0
