author,author_created_utc,author_flair_css_class,author_flair_text,author_fullname,created_utc,domain,full_link,id,is_self,media_embed,num_comments,over_18,permalink,score,selftext,subreddit,subreddit_id,thumbnail,title,url,edited,media,link_flair_css_class,link_flair_text
haywire,1181841809.0,,,t2_1yfky,1333540845,brightonfeministcollective.org.uk,https://www.reddit.com/r/feminisms/comments/rsqym/brighton_feminist_collective_present_reclaim_the/,rsqym,False,{},0,False,/r/feminisms/comments/rsqym/brighton_feminist_collective_present_reclaim_the/,0,,feminisms,t5_2qhba,http://e.thumbs.redditmedia.com/dtf4j3v3-vgCES9R.jpg,"Brighton Feminist Collective Present: Reclaim the Dancefloor with four awesome bands...TOM MILSOM, BUFFALO PIN, TWINKLE AND THE SLUTS, and FEVER DREAM (The Blind Tiger, Thursday 8.30PM) !!",http://www.brightonfeministcollective.org.uk/event/reclaim-the-dancefloor,,,,
[deleted],,,,,1333538547,thelastpsychiatrist.com,https://www.reddit.com/r/feminisms/comments/rspzs/the_last_psychiatrist_whats_wrong_with_the_hunger/,rspzs,False,{},8,False,/r/feminisms/comments/rspzs/the_last_psychiatrist_whats_wrong_with_the_hunger/,1,,feminisms,t5_2qhba,default,The Last Psychiatrist: What's Wrong With The Hunger Games Is What No One Noticed. Let's see how smart y'all are.,http://thelastpsychiatrist.com/2012/04/whats_wrong_with_the_hunger_ga_1.html,,,,
Gmoney23,1333511615.0,,,t2_7cnxq,1333512610,egotastic.com,https://www.reddit.com/r/feminisms/comments/rsdje/nom_nom_nom/,rsdje,False,{},0,False,/r/feminisms/comments/rsdje/nom_nom_nom/,0,,feminisms,t5_2qhba,default,nom nom nom,http://egotastic.com/,,,,
wavesofglass,1327614105.0,,,t2_6rg6u,1333507194,self.feminisms,https://www.reddit.com/r/feminisms/comments/rs8z0/mylifeisbronot_chill_or_funny/,rs8z0,True,{},1,False,/r/feminisms/comments/rs8z0/mylifeisbronot_chill_or_funny/,1,,feminisms,t5_2qhba,default,"MyLifeIsBro-not ""chill"" or funny...",http://www.reddit.com/r/feminisms/comments/rs8z0/mylifeisbronot_chill_or_funny/,,,,
SarahLee,1198804532.0,,,t2_324xg,1333504518,huffingtonpost.com,https://www.reddit.com/r/feminisms/comments/rs6jv/planned_parenthood_turns_down_500000_from_tucker/,rs6jv,False,{},32,False,/r/feminisms/comments/rs6jv/planned_parenthood_turns_down_500000_from_tucker/,31,,feminisms,t5_2qhba,http://c.thumbs.redditmedia.com/JLUE99HvvGEvDMxt.jpg,"Planned Parenthood Turns Down $500,000 From Tucker Max",http://www.huffingtonpost.com/2012/04/03/planned-parenthood-tucker-max-donation_n_1399396.html,,,,
[deleted],,,,,1333500858,self.feminisms,https://www.reddit.com/r/feminisms/comments/rs3az/tucker_maxs_failed_stunt/,rs3az,True,{},0,False,/r/feminisms/comments/rs3az/tucker_maxs_failed_stunt/,1,"Also, a question: should they have rejected a donation of such largesse in light of the good the money could have done? ",feminisms,t5_2qhba,default,Tucker Max's Failed Stunt,http://www.reddit.com/r/feminisms/comments/rs3az/tucker_maxs_failed_stunt/,,,,
[deleted],,,,,1333492554,ihatewomen.com,https://www.reddit.com/r/feminisms/comments/rrw7x/women_hating_on_women_there_is_a_fucking_website/,rrw7x,False,{},1,False,/r/feminisms/comments/rrw7x/women_hating_on_women_there_is_a_fucking_website/,0,,feminisms,t5_2qhba,default,Women hating on women. There is a fucking website. ,http://www.ihatewomen.com/,,,,
[deleted],,,,,1333487804,self.feminisms,https://www.reddit.com/r/feminisms/comments/rrrys/starting_a_gender_and_sexuality_center_at_my/,rrrys,True,{},0,False,/r/feminisms/comments/rrrys/starting_a_gender_and_sexuality_center_at_my/,1,"I'm helping to start a gender and sexuality center at my university, and I'm looking for books, documentaries, zines, etc exploring gender and human sexuality.  Looking for material that is ground-breaking, up-to-date, and well written.",feminisms,t5_2qhba,default,"Starting a gender and sexuality center at my university, what are some good educational resources?",http://www.reddit.com/r/feminisms/comments/rrrys/starting_a_gender_and_sexuality_center_at_my/,,,,
MercuryChaos,1207243812.0,,,t2_34cxm,1333473087,time.com,https://www.reddit.com/r/feminisms/comments/rrf0n/cecile_richards_president_of_planned_parenthood/,rrf0n,False,{},3,False,/r/feminisms/comments/rrf0n/cecile_richards_president_of_planned_parenthood/,110,,feminisms,t5_2qhba,http://a.thumbs.redditmedia.com/GSiOGgyRMLGv5rSB.jpg,Cecile Richards (president of Planned Parenthood) is on the list of nominees for Time Person of the Year.,"http://www.time.com/time/specials/packages/article/0,28804,2107952_2107953_2109558,00.html",,,,
bswen,1179417201.0,,,t2_1rgnx,1333469719,rhrealitycheck.org,https://www.reddit.com/r/feminisms/comments/rrc7h/arizona_legislators_trying_to_declare_pregnancy/,rrc7h,False,{},2,False,/r/feminisms/comments/rrc7h/arizona_legislators_trying_to_declare_pregnancy/,27,,feminisms,t5_2qhba,http://c.thumbs.redditmedia.com/N70mZSMN3CmIYGGt.jpg,Arizona Legislators Trying To Declare Pregnancy Two Weeks Prior To Conception | RH Reality Check,http://www.rhrealitycheck.org/article/2012/04/01/arizona-legislators-trying-to-declare-pregnancy-two-weeks-prior-to-conception,,,,
FeministSpeakerTW,1333466351.0,,,t2_7cgkr,1333467997,self.feminisms,https://www.reddit.com/r/feminisms/comments/rrau7/feminism_and_ability_for_a_hostile_audience/,rrau7,True,{},13,False,/r/feminisms/comments/rrau7/feminism_and_ability_for_a_hostile_audience/,10,"Soon I will be presenting the issue of accessibility and inclusivity to a hostile audience of young computing professionals. I happen to know that this audience is hostile as it is the reason this is topic is being raised. 

Now, this sort of speaking is something I do a lot of. However, I typically have at worst a *neutral* audience. So I'm looking for your help on how to get through this. My comfort in front of groups isn't an issue; I have 20 years of being in front of an audience under my belt. What I'm looking for is:

* Facts with citation
* Advice or rhetorical jujutsu for derailing tactics (Yes, I'm very familiar with DFD, but that's not the most effective strategy)

Now, the problem I face is that I usually have an audience at least partially made up of women who can sometimes offer backup when I open it up for questions. I don't have that. This is an exclusively male audience. 

Specific derailments likely to come up:

* Marginalized groups want ""equality"" but ask for special treatment
* Whites/men/able bodied people are oppressed too because of prison and child support
* Those are edge cases we can't be expected to consider (specifically in reference to disability, race, and transgender people)

I'm posting this from a throwaway because some of the target audience know who I am on reddit.

Thanks :)",feminisms,t5_2qhba,self,Feminism and Ability for a Hostile Audience,http://www.reddit.com/r/feminisms/comments/rrau7/feminism_and_ability_for_a_hostile_audience/,,,,
reallyreallyanon,1320021824.0,,,t2_65azm,1333454145,self.feminisms,https://www.reddit.com/r/feminisms/comments/rr1vo/living_feminism/,rr1vo,True,{},18,False,/r/feminisms/comments/rr1vo/living_feminism/,18,"I am trying to start a subreddit for how to live a more ethical life in all ways - increasing equality between gender would obviously come under this. If anyone wants to go to [ethical living](http://www.reddit.com/r/ethical_living/) and make posts regarding magazines not to buy, issues to email representatives about or anything else then that would be nice :)

In particular I am hoping it can be a place for things that can be incorporated in to everyday life - perhaps the best example I can think of is when a friend printed of stickers to stick on poster adverts that sexualised women (the types at train stations etc). But anything is welcome :)",feminisms,t5_2qhba,self,Living feminism,http://www.reddit.com/r/feminisms/comments/rr1vo/living_feminism/,1.0,,,
pexax017,1308584085.0,,,t2_5egxh,1333416386,tinadupuy.com,https://www.reddit.com/r/feminisms/comments/rqgtf/purpose_driven_lies_and_gender_equality/,rqgtf,False,{},0,False,/r/feminisms/comments/rqgtf/purpose_driven_lies_and_gender_equality/,0,,feminisms,t5_2qhba,default,Purpose Driven Lies and Gender Equality,http://www.tinadupuy.com/column/purpose-driven-lies-and-gender-equality/,,,,
diana101,1332448964.0,,,t2_78nsm,1333415410,hrc.org,https://www.reddit.com/r/feminisms/comments/rqfxf/rick_santorum_hates_pink_bowling_balls/,rqfxf,False,{},5,False,/r/feminisms/comments/rqfxf/rick_santorum_hates_pink_bowling_balls/,17,,feminisms,t5_2qhba,http://f.thumbs.redditmedia.com/XbNZFexqa10GvkjG.jpg,Rick Santorum hates pink bowling balls!,http://www.hrc.org/press-releases/entry/rick-santorum-tells-boy-not-to-use-pink-bowling-ball,,,,
cozyjamble,1237509203.0,,,t2_3f1zu,1333407001,comediva.com,https://www.reddit.com/r/feminisms/comments/rq8io/the_war_on_women_drinking_game/,rq8io,False,{},0,False,/r/feminisms/comments/rq8io/the_war_on_women_drinking_game/,1,,feminisms,t5_2qhba,http://e.thumbs.redditmedia.com/0XJIN9Lxjty5cmIv.jpg,The War On Women Drinking Game!,http://www.comediva.com/war-on-women-drinking-game,,,,
shallah,1220919695.0,,,t2_38lau,1333400764,tpmmuckraker.talkingpointsmemo.com,https://www.reddit.com/r/feminisms/comments/rq304/bomb_explodes_at_wi_planned_parenthood/,rq304,False,{},0,False,/r/feminisms/comments/rq304/bomb_explodes_at_wi_planned_parenthood/,5,,feminisms,t5_2qhba,http://c.thumbs.redditmedia.com/zQJgE5tX-uwK3xfb.jpg,Bomb Explodes At WI Planned Parenthood,http://tpmmuckraker.talkingpointsmemo.com/2012/04/homemade_bomb_explodes_at_planned_parenthood_offic.php?ref=fpb,,,,
MissCherryPi,1253492866.0,,,t2_3n1uy,1333387014,nytimes.com,https://www.reddit.com/r/feminisms/comments/rpr45/scotus_approves_stripsearches_for_any_offense/,rpr45,False,{},0,False,/r/feminisms/comments/rpr45/scotus_approves_stripsearches_for_any_offense/,1,,feminisms,t5_2qhba,default,SCOTUS Approves Strip-Searches for Any Offense,http://www.nytimes.com/2012/04/03/us/justices-approve-strip-searches-for-any-offense.html,,,,
matriarchy,1326271261.0,,,t2_6mxys,1333384679,bloomberg.com,https://www.reddit.com/r/feminisms/comments/rpp96/female_cfos_in_us_paid_less_than_men_study_finds/,rpp96,False,{},0,False,/r/feminisms/comments/rpp96/female_cfos_in_us_paid_less_than_men_study_finds/,0,,feminisms,t5_2qhba,http://c.thumbs.redditmedia.com/2tahsXTWC7Sku2fP.jpg,"Female CFOs in U.S. Paid Less Than Men, Study Finds - Bloomberg",http://www.bloomberg.com/news/2012-04-02/female-cfos-in-u-s-paid-16-less-than-men-study-finds.html,,,,
SarahLee,1198804532.0,,,t2_324xg,1333371700,msmagazine.com,https://www.reddit.com/r/feminisms/comments/rpfxx/at_11th_hour_georgia_passes_women_as_livestock/,rpfxx,False,{},20,False,/r/feminisms/comments/rpfxx/at_11th_hour_georgia_passes_women_as_livestock/,116,,feminisms,t5_2qhba,http://a.thumbs.redditmedia.com/c_r6_M6GXBUKOM-T.jpg,"At 11th Hour, Georgia Passes “Women as Livestock” Bill",http://msmagazine.com/blog/blog/2012/03/31/at-11th-hour-georgia-passes-women-as-livestock-bill/,,,,
[deleted],,,,,1333309229,youtube.com,https://www.reddit.com/r/feminisms/comments/rod3a/womens_health_expert_tim_jones_my_fathers_a/,rod3a,False,"{'content': '&lt;iframe width=""600"" height=""338"" src=""http://www.youtube.com/embed/EnZNAFlSQKY?fs=1&amp;feature=oembed"" frameborder=""0"" allowfullscreen&gt;&lt;/iframe&gt;', 'height': 338, 'scrolling': False, 'width': 600}",0,False,/r/feminisms/comments/rod3a/womens_health_expert_tim_jones_my_fathers_a/,15,,feminisms,t5_2qhba,default,"Women's Health Expert Tim Jones: ""My father's a veterinarian, I grew up in operating rooms."" - House Majority Leader Tim Jones (R-Eureka, Missouri)",http://www.youtube.com/watch?feature=player_embedded&amp;v=EnZNAFlSQKY,,"{'oembed': {'author_name': 'firedupmo', 'author_url': 'http://www.youtube.com/user/firedupmo', 'description': 'JonesVet', 'height': 338, 'html': '&lt;iframe width=""600"" height=""338"" src=""http://www.youtube.com/embed/EnZNAFlSQKY?fs=1&amp;feature=oembed"" frameborder=""0"" allowfullscreen&gt;&lt;/iframe&gt;', 'provider_name': 'YouTube', 'provider_url': 'http://www.youtube.com/', 'thumbnail_height': 360, 'thumbnail_url': 'http://i2.ytimg.com/vi/EnZNAFlSQKY/hqdefault.jpg', 'thumbnail_width': 480, 'title': 'Women\'s Health Expert Tim Jones: ""My father\'s a veterinarian, I grew up in operating rooms.""', 'type': 'video', 'url': 'http://www.youtube.com/watch?v=EnZNAFlSQKY', 'version': '1.0', 'width': 600}, 'type': 'youtube.com'}",,
yyeass,1329936615.0,,,t2_6zq1a,1333267927,awkwardfeministmoments.tumblr.com,https://www.reddit.com/r/feminisms/comments/rnojr/that_awkward_moment_when/,rnojr,False,{},10,False,/r/feminisms/comments/rnojr/that_awkward_moment_when/,57,,feminisms,t5_2qhba,http://f.thumbs.redditmedia.com/jbocRvIX3c_o89Ik.jpg,That awkward moment when...,http://awkwardfeministmoments.tumblr.com/,,,,
shallah,1220919695.0,,,t2_38lau,1333226773,youtube.com,https://www.reddit.com/r/feminisms/comments/rmte4/personhood_usa_lawyer_says_rape_victims_are/,rmte4,False,"{'content': '&lt;iframe width=""600"" height=""338"" src=""http://www.youtube.com/embed/Tud1QRV6jy0?fs=1&amp;feature=oembed"" frameborder=""0"" allowfullscreen&gt;&lt;/iframe&gt;', 'height': 338, 'scrolling': False, 'width': 600}",2,False,/r/feminisms/comments/rmte4/personhood_usa_lawyer_says_rape_victims_are/,3,,feminisms,t5_2qhba,http://a.thumbs.redditmedia.com/nRP3GnHIdqWIK8zT.jpg,Personhood USA Lawyer Says Rape Victims Are Protected by Having Their Rapist's Baby (2011),http://www.youtube.com/watch?v=Tud1QRV6jy0,,"{'oembed': {'author_name': 'housebill587', 'author_url': 'http://www.youtube.com/user/housebill587', 'description': ""Personhood USA Lawyer Rebecca Kiessling tries to tell the committee that if they really cared about rape victims they would take MORE power away from her and force her to have her rapist's baby. Comments have been removed due, in part, to people making statements that could be construed as attacking rape victims. We think that's disgusting, and want to avoid ad hominem attacks against anyone."", 'height': 338, 'html': '&lt;iframe width=""600"" height=""338"" src=""http://www.youtube.com/embed/Tud1QRV6jy0?fs=1&amp;feature=oembed"" frameborder=""0"" allowfullscreen&gt;&lt;/iframe&gt;', 'provider_name': 'YouTube', 'provider_url': 'http://www.youtube.com/', 'thumbnail_height': 360, 'thumbnail_url': 'http://i1.ytimg.com/vi/Tud1QRV6jy0/hqdefault.jpg', 'thumbnail_width': 480, 'title': ""Personhood USA Lawyer Says Rape Victims Are Protected by Having Their Rapist's Baby"", 'type': 'video', 'url': 'http://www.youtube.com/watch?v=Tud1QRV6jy0', 'version': '1.0', 'width': 600}, 'type': 'youtube.com'}",,
SarahLee,1198804532.0,,,t2_324xg,1333220820,rhrealitycheck.org,https://www.reddit.com/r/feminisms/comments/rmp0s/missouri_legislator_qualified_to_legislate_womens/,rmp0s,False,{},2,False,/r/feminisms/comments/rmp0s/missouri_legislator_qualified_to_legislate_womens/,19,,feminisms,t5_2qhba,default,"Missouri Legislator: Qualified To Legislate Women's Health Because ""My Father Was a Veterinarian"" ",http://www.rhrealitycheck.org/article/2012/03/29/missouri-legislator-feel-qualified-to-legislate-womens-health-because-my-father-w,,,,
SarahLee,1198804532.0,,,t2_324xg,1333208777,theatlanticwire.com,https://www.reddit.com/r/feminisms/comments/rmgoj/it_left_the_victim_and_others_wondering_what_it/,rmgoj,False,{},8,False,/r/feminisms/comments/rmgoj/it_left_the_victim_and_others_wondering_what_it/,34,,feminisms,t5_2qhba,http://a.thumbs.redditmedia.com/CqrmCu8e4YZgg7Ff.jpg,"""It... left the victim and others wondering what it takes to convict somebody of rape in this town.""",http://www.theatlanticwire.com/national/2012/03/new-york-does-convict-rapists-they-dont-make-front-page/50516/,,,,
Qwill2,1280253713.0,,,t2_47n3m,1333192674,logosjournal.com,https://www.reddit.com/r/feminisms/comments/rm9ue/marcuses_and_fromms_correspondence_with_the/,rm9ue,False,{},0,False,/r/feminisms/comments/rm9ue/marcuses_and_fromms_correspondence_with_the/,4,,feminisms,t5_2qhba,http://b.thumbs.redditmedia.com/ohAaOiIRGkmjNFqs.jpg,Marcuse’s and Fromm’s Correspondence with the Socialist Feminist Raya Dunayevskaya: A New Window on Critical Theory (x-posted from r/HistoryofIdeas),http://logosjournal.com/2012/winter_anderson/,,,,
mcspocky,1321317330.0,,,t2_68t02,1333155332,thinkprogress.org,https://www.reddit.com/r/feminisms/comments/rlrxw/ecbc_emergency_contraception_is_birth_control_not/,rlrxw,False,{},5,False,/r/feminisms/comments/rlrxw/ecbc_emergency_contraception_is_birth_control_not/,46,,feminisms,t5_2qhba,default,"EC=BC: Emergency Contraception Is Birth Control, Not Abortion",http://thinkprogress.org/health/2012/03/30/454446/ecbc-emergency-contraception-is-birth-control-not-abortion/,,,,
haywire,1181841809.0,,,t2_1yfky,1333155245,youtube.com,https://www.reddit.com/r/feminisms/comments/rlrvw/footage_from_prochoice_demo_at_bedford_square/,rlrvw,False,"{'content': '&lt;iframe width=""600"" height=""338"" src=""http://www.youtube.com/embed/N-b7ZOBD7nM?fs=1&amp;feature=oembed"" frameborder=""0"" allowfullscreen&gt;&lt;/iframe&gt;', 'height': 338, 'scrolling': False, 'width': 600}",1,False,/r/feminisms/comments/rlrvw/footage_from_prochoice_demo_at_bedford_square/,1,,feminisms,t5_2qhba,http://a.thumbs.redditmedia.com/GbqHL2SlUGQBG_7f.jpg,Footage from Pro-Choice demo at Bedford Square,http://www.youtube.com/watch?v=N-b7ZOBD7nM,,"{'oembed': {'author_name': 'tooleh', 'author_url': 'http://www.youtube.com/user/tooleh', 'description': 'With Brighton Feminist Collective, Brighton Pro-Choice, Bloomsbury Pro-Choice and a bunch of insane anti-choice creepers http://www.brightonfeministcollective.org.uk', 'height': 338, 'html': '&lt;iframe width=""600"" height=""338"" src=""http://www.youtube.com/embed/N-b7ZOBD7nM?fs=1&amp;feature=oembed"" frameborder=""0"" allowfullscreen&gt;&lt;/iframe&gt;', 'provider_name': 'YouTube', 'provider_url': 'http://www.youtube.com/', 'thumbnail_height': 360, 'thumbnail_url': 'http://i3.ytimg.com/vi/N-b7ZOBD7nM/hqdefault.jpg', 'thumbnail_width': 480, 'title': 'Pro Choice Demo @ Bedford Square', 'type': 'video', 'url': 'http://www.youtube.com/watch?v=N-b7ZOBD7nM', 'version': '1.0', 'width': 600}, 'type': 'youtube.com'}",,
thatjessiecat,1326288916.0,,,t2_6mzed,1333120972,xojane.com,https://www.reddit.com/r/feminisms/comments/rl0g0/no_beauty_mistake_has_ever_turned_a_man_off_xojane/,rl0g0,False,{},17,False,/r/feminisms/comments/rl0g0/no_beauty_mistake_has_ever_turned_a_man_off_xojane/,48,,feminisms,t5_2qhba,http://a.thumbs.redditmedia.com/c-sM40Bdy241KL16.jpg,No Beauty Mistake Has Ever Turned a Man Off  | xoJane,http://www.xojane.com/beauty/no-beauty-mistake-has-ever-turned-man,,,,
[deleted],,,,,1333057681,motherjones.com,https://www.reddit.com/r/feminisms/comments/rjwmc/house_gop_rape_prevention_measures_an/,rjwmc,False,{},0,False,/r/feminisms/comments/rjwmc/house_gop_rape_prevention_measures_an/,8,,feminisms,t5_2qhba,http://e.thumbs.redditmedia.com/TTCiPHhpIkDyBr3p.jpg,House GOP: Rape Prevention Measures an Unreasonable Luxury,http://motherjones.com/mojo/2012/03/gop-preventing-immigrant-rape-ice-holiday,,,,
[deleted],,,,,1333051077,washingtonpost.com,https://www.reddit.com/r/feminisms/comments/rjqkn/syrian_uprising_imam_tells_rape_victims_they/,rjqkn,False,{},0,False,/r/feminisms/comments/rjqkn/syrian_uprising_imam_tells_rape_victims_they/,1,,feminisms,t5_2qhba,default,Syrian uprising: Imam tells rape victims they deserve to be honored - The Washington Post,http://www.washingtonpost.com/blogs/blogpost/post/syrian-uprising-imam-tells-rape-victims-they-deserve-to-be-honored/2012/03/28/gIQAewdEhS_blog.html,,,,
Ygdrowen,1319405515.0,,,t2_63q5k,1333047438,imgur.com,https://www.reddit.com/r/feminisms/comments/rjn5u/this_is_in_a_swedish_magazine_with_kids_toys/,rjn5u,False,{},3,False,/r/feminisms/comments/rjn5u/this_is_in_a_swedish_magazine_with_kids_toys/,9,,feminisms,t5_2qhba,http://b.thumbs.redditmedia.com/kfV4_FUF8aWbSIGy.jpg,This is in a swedish magazine with kid's toys!,http://imgur.com/oS4bd,,,,
JulianMorrison,1153260242.0,,,t2_afom,1333038620,pandagon.net,https://www.reddit.com/r/feminisms/comments/rjf5q/misogyny_isnt_caused_by_male_horniness/,rjf5q,False,{},27,False,/r/feminisms/comments/rjf5q/misogyny_isnt_caused_by_male_horniness/,39,,feminisms,t5_2qhba,http://f.thumbs.redditmedia.com/6RfqyTNZRDvvWFWY.jpg,Misogyny isn’t caused by male horniness,http://pandagon.net/index.php/site/misogyny-isnt-caused-by-male-horniness,,,,
[deleted],,,,,1333038001,washingtonpost.com,https://www.reddit.com/r/feminisms/comments/rjenp/an_abortion_clinics_landlord_turns_the_tables_on/,rjenp,False,{},15,False,/r/feminisms/comments/rjenp/an_abortion_clinics_landlord_turns_the_tables_on/,191,,feminisms,t5_2qhba,http://a.thumbs.redditmedia.com/ISIeHaSkkFaiock6.jpg,An abortion clinic’s landlord turns the tables on anti-abortion protesters - The Washington Post,http://www.washingtonpost.com/local/a-clinics-landlord-turns-the-tables-on-anti-abortion-protesters/2012/03/29/gIQAThgwiS_story.html?hpid=z3,,,,
behraro,1304828861.0,,,t2_57f6w,1333037172,youtube.com,https://www.reddit.com/r/feminisms/comments/rjdzg/a_message_to_planned_parenthood_supporters_from/,rjdzg,False,"{'content': '&lt;iframe width=""600"" height=""338"" src=""http://www.youtube.com/embed/naP2FbO8_-c?fs=1&amp;feature=oembed"" frameborder=""0"" allowfullscreen&gt;&lt;/iframe&gt;', 'height': 338, 'scrolling': False, 'width': 600}",1,False,/r/feminisms/comments/rjdzg/a_message_to_planned_parenthood_supporters_from/,4,,feminisms,t5_2qhba,http://f.thumbs.redditmedia.com/qD_P2yLNuUAfUg-w.jpg,"A message to Planned Parenthood Supporters from President Obama
",http://www.youtube.com/watch?v=naP2FbO8_-c&amp;feature=youtu.be,,"{'oembed': {'author_name': 'PPVotes', 'author_url': 'http://www.youtube.com/user/PPVotes', 'description': ""President Obama knows how important women's health is, and he respects the right of every woman to make her own medical decisions. Watch the video to see his special message to Planned Parenthood Action Fund supporters -- and then sign our letter thanking him for standing strong for women's health: [LINK] Already, 20 million women have received preventive care without a co-pay because of the health care reform law."", 'height': 338, 'html': '&lt;iframe width=""600"" height=""338"" src=""http://www.youtube.com/embed/naP2FbO8_-c?fs=1&amp;feature=oembed"" frameborder=""0"" allowfullscreen&gt;&lt;/iframe&gt;', 'provider_name': 'YouTube', 'provider_url': 'http://www.youtube.com/', 'thumbnail_height': 360, 'thumbnail_url': 'http://i3.ytimg.com/vi/naP2FbO8_-c/hqdefault.jpg', 'thumbnail_width': 480, 'title': 'A message to Planned Parenthood Supporters from President Obama', 'type': 'video', 'url': 'http://www.youtube.com/watch?v=naP2FbO8_-c', 'version': '1.0', 'width': 600}, 'type': 'youtu.be'}",,
SarahLee,1198804532.0,,,t2_324xg,1332993766,thinkprogress.org,https://www.reddit.com/r/feminisms/comments/riqvm/defending_violence_against_women_act_rep_moore/,riqvm,False,{},2,False,/r/feminisms/comments/riqvm/defending_violence_against_women_act_rep_moore/,10,,feminisms,t5_2qhba,default,"Defending Violence Against Women Act, Rep. Moore Recounts Being Raped As A Child",http://thinkprogress.org/health/2012/03/28/454073/defending-vawa-rep-moore-recounts-being-raped-as-a-child/,,,,
veganfairy,1232510625.0,,,t2_3cs92,1332975880,washingtonpost.com,https://www.reddit.com/r/feminisms/comments/ribdc/adrienne_rich_feminist_poet_and_essayist_dies_at/,ribdc,False,{},10,False,/r/feminisms/comments/ribdc/adrienne_rich_feminist_poet_and_essayist_dies_at/,78,,feminisms,t5_2qhba,default,"Adrienne Rich, feminist poet and essayist, dies at age 82",http://www.washingtonpost.com/entertainment/books/son-adrienne-rich-feminist-poet-and-essayist-dies-at-age-82/2012/03/28/gIQAU7gHhS_story.html,,,,
mcspocky,1321317330.0,,,t2_68t02,1332971565,politicususa.com,https://www.reddit.com/r/feminisms/comments/ri7mr/angry_and_insulted_women_will_make_the/,ri7mr,False,{},0,False,/r/feminisms/comments/ri7mr/angry_and_insulted_women_will_make_the/,1,,feminisms,t5_2qhba,default,Angry and Insulted Women Will Make The Republicans Pay In November,http://www.politicususa.com/women-republicans-pay/?utm_source=feedburner&amp;utm_medium=feed&amp;utm_campaign=Feed:+politicususa/fJAl+(Politicus+USA+)&amp;utm_content=Google+Reader,,,,
ReaganSmashK,1330401022.0,,,t2_71c9b,1332971311,self.feminisms,https://www.reddit.com/r/feminisms/comments/ri7e1/as_a_man_my_personal_favorite_quote_from_the/,ri7e1,True,{},0,False,/r/feminisms/comments/ri7e1/as_a_man_my_personal_favorite_quote_from_the/,1,,feminisms,t5_2qhba,default,"As a man, my personal favorite quote from the original feminist movement. ",http://www.reddit.com/r/feminisms/comments/ri7e1/as_a_man_my_personal_favorite_quote_from_the/,,,,
mythofthefront,1302129522.0,,,t2_52gsh,1332958603,smbc-comics.com,https://www.reddit.com/r/feminisms/comments/rhvs3/i_think_you_might_appreciate_this/,rhvs3,False,{},2,False,/r/feminisms/comments/rhvs3/i_think_you_might_appreciate_this/,1,,feminisms,t5_2qhba,http://f.thumbs.redditmedia.com/jkYf1SDU3VEyEDRq.jpg,I think you might appreciate this...,http://www.smbc-comics.com/index.php?db=comics&amp;id=2263#comic,,,,
shallah,1220919695.0,,,t2_38lau,1332940843,news.yahoo.com,https://www.reddit.com/r/feminisms/comments/rhhlm/adopted_or_abducted_from_australia_to_spain/,rhhlm,False,{},0,False,/r/feminisms/comments/rhhlm/adopted_or_abducted_from_australia_to_spain/,31,,feminisms,t5_2qhba,http://f.thumbs.redditmedia.com/L-LkrAWirA5PTT9A.jpg,"Adopted or abducted? ""From Australia to Spain, Ireland to America, and as recent as 1987, young mothers say they were “coerced”, “manipulated”, and “duped” into handing over their babies for adoption""",http://news.yahoo.com/forced-adoptions-for-unwed-mothers-around-the-globe.html,,,,
